1000676	show rabbits	Rabbit Shows 2014	Raising Show Rabbits	Rabbits for Sale	Bunnies for Sale	Rabbit Show Cages	Show Rabbits for Sale	Arba Shows 2014	Show Rabbit Breeds
1007358	Become a Green Beret	Green Beret Officer Training	Green Beret Officer Requirements	How to Join Green Berets
1007699	Make Focaccia Style Flax Bread	Focaccia Flax Bread Recipe	Low Carb Focaccia Flax Bread	Gluten Free Focaccia Flax Bread	Flax Bread Recipe	Focaccia Bread Pictures	Focaccia Style Flax Bread	Easy Focaccia Bread Recipe	How to Make Flax Bread
1008097	clean hardwood floors	Vinegar Clean Hardwood Floors	Bona Mop	Clean Hardwood Floors with Steam	How to Care for Wood Floors	Best Way Clean Hardwood Floors	Clean Hardwood Floors Naturally	Machine to Clean Hardwood Floors	Deep Clean Hardwood Floors
1008853	Eat Formally	
1009188	Get Your Facebook Page Noticed	Someone Noticed	Get Noticed Theme	Resumes That Get Noticed	Get on Your Facebook	Best Resume to Get Noticed	Have Noticed That	Get Noticed Boutique	How to Get Noticed
1010825	Bid Farewell in Russian Language	Farewell in Multiple Languages	Bid Farewell Quotes	Russian Farewell Phrases	Goodbye in Russian Farewell	A Bid Farewell Lyrics	Farewell in Different Languages	Bid Farewell Meaning
1014833	design a web site	How to Make a Website	Venture Capital Website Design	Affordable Small Business Website Design	Professional Website Design	Design Your Own Website Free	Affordable Website Design	Affordable Small Business Website D…	Small Business Website Design	Do It Yourself Website Design
1015737	Get Brass Key on RuneScape	Crystal Key Runescape	Key Ring Runescape	Runescape Bronze Key	The Brass Key
101827	Remove Undesirable ASCII Characters from a Site Created With Apple iWeb	
1019142	Stop Deer from Eating Your Plants and Trees with Soap	
1020624	make your own game	Game Creator	Video Game Maker	Build Your Own Virtual Game	Free 3D Game Maker	Create Your Hero Game	Make Your Own Roller Coaster	Make Your Own World	Make Your Own Computer Game
1021142	play with dogs	Funny Dog Games	Play Dog with a Blog	Play With Dogs Online	Puppy Games for Girls	Games for Dogs	Playing With Your Dog	Dog Games for Kids	Dog Games for Girls for Free
10215	call 9-1-1	Call 911	911 Emergency Calls	Police Calls in Your Neighborhood	Call 9 1 1 Lyrics	Somebody Call 9 1 1	Funny 9 1 1 Calls	Real 9 1 1 Calls	Police Calls by Zip Code
102638	Deal With Heat Exhaustion	Heat Exhaustion vs Heat Stroke	Lasting Effects of Heat Exhaustion	Signs of Heat Exhaustion Symptoms	Heat Exhaustion Treatment	Heat Exhaustion Definition	Tips to Prevent Heat Exhaustion	Exhaustion Definition
1026880	Teach Your Children Good Driving Skills by Example	
1027282	Be Beautiful at Seventy	
1029612	Use a Fish Finder	Humminbird 561 Fishfinder	Humminbird Fish Finders	Hummingbird Factory Outlet	Reading Hummingbird Fish Finders	Lowrance Fish Finders	Humminbird 561 Review	Humminbird 561	Humminbird Depth Finders
1031679	enjoy the life	The Enjoy Life Little Rock	Enjoy Life Leadership Academy	How to Enjoy Life More	The Enjoy Life Skate Shop	Enjoy Life Club	Enjoying My Life	Why Should We Enjoy Life	Enjoy The Life Quotes
1033040	Flirt Using Body Language (Girls)	Body Language Girl Likes You	Men Flirting Body Language	How Women Flirt Body Language	Older Women Flirt Body Language	Teen Girl Body Language	Guys Flirting Body Language	Read Body Language Flirt	Female Body Language Flirting
103358	Eat Fewer French Fries	Can Diabetics Eat French Fries	How to Make French Fries	How to Cook French Fries	Buy Frozen French Fries	Good Eats French Fries	Best French Fries	McDonald's French Fries	Frozen French Fries
103802	blend in	Blends in Words	Blends in English	Blend in Definition	What are Blends in Phonics	Blend in Spanish	Veggie Blend in	Blend in Synonym	Blend in Long Island City
1040045	Look Asiatic when You're Not	When You're Not Around	Asiatic People	Who were the Asiatics
1041196	Lime Render a Wall	
104193	tease your hair	How to Tease Hair Properly	Teased Hair Videos	How to Tease Straight Hair	YouTube How to Tease Hair	Tease Hair Salon
1044273	Recognize Cellulitis Symptoms	Cellulitis Foot	Cellulitis in Legs	Types of Cellulitis	Most Common Cause of Cellulitis	Cellulitis of Leg	Causes of Cellulitis in Adults	Cellulitis Causes Symptoms Treatment	Cellulitis of the Eye
104810	Make a Quarter Staff With PVC Pipe	Building with PVC Pipe Fittings	Build a Pipe Table	Things to Build with PVC
1048912	down load yahoo messenger	Download Yahoo Messenger Windows XP	Download Yahoo Messenger Windo…	Tango Video Chat	Download Mozilla Firefox 2014	Download Yahoo Messenger 11 for Windows 7	Yahoo Messenger for Windows 8	Download Yahoo Messenger 11 for …	Download Yahoo Messenger 10	Download Avast Free	Download Yahoo Messenger 12
104948	steal a myspace layout	Myspace Layouts 1.0	Myspace Layouts	2.0 Myspace Layouts	Hot Free Myspace Layouts
1052158	apply for medicaid	Apply GA Medicaid Online	Apply Medicaid Online	2014 Medicaid Application	Who Can Apply for Medicaid	Florida Medicaid Apply Now	Medicaid Application Form	Medicare Apply Online	Apply for Medicaid in Texas
105261	Install a Mail Slot	Mail Slots for Doors	Mail Slot System for Office	Through The Wall Mail Slots	Mail Slots for Walls	Mail Slot Organizer
1053218	Insert a Cannula	Soft Nasal Cannula	Nasal Cannulas for Oxygen
1055281	Defeat Barbarrcia in Final Fantasy IV	Final Fantasy IV Final Boss	Final Fantasy IV iOS	Final Fantasy IV PSP	Barbarian Fantasy Art	Barbarian Fantasy Movies	Final Fantasy IV Walkthrough	Fantasy Barbarian Images	Final Fantasy IV GameFAQs
105608	Put a Fancy Edge on a Pie Crust	How to Decorate Pie Crust
1062857	Buy a Wok	What Size Wok to Buy	What is the Best Wok	Buying a Wok at Target	Carbon Steel Woks for Sale	Wok Pans	Kohl's Wok	Buy Wok for Chinese Cooking	Electric Woks for Sale
1063997	Make a Hide out for Kids	Cool Hideouts	Secret Hideouts for Kids	Billy The Kid Hideout	Kids Hideout Little Falls MN	How to Make Secret Hideouts	Kids Hideout Lafayette	Kids Hideout Lafayette CA	Kids Hideout Ideas
1064414	Dress up As Ed from Ed, Edd 	Ed Edd N Eddy Anime	Ed Edd N Eddy Games	Ed Edd N Eddy DVD	LEGO Ed Edd N Eddy	Ed Edd N Eddy YouTube	Ed Edd and Eddy
1066797	practice acting	Acting Script	Play Scripts	Acting Scripts for Teens	Scripts to Practice with	Scripts for Auditions	Acting Lines	Acting Lines to Practice	Disney Audition Scripts
1066834	color hair	Hair Colors for Fall 2014	Good Summer Hair Color	Amazon Hair Color	Hair Color Chart	Wella Color Hair	Excellence Hair Color	L'Oreal Preference Hair Color	Highlights for Dark Hair
106763	storm chase	Red Bull Storm Chase	Storm Chase Vehicle Equipment	Tornado Chasing Tours	Storm Chase Videos	Tornado Chasing	Storm Chase Live	Storm Chase Game	Storm Chase Vehicles
1069014	Survive Retirement	How to Survive Retirement with No …	Surviving Your Husband's Retirement	Early Retirement	How to Survive Retirement with No Money	Military Retirement Surviving Spouse	Surviving Your Retirement	How to Survive After Retirement	How to Survive Retirement Emotionally	Senior Humor Good Jokes
1072586	buy a computer	Buy a Computer Cheap	Want to Buy a Computer	Best Buy Laptops	Places to Buy a Computer	Reasons to Buy a Computer	Buy a Computer Online	Help Me Buy a Computer	Buy a Computer Mouse
107603	find an apartment	Apartment Locators Houston	Find an Apartment in La	Apartment Finders Denver	Websites to Find an Apartment	Zillow Homes for Rent	Find an Apartment in Boston	Best Way to Find Apartments	Need to Find an Apartment
1076997	collect unemployment	Reasons You Can Collect Unemployment	Collect Unemployment in Florida	Collect Unemployment and Social Security	Unemployment Check	Apply for Unemployment Benefits	Reasons You Can Collect Unemploy…	Collect Unemployment and Social S…	Draw Unemployment	File for Unemployment	Unemployment Application
1077005	sell your wedding gown	Who Buys Old Wedding Dresses	Stores That Sell Wedding Gowns	Places to Buy Wedding Dresses	Where to Buy Wedding Dress	Used Wedding Dresses for Sale	Sell Wedding Gown for Cash	Bride to Bride Boutique	Sell Your Wedding Stuff
1078662	Pull a Prank on Mischief or Goosey Night (Halloween Eve)	
107983	express yourself	Express Your Way	Charles Wright	Charles Wright Express Yourself	Express Yourself Website	Express Yourself Lyrics	Express Yourself NWA Lyrics	Express Yourself Original Song	Express Yourself Song
108019	Ask a Lady Out If You're Shy	
1081221	open compressed files	Unzip a File	Unzip Compressed Files for Free	Free Unzip for Windows 8	Zip Files Windows 7	Open Compressed Files Windows 7	WinZip Free Download	Unzip Files Free Downloads	Free WinZip for Windows 8
1082159	Relieve Stress when Revising	Ways to Relieve Stress	Exercises to Relieve Stress	How to Relieve Stress Naturally	Pressure Points to Relieve Stress	Foods That Relieve Stress	Stress Relieve Metal	10 Ways to Relieve Stress
108340	make bagels	Recipe Bagels	Bagels	How to Make Bagel Dough	How to Make Bagel Pizza	Panera Bagels	How to Make Bagel Bites	World's Best Bagel Recipe	How to Make Bagel Chips
1084355	dress like paris hilton	Paris Hilton Dress 2014	Paris Hilton Pink Dress	Paris Hilton for Men	Hilton Hotels in Paris	Paris Hilton Sheer Dress	Paris Hilton Grammys Dress	Paris Hilton White Dress	New Paris Hilton Pictures
1084790	Appear Hygienic	
1084802	Make a Kesha Costume	Kesha Outfit	Kesha Hot	Kesha Costume at Party City	How to be Kesha for Halloween	Is Kesha A Boy	Kesha Timber Costumes	Dress Up Like Kesha
1085483	compare colleges	College Prowler Compare Colleges	Compare College Rankings	Compare Colleges Academically	Compare College ACT Scores	Compare Colleges by Major	College Matchmaker	College Comparison Chart	College Comparison Tools
1087435	make your own glitter words	Create Your Own Glitter Graphics	Graphics	Make Your Own Glitter Graphics	Make Your Own Text Graphics	Create Glitter Text	Create Your Own Glitter Text	Glitter Words	Rhinestone Text Generator
1089128	'play' '	Play Pack	Play The Settlers	Play Vegas Bingo	Pogo Play Free Online Games	Outdoor Play	Play for Tokens	Play Tiger Woods World Golf	Play Minecraft Game
1089466	Lose Weight by Doing Things You Like	Sure Thing Weight Loss	Things You Like to Do	Things You Like About Someone	Things I Like	Things You Like About People
1090547	apply for personal loans	Loans For People With Bad Credit	LendingTree	Online Applications for Personal Loans	Personal Loans With Poor Credit	Small Personal Loans	Apply for Loans Online With Bad Credit	Apply for Loans Online	Apply for Personal Loan Chase
1090555	count money	Money Counting Machine	Money Counts Software	Parsons Money Counts Software	Free Count Money Worksheets	Count Money Online	AccuBanker	Counting Money Math Games	Money Counts 9.0
10928	Become a Hair Stylist	How to be Hair Stylist	How to Become a Hairstyles	Requirements to Be A Hair Stylist	Being a Hairstylist	Become Hair Salon
1094943	Be a Scarecrow for Halloween	Spirit Halloween Scarecrow	Scary Costumes	Halloween Scarecrow Yard Display	Scarecrow Decor	Halloween Scarecrow Costume	Super Scary Costumes	Halloween Scarecrows Pictures	Scarecrow Halloween Decorations
1096701	make your own free website	How to Make a Website	Make Your Very Own Website	Make Your Own Website Free for Kids	Create a Website 100% Free	Wix Website	Make Your Own Website Free for Teens	Create Your Own Personal Website	Free Create Website for Teens	Make Your Own Website Free for Te…
1096937	Confirm the Authenticity of a Property Title	
1099968	have a party	YouTube MBE have a Party	Smarty have a Party	Let's Have A Party	Place to have a Party	Have A Party Lyrics	MBE have a Party Lyrics	Have A Party YouTube	Have A Party MBE
1102029	Apply for a Marriage License in Virginia	Apply for Marriage License PA	Marriage License in VA	Virginia Beach Marriage License Application	How to Apply Marriage License	Apply for Marriage License CA	Apply for Marriage License Ohio	Apply for Marriage License NY	Obtain Marriage License in Virginia
1102545	adopt a kitten	Adopt a Baby Kitten	Adopt a Kitten Illinois	Adopt a Kitten Free	Adopt a Cat for Free	Adopt a Kitten NJ	Free Kittens	Adopt a Kitten in Massachusetts	Kittens for Sale
1103301	organize your office	Desk Organization Products	Desk Organizers	Home Office Furniture	Office Organizer	Office Decor	Home Office Desks	Organize My Office at Work	Office Furniture
1103959	Make Bubble Blowing Tools	How to Make Bubbles	Blowing Bubbles Lyrics	Bubble Blowing Wands	Bubble Blowing Toys	History of Blowing Bubbles	Bubble Blowing Solution	Bubble Blowing Contest	Forever Blowing Bubbles
1106235	Make a Raw Vegan Brownie	Recipe for Vegan Brownies	Best Raw Brownies	Easy Raw Brownies	Raw Vegan Brownies	Vegan Brownies with Dates	Healthy Vegan Brownies	Raw Chocolate Brownie	Vegan Chocolate Brownies Recipe
1106648	get rid of birds	Bird Poison	How to Keep Pigeons away	Get Rid of Birds on Porch	How to Get Rid of Pesky Birds	Get Rid of Bird Droppings	Get Rid of Nesting Birds	Rid Birds Around My House	How to Get Rid of Sparrows
1106719	Build Muscular Strength	Muscular Strength Benefits	How to Build Muscular Legs	Muscular Build Men	Description of Muscular Strength	How to Build Muscular Arms	Muscular Strength Pictures	Muscular Strength and Endurance Workouts	Exercises to Build Muscular Endurance
1107812	send flowers	$19.99 Flowers	Same Day Flowers	Send Flowers Funeral	FTD 50% Off Code	Edible Arrangements	Online Cheap Flower Delivery	From You Flowers	Send Flowers Valentine's Day
1107815	Hold a Pick	How to Hold Guitar Pick	How to Hold A Pic	Holding Guitar Pick Correctly	First Picks Holdings LLC	How to Hold a Guitar	Holding A Guitar Pick Properly	Proper Way to Hold a Guitar	Guitar Pick Holding Technique
1108213	Smile When You Are Angry	Angry Smiley Face	Smiling When Upset	Psychology Passive Aggressive Behavior	Benign Confrontation	The Angry Smile Book	Psychology Passive Aggressive	Passive Aggressive Behavior in Families	Smile Online
1108896	apply for medi-cal	Obamacare	Apply for Medi Cal 2014	Apply for Medical Insurance Online	Apply for Medical Insurance	Medi Cal Application Enrollment Form	Apply for Medi Cal Application	Health Insurance Plans	eHealth
1114572	Have a Sleepover when You Are Grounded	Reasons to have a Sleepover	You are Grounded Meaning	Let's Have a Sleepover	You are Grounded Forever
1115517	Make Herb De Provence	What is Herbes de Provence Seasoning	Herbs de Provence Substitute	Dried Herbes de Provence	Herbs de Provence Seasoning Mix	Herbes de Provence Spice	Herbs de Provence Uses	Herbs de Provence Chicken	Cooking with Herbes de Provence
11157	Make an Oil Lamp	Scented Lamp Oil Recipe	Oil Burning Lamps	Homemade Oil Lamps with Glass Bottles	Wine Bottle Lamps	Wine Bottle Oil Lamp Kit	Olive Oil Lanterns	Wine Bottle Wick Holder	Olive Oil Lamps for Sale
1115868	Make Lavash	
1117895	Make Homemade Pom Poms	Homemade Pom Poms Crafts	How to Make Homemade Pom Poms	Make Pom Pom from Yarn	Material to Make Pom Poms	Instructions to Make Pom Poms	Homemade Pom Poms Decorations	How to Make Tissue Pom Poms	Homemade Pom Poms for Cheerleading
111838	Select a Go Kart Racing Gear Using Gears and Tires	
1118979	buy carpet	Carpet Prices	Lowe's Carpet Specials	Home Depot Carpet	Purchase New Carpet	Buy Carpet Online	Good Carpet Deals	Empire Carpet	Best Time to Buy Carpet
1118986	test for diabetes	Lab Tests for Diabetes	Blood Test for Diabetes	Self Test for Diabetes	Test for Diabetes Type 2	Symptoms of Diabetes	A1C Blood Test for Diabetes	Do I Have Diabetes Quiz	Test for Diabetes at Home
1121148	Enjoy a Visit to Goa	
1121960	Control Your World	Sonic Lost World Controls	Runescape Pest Control World	Johnson Controls World Services Inc	Craft The World Controls	World Control Conspiracy	Mind Control World Control	FIFA World Controls	The Secret World Controls
1123143	Tolerate Getting Wisdom Teeth Pulled	Getting Wisdom Teeth Pulled Awake	Getting Wisdom Teeth Pulled Recovery	Wisdom Teeth Pulled YouTube	Not Getting Wisdom Teeth Pulled	Getting Wisdom Teeth Pulled Cost	Getting Wisdom Tooth Pulled	After Getting Wisdom Teeth Pulled	Guy Gets Wisdom Teeth Pulled
1123205	cure dry hair	How to Treat Hair Loss	How to Heal Dry Hair	Brittle Hair Treatment	Best Cures for Dry Hair	Causes of Dry Hair	Hair Repair	Hair Treatment	Best Hair Treatment for Damaged Hair
1124979	Negotiate a Job Offer That Involves Relocation	Companies That Offer Relocation	Job Offer Negotiate Salary	How to Negotiate Salary Offer	Jobs That Pay for Relocation	Negotiate Job Offer Letter Sample	Decline Job Offer Relocation	Jobs That Offer Relocation Packages	Job Offer Negotiate Vacation
112607	hit a home run	Hit a Home Run Game	Baseball Games for Kids	He Hit a Home Run	Baseball Games	Baseball Games to Play	Fun Baseball Games	Hit a Home Run Meaning	MLB Games Online
1126110	Be a Reclusive Author	Living A Reclusive Lifestyle	Harper Lee Author	Reclusive Artists	D Salinger	Famous Reclusive People	Reclusive Novelist	Harper Lee Assisted Living	Reclusive Writers
1128280	decorate a livingroom	Living Room Ideas Decorating	Best Living Room Designs Pictures	Martha Stewart Living Room Ideas	Living Room Decorating Ideas Photos	Couches for Small Living Rooms	Couches	Martha Stewart Furniture	Small Living Room Design Ideas
1129308	get paid to travel	Travel Jobs Hiring	Get Paid to Vacation	How to Travel The World for Free	Free Travel Opportunities	Fun Travel Jobs Get Paid	Get Paid to Travel The World	Travel Jobs That Pay Well	Travel Jobs No Experience Necessary
1129868	download i-tunes	iTunes Install Issues	iTunes Download for Windows	iTunes Install	iTunes 64 Bit	My iTunes	iTunes Account	iTunes Music Store	Free Music Downloads
113084	Steal a Base	All Time Base Steal Leaders	Baseball Stealing Home Game	Steal Home Game	When Can You Steal Bases	Steel Base Plate	Stealing Bases in Baseball	Steal Bases Games	When to Steal in Baseball
1134177	qualify for medicaid	Qualify for Medicaid Florida	Can I Qualify for Medicaid	Medicaid Application	Qualify for Medicaid Texas	Qualify for Medicaid in Michigan	Qualify for Medicaid in Georgia	Qualify for Medicaid in Louisiana	Qualify for Medicaid Ohio
1137924	build free websites	Yahoo Build a Website Free	Free Web Hosting Sites	Google Website	Wix Website	How to Design a Website	Make a Website Completely Free	Building Your Own Website	Create a Free Website
1140091	gain flexibility	Best Stretches to Increase Flexibility	How Long to Gain Flexibility	How to Increase Flexibility	Best Way to Gain Flexibility	Yoga Body Naturals	Stretches to Increase Flexibility	Stretching	Full Body Stretching Routine
1144176	Use Your Digital Camera's ISO Setting	Best Settings for Digital Camera	Digital Camera Settings Guide	Understanding Digital Camera Settings	Best High ISO Digital Camera	Digital Camera ISO Settings	Digital Camera ISO Meaning	High ISO Digital Camera	Easy Use Digital Camera
1144914	Enjoy a Snow Day	
1146291	ghost a hard drive	Ghost Software for Windows 7	Hard Drive Ghosting Software	Computer Ghosting Software	Drive Cloning Software	Clone Software	Ghost Software	Ghost Program	Hard Drive Clone Software
1147796	Paint Laminate Cabinets	Chalk Paint Laminate Cabinets	Laminate Cabinet Paint Kit	Paint Laminate Cabinets Without Sanding	Paint Laminate Cabinets Pictures	Painting Melamine Cabinets	How to Glaze Laminate Cabinets	Laminate Paint	Cabinet Rescue
1147817	sell an idea	Sell Ideas to Companies	Idea Investors	How to Sell Your Ideas to Companies	Where to Sell My Ideas	Ideas for Sale	Sell an Idea to Walmart	Sell Your Invention Idea	Sell Your Idea
1147818	sell jewelry	Sell Jewelry Home Based Business	Sell Diamond Rings	Best Way to Sell Jewelry	We Buy Jewelry	Best Place to Sell Jewelry	Selling Jewelry from Home No Startup Fee	How to Sell Jewelry to Stores	Selling Jewelry from Home No Startu…	Where to Sell Your Jewelry
11485	Make Jello Cake	Jello Cake Instructions	Recipe to Make Jello Cake
1150778	look good in a bikini	
1151604	report phishing	Report Phishing Site	Send Fraud Emails to FBI	Report Phishing Email	Report Phishing to Microsoft	Report Phishing Phone Calls	Forward Scam Email to FBI	Report Phishing to FBI	Where to Send Phishing Emails
1151606	whitewater raft	Inflatable Rafts Whitewater	Hyside Paddle Cat	River Rafts	Whitewater Raft for Sale	Aire Whitewater Rafts	Used Whitewater Rafts	Demo Whitewater Rafts for Sale	Buy a Raft
1151664	Write a Creative Diary	How to Write Diary Entry	Write a Diary Online	Write in Your Diary	Why Write a Diary	Writing A Diary Book	How to Write Creative Story	Creative Diary Ideas	How to Write Creative Writing
1152172	Search for Last Minute Cruise Deals	Hot Cruise Deals Last Minute	Last Minute Cruise Deals Baltimore	Deal Cruise Last Minute	Last Minute Cruise Deals Alaska	Last Minute Cruise Vacation Deals	Last Minute Cruise Deals Florida	Best Last Minute Cruise Deals	Princess Last Minute Cruise Deals
1153175	Make Indian Dry Mutton	Mutton Indian Recipes	What is Mutton Meat	How to Cook Mutton	Indian Mutton Masala	Mutton Recipe	South Indian Mutton Curry Recipe	Mutton for Sale	Indian Mutton Stew Recipe
1156408	send dried flowers	
1156730	Become a Magistrate	Becoming a Magistrate in PA	How to Become NC Magistrate	How to be a Magistrate	Becoming a Magistrate in Virginia	Requirements to be a Magistrate	Alabama Magistrate Requirements	NC Magistrate Application
1158147	Throw Your Friend	Best Friend Pillow	Friends Tapestry Throw	Blankets for Girlfriend	Friends &amp; Family Throw Blanket	Friends Blanket	Personalized Friendship Throws	Best Friend Blankets	Friendship Throws
11593	listen to music	MP3 Music Listen Now	Listen to Music on YouTube	Free Music To listen Too	Country Free Listen Music Online	Listen Radio	Listen Songs Online Free Now	Play Music	Free Music on Computer
1159373	Listen to KISS 95.1 on the Computer	
1160300	divorce in california	Divorce Laws in California	California Divorce Questions	Uncontested Divorce in California	Divorce in California How Long	Divorce in California Spousal Support	Fast Divorce in California	Free Divorce Records in CA	What is Legal Separation in California
1161348	Convert Video to Sony Psp Video Mp4 Format With Avs4You Software	
116162	Choose a Wedding Officiant	Become a Wedding Officiant	Finding a Wedding Officiant	Who Can Officiants Weddings	Becoming a Wedding Officiant	Register as a Wedding Officiant	Become a Wedding Officiant Florida	Wedding Officiant	Become a Wedding Officiant Online
116596	create a super hero	Create a Person	Create Your Own Superhero Online	Create a Family Guy Character	DC Superhero Creator	Create a DC Hero	Create a Superhero Suit	Create a Superhero Team	Create Your Own Marvel Character
1169307	open a checking account	Open a Checking Account Promotion	Open a Checking Account Citibank	Apply for Checking Account Online	Free Bank Account No Deposit	Open a Bank Account Online	Second Chance Checking Account	Chase Open a Checking Account	Can't Open a Checking Account
117223	Accept a Close Friend's Sexual Orientation	
1173504	Think of a Good wikiHow Article to Write	
117372	Host a Birthday Sleepover	Birthday Sleepover Invites	Sleepover Birthday Supplies	Good Movies for a Sleepover	How to Do a Sleepover	Sleepover Birthday Party Favors	How to Host a Sleepover	Food for a Sleepover	Sleepover Birthday Party Supplies
1176576	Kiss an Enemy	Animehere	Anime Stream	Watch Anime Online for Free	Anime Kiss	GoGoAnime	KissAnime	HD Anime	AnimeUltima
1178431	shoot the moon	Shoot The Moon Billie Letts	Billie Letts	Shoot The Moon Game 1959	Shoot The Moon App	Shoot The Moon Vest	Shoot The Moon Game	Shoot The Moon Definition	Shoot The Moon Song
1181532	build a closet	Build a Closet Plans	Lowes Closet Organizers	Build a Closet Organizer	Design Your Own Closet	Lowe's Build a Closet	Build a Closet Organization System	Home Depot Build a Closet	Build a Closet Wall
1181540	null	
1183608	null	
1184160	learn spanish on-line	Learn Spanish Online Totally Free	Learn Spanish Online for Free Beginners	Learn Spanish Online for Kids	Learn Speak Spanish Online Free	Free Spanish Lessons	Rocket Spanish	Learn Spanish Online Audio	Learn Spanish Fast Free
1184373	Share a Slideshow on LinkedIn with SlideShare	LinkedIn Slideshow	LinkedIn Acquires Slideshare
1185363	Use Tumblr	Number of Tumblr Users	How to Use Tumblr Savior	What Font Does Tumblr Use	How Many Users on Tumblr	Tumblr Search Users	How to Use Tumblr Blog	How to Use Tumblr Themes	Why Use Tumblr
1185395	save dogs	Dog Saves Owner from Train	Adopt a Dog in Massachusetts	Dog Saves Boy from Cougar	Dog Saves Owner	Dog Saves Family	Dog Saves Man	Alexis Khan Arrested in Charleston	Dog Saves Drowning Boy
1185449	donate toys	Donate Toys for Christmas	What to Do With Used Toys	Donate Toys and Clothes	Salvation Army Drop off Locations	Toy Drop off Locations	Donate Toys to Children's Hospital	Used Toy Donation Drop Off	Second Hand Toys
118630	Know when It Is Safe to Download Something	
1188926	design your own tattoo	Free Pictures Tattoo Designs	Create a Tattoo and Print	Tattoo Lettering Styles	Free Printable Tattoo Designs	Popular Tattoo Fonts	Free Tattoo Designs	Tattoo Ideas for Men	Tattoo Script Generator
1191712	Build a Flash Animation Using Actionscript 3	Flash ActionScript 3 Download	Flash ActionScript 3 Codes	Flash ActionScript Examples	Adobe Flash ActionScript 3.0	How to Make Flash Animation	Flash ActionScript Download	Websites Using Flash Animation	ActionScript 3 Tutorials
1192454	Build a Dance Floor	Dance Floors	Rental Dance Floors	Dance Deck	Portable Dance Floors	Outside Dance Floor Rental	Dance Floors for Sale	Building a Temporary Dance Floor	Make a Portable Dance Floor
1194030	make a puzzle	Create Your Own Puzzle	Make a Puzzle Word Search	Jigsaw Puzzle Template	Make a Jigsaw Puzzle	Make a Puzzle Online Free	Make a Puzzle in Photoshop	Make a Puzzle from a Picture	Make a Jigsaw Puzzle Online
1194889	buy a star	Buy a Star Memorial	NASA Official Star Registry	Name A Star NASA	Buying Stars in the Sky	Name A Star for Free	Star Registry Scam	Starnamer	Adopt A Star
