2997517	Make Mushroom Soup in Harvest Moon: Animal Parade	
2998661	Sign Up for AirBNB	Airbnb Rooms	Airbnb Log in	Airbnb Account	BNB	Airbnb Website	Rent Your Room	Airbnb	Rent A Room Websites
3003	record a cd	CD Record Player Combo	Record CD Radio Player	Record Player That Burns CDs	Record CD to My Computer	cdrecord Windows	Vinyl Records to CD Converter	Vinyl Records to CD	Record CD from Cassette
300399	download ringtones	AT&amp;T Ringtones	ATT Ringtones Downloads	Download Free Music	Download Free Ringtones to Computer	Mp3 Ringtone Download	Download Ringtones to My Phone	Download Music Ringtones	Free Android Ringtones Download
3007043	build a mouse maze	How to Build A Maze	Mice in a Maze	Building A Maze for Mice	Building a Rat Maze	Making A Maze Game	PowerPoint Maze Game	Mouse Maze Designs	How to Create a Maze
300726	cross over	GMC Crossovers	Infiniti Crossover 2014	Cadillac Crossover 2014	Nissan Crossover Vehicles	Lincoln Crossover 2015	Crossover 2014	2015 Cadillac SRX Crossover	Crossover Vehicles
3016472	Bring a Stuffed Animal Home	Send a Stuffed Animal	I AM A Stuffed Animal	Holiday Home Stuffed Animals	Design a Stuffed Animal	Take Home Stuffed Animal Letter	Create a Stuffed Animal	Build a Stuffed Animal	Take Home Stuffed Animal Journal
3024472	Celebrate the Bright Autumn Festival	Autumn Festivals Around the World
302573	Survive an Internship in Elementary Education	Summer Internships in Education	Summer Internships for Education Majors	Summer Elementary Education Internships	Education Internships in NJ
3035762	Make Chestnut Rice in Harvest Moon: Animal Parade	Harvest Moon Animal Parade Chicken	Harvest Moon Animal Parade Fodder	Harvest Moon Animal Parade Recipes	Harvest Moon Animal Parade Perfume
3036902	Make Omelet Rice on Harvest Moon: Animal Parade	Harvest Moon Animal Parade Chicken	Harvest Moon Animal Parade Fodder	Harvest Moon Animal Parade Recipes	Harvest Moon Animal Parade Perfume
303743	Measure Your Torso to Fit Your Backpack	Measure Torso for Backpack
3039532	Lessen the Chance of Evil Doers Coming Into Your Home	
3043395	find old movies	Movies Unlimited	List of Classic Movies	Old Movies Search	Find Old Movies by Description	Old DVD Movies	Free Classic Movies	Find Old Movies Titles	Find Old Movies to Watch
3045719	Sing a Song to Your Crush	Song Sing Your Song	Sing A Song For Me	Just A Little Crush Song	Songs to Sing to Crush	Good Songs to Sing	Sing A Song to Me	Sing Your Song Movie	Ways to Sing A Song
3049339	Log Into the Wikipedia IRC Channel on Freenode.Net	
3052956	Judge First and Second Prize in a Sports Raffle	
3053234	Find Out About Animes	Anime Outlines	One Outs Anime	Knockout Anime	Punch Out Anime	Anime Outfits	Backup Anime Out	Download Anime Out	Best Anime Out
305743	Play &quot;The Sign&quot; on an Acoustic Guitar	Easy to Play Acoustic Guitar	Playing The Acoustic Guitar	Playing an Acoustic Guitar	Inside an Acoustic Guitar	What's an Acoustic Guitar	Learn Play Acoustic Guitar	Buy an Acoustic Guitar	Play Acoustic Guitar Online
3068185	live your best life	How to Live Your Life	Live Your Best Life Now	Live Your Best Life Poem	Live Your Best Life Tour	Live Your Best Life Oprah	The Best Life to Live	How to Live A Positive Life	Live Your Best Life Book
307110	Search for Available Domain Names	Check Domain Name Availability	Free Domain Name Search	Go Daddy Domain Names	Buy a Domain Name	Go Daddy Domain Search	Domain Names that are available	Instant Domain Name Search	Available URLs
3071577	Add Item Modifiers on Square	Modifier on Add on Code
3073187	make a thank you card	Make Thank You Card Free	Design Your Own Thank You Cards	How to Make a Birthday Card	Custom Thank You Cards	Thank You Wedding Cards	Personalized Thank You Cards	Thank You Postcards	Thank You Photo Cards
308278	save the rainforest	Save the Rainforest Games	Reasons to Save the Rainforest	Save the Rainforest Poster	Save the Rainforest Organizations	Rainforest Facts	Save the Rainforest for Kids	Save the Rainforest Foundation	Save the Rainforest Information
3084689	Properly Prepare a Hookah	Where to Buy a Hookah	Hookahs	Make a Hookah	Starting a Hookah Bar
309615	Make Beetroot Dip	
309748	Do a Flip Turn (Backstroke)	Butterfly Turns Swimming	Breaststroke Flip Turn	Backstroke Turn Technique	Back to Breast Flip Turn	Backstroke Flip Turn Rules	Backstroke Turn	Stroke and Turn Video	How to Do Backstroke
310831	Make a Short Hairstyle Cute	Easy Cute Hairstyles	New Short Hairstyles	Really Cute and Easy Hairstyles	Latest Cute Short Hairstyles	Cute and Easy Hairstyle	Make a Hairstyle	Cute Hairstyles for Teens	Cute Hairstyles for Long Hair
311782	set up a 401k	Setting Up a 401k Plan
313621	buy a book	How to Order Books Online	Used Books Cheap	Buy a Book on Audible	Cheapbooks	Used Books Amazon	Buy a Book from Amazon	Textbooks	Need to Buy a Book
313847	Be Like Phoebe Halliwell	Halliwell's Film Guide	Phoebe Halliwell	Halliwell Sisters	Phoebe Halliwell Clothes
3142190	Be a Good Blue Peter Presenter	Blue Peter Presenters	List of Blue Peter Presenters	What Makes a great Presenter	Characteristics of a Good Presenter	Picture of a Presenter	Past Blue Peter Presenters	Qualities of a Good Presenter	Strengths as a Presenter
3150381	Do the &quot;Fake iPad&quot; Prank	Funny iPad Pranks	Giant iPad Prank	Broken iPad Prank
3154362	mix songs	Mix Your Own Music	Make A Song Mix	Mix Songs Online	Mix Music Online	DJ Mix Songs	YouTube Mix Songs	Mix Songs Free	Song Mixers
3162796	Uninstall the Sims 2 on PC	Manually Uninstall Sims 2	Can't Uninstall Sims 2	Sims 2 Uninstall Tool	Sims 2 Download PC	Can't Uninstall Sims 3	The Sims 2 PC	The Sims 2 PC Free	Sims 2 Won't Uninstall
31635	Clean and Disinfect Wooden Cooking Utensils	Best Cooking Utensils	Wooden Cooking Utensils	Wooden Cooking Utensil Sets	Best Wooden Utensils	Best Wooden Kitchen Utensils	Clean and Disinfect Leather Furniture	Plastic Cooking Utensils	Quality Wooden Cooking Utensils
31639	deliver a baby	Katy Perry delivers a Baby	Actual Baby Delivery	Ways to Deliver a Baby	Deliver a Baby Video	How They Deliver a Baby	Free Delivery A Baby Game	Cost to Deliver a Baby	Deliver a Baby Virtual
316961	Make a Three Fold Duct Tape Wallet	Buy Duct Tape Wallet	Duct Tape Wallet Sale	How to Make Duct Wallets	Pattern for Duct Tape Wallet	Duct Tape Wallets for Sale	Make Duct Tape Wallet	Duct Tape Wallet Pattern	Instructions to Make a Duct Tape Wallet
3175686	Hold and Create a Presentation As a Teen	
318064	Decorate Your Camp Cabin	Ways to Decorate a Cabin	Decorate Your Cabin	Camp Cabins for Sale	Decorating Cabin
3192523	open a .dat file	Dat Files Viewer	Free Viewer	Dat	Open Dat File Windows 7	Free File Viewer 2014	What is a Dat File	Free File Viewer Download	Dat Extension
319271	play monopoly	Play Monopoly Empire	Play Monopoly Online Multiplayer	Play Monopoly Online No Downloading	Monopoly Amazon	Free Monopoly Computer Game	Addicting Games Monopoly	Play Monopoly Against Computer	Free Monopoly Club Pogo
319769	stop foreclosure	Real Estate Homes for Sale	Stop Foreclosure Assistance	Atlanta Home Mortgage	How to Stop Home Foreclosure	Stop Foreclosure Mortgage Help	Money to Stop Foreclosure	Stop Foreclosure Obama	Loans to Stop Foreclosure
3208594	find a business address	Whitepages Address Lookup	Yellow Pages Business Directory	Reverse Directory	People Search	Address Lookup by Name	Address Lookup	Reverse Lookup by Address	Find a Business Address Free
3218704	tan naked	Naked Tanning Images Up Close	Nude Tanning Candid	Tanning Naked in the Yard	Naked Tanning Bed	Naked Volleyball	Tanning Voyeurs	Naked Yoga	Tanning Beds Naked
3242066	Make Lumberjack Nails	What Do Lumberjacks Say	Lumberjack Store	Lumberjack Tools	Lumberjack Pictures
324825	Overcome Fear of Disease	Overcome Fear of Failure	Meditation to Overcome Fear	How to Overcome Fear Biblically	Scriptures to Overcome Fear	Overcome Fear of Driving	Overcome Fear Quotes	Overcome Fear of Public Speaking	Love Overcomes Fear
3260106	Find Old Records of Christmas Music	Christmas Records	Old Christmas Music Albums	Old Christmas Music Radio	Pictures of Old Christmas	Free Old Christmas Music	Free Christmas Music	A List of Christmas Music	List of Old Christmas Songs
326859	Do a Superman on a Dirtbike	Create a Dirt Bike	A Dirt Bike Game	A Dirt Bike for Sale	Price of a Dirt Bike	Shipping A Dirt Bike	Build a Dirt Bike	Sell a Dirt Bike
326955	Have a Small Waist No Matter the Body Type	
3271463	Prepare for a Baton Twirling Competition	Twirling A Baton	Baton Twirling Competitions in Pennsylvania	Baton Twirling Competitions 2015	Baton Twirling Competition	National Baton Twirling Competition	Baton Twirling Competitions in Texas	Baton Twirling Competition Costumes	Batons for Twirling
328479	Look Like Whitney Port from &quot;The Hills&quot;	The Hills Whitney Port	Whitney from the Hills	Where is Whitney Port Now
3298960	Look Like Candice Swanepoel	Candice Swanepoel Boyfriend	Candice Swanepoel Pictures	Candice Swanepoel Twitter	Candice Swanepoel Photos 2013	Candice Swanepoel Wallpapers	Candice Swanepoel Hot	Candice Swanepoel	Candice Swanepoel Hot Wallpaper
3303216	Make a Successful Group in Roblox	Make A ROBLOX	Make a Roblox Account	ROBLOX Make a Free Account	Make a New ROBLOX	ROBLOX Group Search	What Makes a Successful Group	Make A ROBLOX Game	ROBLOX Group Names
3307452	Find Building Ideas for Minecraft	Minecraft Building Plans	Minecraft House Designs	Minecraft House Ideas	Things to Build in Minecraft	Minecraft Building Ideas List	Minecraft Blueprints	Minecraft Xbox 360 Building Ideas	Minecraft Blueprints Step by Step
3318814	lose weight while breastfeeding	What to Eat While Breastfeeding	Cannot Lose Weight While Breastfeeding	Breastfeeding Diet	Weight Loss After Pregnancy	Weight Loss During Breastfeeding	Lose Weight While Breastfeeding Calculator	Diet While Breastfeeding	Breastfeeding Diet Meal Plan
33191	Bring out Natural Red and Blond Highlights	Natural Red Highlights	Red and Blonde Highlights Together	Brown Hair with Red and Blonde Highlights	Bring Out Natural Highlights	Blonde and Red Highlights	Bring Out Natural Red Highlights	Natural Blonde Highlights and Lowlights	Red Blonde and Black Highlights
3322667	Overcome Your Carnal Problems and Have a Blissful Relationship with Your Partner	
332750	Beat the Mission Keep Your Friends Close on Vice City	
3328262	sell a business	Sell a Business Fast	How to Sell a Business by Owner	Sell a Business Online	LoopNet Business for Sale	Sell a Business Contract Form	Selling a Small Business	Sell a Business Free Listings	Buy and Sell a Business
3331810	Role Play Zombie Apocalypse	Zombie Apocalypse Roleplay Quiz	Zombie Apocalypse Role Playing Game	Zombie Apocalypse Role Quiz	Zombie Apocalypse	Zombie Apocalypse Games	Zombie Apocalypse Roleplay	Is A Zombie Apocalypse Possible	Zombie Role Playing Game
333195	snipe hunt	Snipe Hunting Regulations	Bid Sniper for eBay	Snipe Hunt Game	Snipe Bird Hunting	Bid Sniper	Common Snipe	Snipe Bird	What's a Snipe
334730	Move to the Netherlands	Immigration to the Netherlands	Emigrating to Holland	How to Move to Holland	New Dutch Immigration Laws	Moving from US to Netherlands	American Moving to Amsterdam	Dutch Integration Bill	Dutch Immigration
335525	learn chinese in china	Learn Chinese in Shanghai	Learn Chinese Free	Hutong School	Study Chinese	Learn Chinese in Beijing	China Study Abroad	Study Chinese Language	Study Mandarin in China
3362492	Be Your Sailor Moon Self	Sailor Moon Episodes	Sailor Moon Full Episodes	Sailor Moon Dress Up	Sailor Moon Shirts
3364372	Achieve an Achievement Badge in Cub Scouts (Boy Scouts)	
33675	Tie a Hojojutsu Bundle	Hojojutsu	Hojojutsu Torrent	Hojojutsu Ties	Hojojutsu Definition	Hojojutsu DVD	Hojojutsu Book	Hojojutsu Techniques
338294	Register a Company in Kenya	Registering a Business in Kenya	Kenya Companies Registry	Registrar of Companies Kenya
3385100	Send Cad�Cam Files with LeapFILE	CAD CAM Files	LeapFile Desktop
3387144	sue your employer	Sue Your Employer Discrimination	How to Sue A Company	Sue Your Employer for Salary	Grounds for Lawsuit Against Employer	Wrongfully Terminated	Reasons to Sue Your Employer	Can You Sue Your Employer	Wrongful Firing
339172	increase libido	Build Libido	Libido Max	Male Libido Enhancement	Increase Libido in Women	Supplements to Increase Libido	MG Health Male Libido XL	Best Libido Booster for Men	Male Libido XL Ingredients
339749	Make Microwave Oatmeal	Microwave Oatmeal Bowl	How to Make Good Oatmeal	Microwave Oatmeal Boils Over	Easy to Make Oatmeal Cookies	Quaker Oatmeal Microwave	How to Make Oatmeal Bread	Microwave Oatmeal Cooker	Oatmeal Microwave Instructions
340074	play houses	Outdoor Wooden Playhouses	Step 2 Playhouses	Backyard Playhouses	Children's Wooden Playhouses Outdoor	Outdoor Playhouses	Big Playhouses	Wooden Playhouses	Cheap Playhouses
340252	blog templates	Blog Layouts	Blogger Templates	WordPress Blog Templates	Cutest Blog on the Block	Free Blogs	Best Blog Templates	Free Cute Blog Templates	Free Website Templates
340745	add music to powerpoint	How to Put Music in PowerPoint	Music for a PowerPoint	Adding Music to PowerPoint 2010	How to Add Music to Slideshow	Free Music Clips to Download	Free Music for PowerPoint	Free Music Loops	Sound Effects for PowerPoint
3409612	Make a Journal Out of a Franklin Covey Planner Cover	Franklin Covey Planner Refills	Franklin Covey Planners	Franklin Covey Planner Binders
34153	open windows explorer	Open Windows Explorer Windows 7	Open Windows Explorer Shortcut	Open Windows Explorer Tool	Windows 7 Explorer	Download Windows Explorer	Open Internet Explorer	Internet Explorer Window Opens Minimized	Internet Explorer Window Open
3418994	Design a Small Business Logo to Make an Identity of Your Company	
342571	Make an Easy Five Minute Dip	Easy to Make Cheese Dip	Easy to Prepare Dips	Easy Hot Dips to Make
342924	Make a Naco	
342981	Get Battlefield 2142 Working on Linux	Battlefield 2142 Deluxe Edition	Battlefield 2142 Mods	Download Battlefield 2142	Battlefield 2142 1.5 Patch	Battlefield 2142 Download Full	Battlefield 2142
3432961	Start a Fire with Orange Peels	Eating Orange Peels	Orange Peel Paint	Burning Orange Peels	Orange A Peel Recipe	Orange Peel Fire Starter	Ways to Peel an Orange	Start Fire with Orange	Orange with a Peel Chicago
344841	get over it	Eagles Get Over It	Boot Camp Movie	Third Person Movie	Just Get Over It	OK Go Get Over It Lyrics	Get Over It Quotes	Guess Who Movie	The Virgin Suicides Movie
3465884	Make a Paper Minecraft Pickaxe	How to Make a Pickaxe	Minecraft Foam Pickaxe	Make Paper Minecraft Steve	Make A Minecraft Game	Minecraft Paper Games	How to Build a Pickaxe	Super Pickaxe Minecraft	Diamond Pickaxe Template
34763	plan a road trip	Plan a Vacation	Map Out A Road Trip	Plan A Road Trip Online	Free Road Trip Planner	Road Trip Planning Sites	MapQuest Road Trip Planner	Rand McNally Route Trip Planner	Plan A Trip
3491448	Draw Teeth	How to Draw Human Teeth	Sketches of Teeth
3495671	Make an Animal Pillow Box	Easy to Make Pillows	How to Make Pillow Covers	Animal Pillow Cases	Animal Throw Pillow	Black Pillow Box	Kids Pillows Animals
349616	Dress Like Angelina Ballerina	Angelina Ballerina YouTube	Angelina Ballerina Game	Angelina Ballerina Games Dress Up	Angelina Ballerina Costume	Angelina Ballerina Dress YouTube	Angelina Ballerina Costumes for Girls	Angelina Ballerina Pictures	Angelina Ballerina Dress
3510780	Create a Birdhouse with Plastic Straws	Buy a Birdhouse	Paint a Birdhouse	How to Build a Birdhouse	Plans for a Birdhouse	How to Make a Birdhouse	Large Plastic Birdhouses
3511709	convert yards to feet	Convert Cups to Pints	Convert Feet to Yards Formula	Convert Feet to Yards Chart	Convert Pounds to Ounces	Convert Yards to Feet Calculator	Convert Meters to Feet	How to Figure Cubic Yards	Convert Pints to Gallons
351529	find a song you dont know the name of	Lyrster	How to Find a Song by Lyrics	Song Identifier by Sound	What Song has these Lyrics	Music Finder	Song Lyrics Search by Phrase	Song Lyrics Free	I Can't Find a Song
351814	Involve Your Students in The Green Wave	Home of the Green Wave
3518404	Photograph Wildlife Creatively	Creatively Inspired
351986	Make Gold Cake	
352690	Make a Rabbit Puppet out of Gloves	Girls Glove Puppets Videos	How to Make Glove Puppets	Glove Puppets for Children	Make a Puppet Kit	Make a Puppet Online	Glove Hand Animal Puppets
3527054	Make a Mob Spawner in Minecraft	Minecraft Spawner	Craftable Spawners Minecraft	Minecraft Mob Spawner	Minecraft Craftable Mob Spawners
3530104	convert degrees to radians	Formula Convert Degrees to Radians	Convert Degrees to Radians Excel	Pi Radians to Degrees Calculator	Convert Radian to Degree Calculator	Convert Degrees to Radians Fraction	Radian Measure Converter	Convert Radians to Degrees Worksheets	Radians to Degrees Chart
3546236	Overcome Agoraphobia Swiftly	Overcoming Panic Disorder and Agoraphobia	Overcoming Panic Disorder and Agora…
355375	Get in Touch with Your Inner Aquarius	Touch With Your Inner
3558848	Start a Successful Food Cart Franchise Business in the Philippines	
358312	make a mothers day card	Printable Mother's Day Card	Print A Mother's Day Card for Free	Homemade Mother's Day Cards	Mother's Day Cards for Kids	Free Printable Mother's Day Cards	Create Mother's Day Card Online	Mother's Day Ecards	Happy Mother's Day Cards to Print
3584000	make at home spa treatments	At Home Spa Bath Treatments	Natural Beauty Treatments at Home	Hand Spa Treatment at Home	Easy DIY Spa Treatments	DIY at Home Spa	Do It Yourself Spa Treatments	Easy Spa Recipes at Home	DIY Spa Treatments
3585716	increase your brain power	Brain Power	How to Improve Your Brain	Vitamins for Brain Function	Boost Your Brain	Improve Brain Function and Memory	How to Increase Mental Power	How to Keep Your Brain Sharp	Boost Your Brain Power
359014	sell your story	Sell Your Story to Hollywood	Sell True Story	Sell Story to Hollywood	Sell Story Ideas	Sell My Story for Cash	Sell Stories for Money	Selling My Story Online
3602805	Remove the Qone8.Com Virus	Qone8 Virus Removal Microsoft	How Do I Remove Qone8	Qone8 Removal Free	Qone8 Uninstall	Remove Qone8 Free	Remove Qone8 from Chrome	Qone8 Removal	Remove Qone8 from Internet Explorer
3607801	Get Rich on Harvest Moon: A Wonderful Life	Download Harvest Moon Wonderful Life	Harvest Moon Wonderful Life Wiki	Harvest Moon Wonderful Life ROM	Harvest Moon Wonderful Life PS2	Harvest Moon Wonderful Life Recipes	Harvest Moon Wonderful Life Walkthrough	Harvest Moon A Wonderful Life Guide	Harvest Moon Wonderful Life Cheats
3608	Wire 3 Prong to Four Prong	Prong Plug	Metal Prongs	Four Prong Adapter	Four Prong Phone Adapter	3 Prong Adapters	Four Prong Dryer Adapter	Four Prong Trailer Wiring	3 Prong Forks
361412	Make a Club Penguin Airlines	Make a Club Penguin Website	Make Your Club Penguin	Make a Club Penguin	Club Penguin Make a Puffle	Make a Club Penguin Character	Club Penguin Make A Code	Club Penguin Make a Account	Club Penguin Make Music
361436	Make a Mother's Day Flower	1800 Flowers Mother's Day	Discount Flowers Mother's Day	Cheap Flowers Mother's Day	Mother's Day Flower Pots	Make A Mother's Day Card	Mother's Day Flower Arrangements	Mother's Day Flowers Free Shipping	Mother's Day Flower Deals
3641486	Succeed in an Interveiw	Succeed in Life Church	To Succeed in Life	Succeed in Life Quotes	Succeed in Business	Succeed in Life Center Houston	How to Succeed in Sales
3646197	Go Pier Fishing	
365223	Sew a Rip in a Plush Doll	Doll Patterns to Sew Easy	How to Sew a Plush	Sew a Doll Kit
365299	Keep a Goldfish Happy and Healthy	Signs of a Healthy Goldfish	How to Keep Goldfish	How to Keep Goldfish Healthy	How to Make Goldfish Happy	Goldfish Healthy Snack	Signs of a Happy Goldfish	Are Goldfish Happy Alone	Being Happy and Healthy
365408	Decide Whether or Not to Get an Abortion	
3654832	Track Your Employees Cell Phones	Free Track Cell Phone Location	Track Cell Phone on Map	Track Cell Phone Location	Free Employee Cell Phone Policy	Track Cell Phone Numbers	Track Your Cell Phone GPS	Track Your Cell Phone Online	Buy your Cell Phone
3664856	Make Learning Science Fun for Your Child	Learning for Fun Games	Have Fun Learning	Learning Fun for Kids	Learning Fun for Toddlers	Make Learning Fun for Preschoolers	Making Science Fun for Kids	Fun with Kids Science	Easy and Fun Science
3671661	find lost money	Unclaimed Property	Find Lost Money Massachusetts	AM I Owed Any Money	Last Money	Find Lost Money in CT	Find Lost Money in Pennsylvania	Find Lost Money Unclaimed	Find Lost Money New York
3679094	Cook Tonggol	
368487	marble paper	Marbled Paper for Sale	Pink Marble Contact Paper	Marble Paper Towel Holders	How to Make Marbled Paper	Wausau Royal Marble Paper	Marble Paperweights	Contact Paper Marble	Marble Paper Towel Stand
3685891	Take Care of a Baby Doll at Night	Take Care of Baby Games for Kids
3687511	Perform the Impossible Count Card Trick	Impossible Tricks for Kids	Impossible Card Trick	Card Trick Count to 13	Impossible Mind Reader Card Trick	The Impossible Magic Trick	Impossible Tricks to Do	Impossible Card Trick Revealed	Impossible Tricks
3690250	Get Squad Points in Call of Duty Ghosts	Call of Duty Ghost Squad Points Hack	Call of Duty Ghosts Squad Points Glitch	Call of Duty Squad Points	Call of Duty Squad Members	Call of Duty Squads Guide	Call of Duty Ghosts Squad Members	Call of Duty Ghosts Squads Explained	Call of Duty Squad Names
3698433	paddle board	Paddleboards Used	Cheap Paddle Boards	Paddle Board Sale Discount	Paddle Board Inflatable	Paddle Boards Amazon	Best Paddle Boards	Price of a Paddle Board	Paddle Boards Craigslist
3701404	Look Cool While Playing Softball	People Playing Softball
3716949	Make Violet Liqueur	Types of Liqueurs	Violet Liqueur How to Make	Homemade Violet Liqueur	Bitter Truth Violet Liqueur	Liqueur List	Coffee Liqueur	Liqueur Recipes
3718558	grow hair fast naturally	Hair Pills That Make Hair Grow Long	Fast Hair Growth Products	Hair Growth Products for Black Women	Ways to Make Hair Grow Fast	How Grow Hair Naturally	How to Grow Hair Quickly	What Makes Hair Grow Faster Naturally	Hair Growth Medicine
3726352	Start a Detective Group	Pictures of a Detective	Start a Group on Facebook
373115	Highlight Your Hair With Highlighter Markers	Red Highlighter Marker Pens	Spray in Hair Highlighter	Hair Highlight Color	Sharpie Red Highlighter Markers	Natural Hair Highlighters That Work	Temporary Hair Highlighters	Highlighters	Highlighter Colors
373607	Become an Ohio State Fan	Hot Ohio State Fans	The Fan Ohio State	Ohio State Fan Pictures	Ohio State Fan on Field	L S Fan Ohio State
3768	Decorate a Kid's Room Without Painting	Decorate Kids Room Cheap	Decorate a Room Online Free	Decorate Kids Room for Free	Ideas to Decorate a Room	Decorate a Room Games	Decorate a Room for Kids	Letters to Decorate Kids Room	Decorate a Room Online
376876	Adjust to Driving a Car on the Right Side of the Road	
376901	Imitate the Smith's &quot;How Soon Is Now&quot; Guitar Effects	
377233	Create a Zen Bedroom	Zen Bedroom Design	Creating a Zen Home	Spa Bedroom	How to Zen Your Home	Zen Like Bedrooms	Zen Rooms
377831	make a weeble	
3785	join the boy scouts	Cub Scout Age Requirements	Join Scouting	Local Boy Scout Troops	Find a Girl Scout Troop	Join Boy Scouts Flyer	Cub Scout Levels by Age	Join Cub Scouts	2014 Boy Scout Handbook
3786250	remember the titans	Remember Titans Cast	Remember the Titans Movie	Remember the Titans True Story	Remember Titans Summary	The Real Gerry Bertier	Watch Remember the Titans	Remember the Titans Characters	Remember the Titans Quotes
379578	buy american	Buy American Flags	Buy American Act Requirements	Buy US Made Products	Why We Should Buy American Mad…	Buy American Flag Walmart	Buy America vs Buy American Act	Buy American Act Exceptions	American Made Clothing	Why We Should Buy American Made Products
3801533	Remove a Review from a List on Yelp	How to Get on Yelp	Delete Review on Yelp
382069	Chill a Pop Tart	
3831627	play chuzzle deluxe	Play Chuzzle Deluxe Without Download	All Games	Free Games Online to Play Without D…	Play Chuzzle Game Online	Chuzzle Game	Free Games Online to Play Without Downloading	Chuzzle Deluxe Free Download Full Version	Play Chuzzle Deluxe Without Downlo…	Chuzzle Free Download	Chuzzle Deluxe Play Free Games
383810	Make an Outdoor Hideout	Hideout PA	Her Hideout	Hideout RV	Hideout Bar
3841157	Create Awesome Talking Friend Movies	Talking Friends YouTube	Awesome Friend Pictures	Talking Friends Full Movie	Talking Friends Games	Talking Friends Create a Mashup	Free Talking Friends	You are an Awesome Friend	I Have Awesome Friends
3841854	Use a Magic 8 Ball	Magic Eight Balls	Horoscope Magic Eight Ball	Walmart Magic Eight Ball	Magic Eight Ball Free Online	Magic 8 Ball	Magic Eight Ball CGI	Mattel Magic Eight Ball	Magic A Ball
3842725	Continue Loving God for a Long Period of Time	
3852575	Make a Necklace out of Duct Tape Flowers	How to Make Duct Flowers	Flowers Made from Tape
3859063	Draw a Parakeet or a Parret	Green Parakeet Parrots	Easy to Draw Parrots	Steps to Draw a Parrot	Moustache Parakeet Parrots	Training a Parakeet	Parrot vs Parakeet	Parrot Parakeet Difference	How to Draw a Parrot
386473	Make Sweet and Sour Chicken	Sweet and Sour Chicken Recipe Chi…	Easy Sweet and Sour Chicken	Kraft Recipe Makers	Sweet &amp; Sour Chicken Recipe	Sweet and Sour Chicken Recipe Chinese	How to Make Sweet and Sour Sauce	Sweet and Sour Recipes Chinese	Kraft Recipe Makers Where to Buy	Sweet &amp; Sour Sauce Recipe
386980	long jump	Long Jump Drills	Long Jump Video	High Jump	Long Jump Technique	Long Jump Pictures	Olympic Long Jump	Long Jump Workouts	Long Jump Game
388565	mind your own business	Mind Your Own Business YouTube	MYB Inc	Mind Your Own Business Song	Mind Your Own Business Pics	Mind Your Own Business Quotes	Mind Your Own Business Scripture	Mind Your Own Business Lyrics	Mind Your Own Business Ecards
389348	Tell an Alligator from a Crocodile	Alligator Crocodile Shoes	Crocodile Alligator Comparison	Alligator Crocodile Shoes for Men	Crocodile Alligator Hybrid	Alligator Crocodile Handbags	Crocodile vs Alligator	Difference Between Alligator Crocodile	Difference Between Crocodiles and Alligators
