151666	airbrush nails	Nail Airbrush Machine Kit	Airbrush Nail Stencils	Airbrush for Nail Art	Nail Airbrush Machine	Airbrush Nail Bar	Airbrush Nail Paint	Nail Airbrush Kit	Nail Airbrush Designs
1516745	wetset hair rollers	How to Set Hair Curlers	Wet Set Hair Pictures	Using Rollers for Wet Set	Dominican Roller Set	Wet Curlers	Wet Sets	Wet Setting Hair	Wet Roller Set Natural Hair
1517927	Get Into The Imperial Age on Age of Empires 2	
1518382	Preserve an Autograph on a Baseball	Baseball Autographs for Sale
1520477	Develop As a Musician	Find a Musician
1521885	help kids	Kids Helping Kids	Help Kids Behavior	Help Kids Read	World Vision Sponsor a Child	Help Kids to Learn	Kids Help Org	Help Kids with Homework	Sponsor a Child
1523932	live a happy life	How to Live Life Happily	Living A Satisfied Life	How to have Happy Life	Live A Happy Life Bangle	10 Ways to Be Happy	Healthy Happy Living Magazine	Way to Live Happy Life	Live A Happy Life Quote
1526423	Select an Arizona Window Sunscreens Dealer	Sunscreens for Home Windows
1526438	Use a Battery Charger	Car Battery Charger Use	How to Use Chargers	Multi Use Battery Charger	How to Use Car Charger	Enercell Battery Charger Use
1526934	Balance School and Life (Teens)	Work School Life Balance	My School Balance	Work Life and Balance	Work and School Balance
1529713	Find Free Craft Supplies	Free Stuff for Crafting	Free Arts &amp; Crafts Stuff	Woodworking Craft Supplies Free Catalog	Discount Craft Supplies Free Shipping	Free Craft Supplies Catalogs	Totally Free Craft Freebies	Free Craft Kit Samples	Free Arts and Craft Supplies
1532733	adopt a highway	Sponsor a Highway	Adopt A Highway Sign	Adopt A Highway California	Adopt A Road Program	Adopt A Highway Washington State	Adopt A Highway North Carolina	Adopt A Highway Delaware	Adopt A Highway MN
1532921	train a dog not to bark	Train Puppies Not to Bark	Stop Dog From Barking	Train Dog Not to Bark at People	Kikopup Barking
1538449	buy baby food	Buy Baby Food in Bulk	Baby Food Online Shopping	Baby Food Cheap	Cheap Baby Formula Online	Buy Baby Food Jars	Best Price for Baby Food	Buy Baby Formula Online	Baby Food Formula
1539887	Write a Human Resources Resume	Objective for Resume Human Resources	Human Resource Resume Templates	Human Resource Manager Resume	Director of Human Resources Resume	Human Resources Resumes Free Sa…	Resume Human Resource	Best Human Resources Resume Exa…	Human Resources Resumes Free Samples	Sample Resumes Human Resources	Best Human Resources Resume Examples
1544251	import furniture	India Furniture Imports	Import Furniture from China	World Market Furniture	World Imports Furniture Catalog	Pier One Imports Furniture	Mexican Furniture Imports	Pier Imports Furniture Store	Import Furniture Online
15473	Make Your Eyes the Spotlight	
1547386	buy a keg	Used Kegs for Sale	Keg Purchase	Where to Buy Beer Keg	Buy Kegs of Beer Online	Beer Kegs for Sale	KegWorks	Order a Keg	Buy a Keg Tap
1547958	Fit in at a British High School	Fit High School Program
1548	sand box	Kids Sandbox	Covered Sandbox	Sand Boxes with Lids	Sand Tables for Kids	Sandboxes for Toddlers	Sandbox Walmart	Kmart Sandbox	Backyard Sandbox
1548590	Shave With Shaving Oil Blade/Electric	Art of Shaving Blades	Old Shaving Blades	Amazon Shaving Blades	Straight Blade Shaving	Shaving Blade Oil	One Blade Shave	Men's Shaving Blades	Shave Razor Blades
1549506	Prepare for Getting a Job in a Medical Office	
1552048	dress up	Dress Up Dolls Games	Disney Games Frozen Dress Up	Dress Up Barbie Games	Dress Up Games for Teenagers	A Girls Dress Up Games	Girl Games Dress Up Makeup	iCarly Dress Up Games	Monster High Dress Up
1555862	Prepare a Pre Teen for Puberty Changes	Pre Puberty Photos	Pre Puberty in Boys	Teenage Puberty	Pre Puberty Signs in Girls	Virtual Teen Puberty for Boys
1558124	Make One Eye Go up and One Eye Go Down	
1558395	Make Almond Crusted Salmon	Almond Crusted Salmon	Almond Crusted Baked Salmon	Almond Crusted Salmon Paleo	Almond Crusted Salmon Recipe Sides	Almond Crusted Fish Recipe	Almond Crusted Halibut	Almond Crusted Chicken	Honey Almond Crusted Salmon
156033	Get a a Better Reaction for a Card Trick	
1564270	saute' mushrooms	Best Sauteed Mushrooms for Steak	How Long to Saute Mushrooms	Outback Sauteed Mushrooms	Best Sauteed Mushrooms	Sauteed Mushrooms and Onions	Spinach Mushroom Saute	Sauteed Mushrooms Recipe	Sauteed Mushrooms for Steaks
1565829	travel to romania	Travel to Romania Cheap	Americans Traveling to Romania	Romania Vacations	Romania TripAdvisor	Trip to Romania	Travel to Romania by Plane	Tours to Romania	Romania Travel Warnings
1566238	buy a dog	Buy a Dog for Free	Dogs for Sale	Looking to Buy a Dog	Adopt or Buy a Dog	Buy a Pet	Adopt a Dog	Buy a Dog Online	Buy a Dog Clicker
1567764	beat egg whites	Beaten Egg White Recipes	Egg Whites	Beating Egg Whites with Sugar	How to Whisk Egg Whites	Make Fluffy Scrambled Eggs	How to Beat an Egg	Fluffy Eggs	Egg Whites Stiff Peaks
1569526	Plan a Child's Birthday Party	Food for Child's Birthday Party	Planning a Child's Birthday Party	Child's Birthday Party in Houston	Plan Birthday Party	Child's Birthday Party Places	Menu for Child's Birthday Party	Child's Birthday Party Ideas	Child's Birthday Party Games
1569675	battle rap	Rap Battle Rhymes	Eminem Rap Battles	Rap Battles Videos	YouTube Rap Battle Videos	Smack DVD Rap Battles	Freestyle Rap Battle	Rap Battles of History	URL Rap Battles 2014
1571249	Plan and Film a Sims 2 Movie	Sims 2 Movie Making	YouTube Sims Movies	The Sims 2 Videos	The Sims Film
1573064	Be a Cool Preteen Girl	
1575162	Pretend You're a Novelist	Pretend You're X	Pretend You are
158440	read a clock	Telling Time Teaching Clock	Anelace Binary Clock	Binary Clocks	Reading Time Clock	Reading A Clock Games	Telling Time Worksheets	Learning Time	Tell Time
1589702	Get Lost in a Good Book	How to Be Lost Book	Get Lost in You	Get Lost in a Story	How to Get Lost	Books to Get Lost in	Get Lost	Let's Get Lost Book	Lost in a Good Book
1591407	date a dentist	Dating Your Dentist	Date Dental	Dating a Patient	10 Reasons to Date A	Single Dentist Dating	Reasons to be a Dentist	Dentist Dating Site	Date Dental in Murrieta
159170	Create and Develop an Original Character	How to Develop Your Character	Create Your Own Original Character	Create Character and Play	Create Character	How to Create Original Characters	Create a Character	How to Develop Character Relationships	How Do Authors Develop Characters
15930	Race a Junker on a Dirt Track	Dirt Race Tracks in PA	Find a Race Track	Dirt Track Race Car Bodies	Parts of a Race Track
1593704	Get Rid of Cats from Your Garden	Get Rid of Cats in My Yard	How to Get Rid of Unwanted Cats	Get Rid of Cats Permanently	Rid Cats from Garden	Getting Rid of Your Cat	Get Rid of Cats	Rid Cats From Your Property	Get Rid of Cats in Yard
1593832	make money writing	Make Money Writing Books Online	Make Money Writing Poetry Online	Make Money Writing Poetry	Make Money Writing Blog	Make Money Writing Songs	How to Earn Money Writing	Make Money Writing from Home	Make Money Writing Short Stories
1594752	Become Confident and Improve Yourself	Become More Self Confident	Things to Improve Yourself	How to Become Confident Women	How to Become Confident Again	Improve Yourself Quotes	How to Improve Yourself Daily	How to Be Confident	How Do I Become Confident
1594774	calculate your final grade	Grade Calculator for Students	Figuring Out Final Grade Formula	Formula to Calculate Grade	Online Grade Calculator	Calculate Exam Grade	Figuring Out Final Grade	Roger Hub Grade Calculator	Grading Scale for Teachers
1596530	Verify That a French Business/Professional Is Appropriately Registered	
1601345	Overcome Selective Mutism As a Teen	Selective Mutism Foundation	How Common is Selective Mutism	Treatment for Selective Mutism	Selective Mutism Adults	What Causes Selective Mutism	Selective Mutism	Selective Mutism Teacher Tools	Selective Mutism in Teens
160151	Keep Your Books Neat	Free Books to Keep
1609011	Make a Xenomorph Costume	Xenomorph King	Xenomorph Costume for Sale	Xenomorph Queen	Xenomorph Types	Xenomorph Dog	Alien Xenomorph Costume Kit	Xenomorph Plush	Xenomorph Mask
1609543	read aloud	PBS Read Aloud Stories	Read Aloud Stories	Read Aloud Program	Books Read Aloud Online Free	Free Read Aloud Websites	Interactive Read Alouds	Online Read Alouds	Read Aloud Strategies
1611485	Do a Knee Tuck	Advanced Abdominal Exercises	Jump Knee Tucks	Standing Knee Tucks	Knee Tuck Surgery	Plank Knee Tucks	Swiss Ball Knee Tuck	Knee Tucks Exercise	Seated Knee Tuck
1611845	Grow Cucumbers to Pickle	How to Pickle Cucumbers Recipes	Pickle Cucumber Recipes	How to Pickle A Cucumber	Easy Cucumber Pickles	Garlic Cucumber Pickles	How to Can Pickles Cucumbers	Sweet Cucumber Pickles	How to Pickle Cucumbers Vinegar
1612068	Buy a Retired Police Dog	Retired Working Dogs for Sale	Retired Service Dogs for Sale	Service Dogs Retired	Looking for Retired Police Officers	Retired Police Cars for Sale	Police Retired Dogs for Adoption	Retired Police Dogs in Florida	Free Retired Police Dogs
1612443	Scream in a Hardcore Punk Band	
1618687	Make a Lemon and  Herb Italian Sandwich	Lemon Herb Sauce	Lemon Flavored Herbs	Lemon Herb Dressing	Lemon and Herb Seasoning	Grilled Lemon and Herb Chicken	Lemon and Herb Chicken Recipe	Orzo with Lemon and Herbs	Lemon and Herbs Recipe
1621010	Improve Your Mother Daughter Relationship	Help for Mother Daughter Relationship	Improving Father Daughter Relationship	Improve Relationship With Daughter
1624419	Remove a Candle from a Mold	Plastic Candle Molds	Small Candle Molds	Homemade Candle Molds	Remove Mold from Fabric
1625210	Grow Patchouli	How to Grow Patchouli Plant	How to Harvest Patchouli	Patchouli Plants for Sale	Patchouli Oil	Patchouli Plant Care	How to Grow Patchouli Indoors	Pogostemon Cablin Plant	Pogostemon Cablin Seeds
1625507	Buy Pieces of Driftwood	Driftwood Pieces Wholesale	Where to Buy Driftwood	Small Driftwood Pieces	Bulk Driftwood Pieces	Pieces of Driftwood for Sale	Small Driftwood Pieces for Sale	Craft Driftwood Pieces	Decorative Driftwood Pieces
162606	Manage Your Time over Summer Break	How Long is Summer Break	How to Better Manage Your Time	Manage Your Time Effectively	Manage Your Time at Work	How to Manage Time Better
16261	build a hydroponic garden	Hydroponic Gardens at Home	Growing a Hydroponic Garden	How to Build a Hydroponics	Making Hydroponic Indoor Garden	Build Your Own Hydroponic Garden	How to Make Hydroponic Garden
1626710	convert roman numerals	Roman Numerals List 1 10	Numeric Numbers	Roman Numeral Date Converter	Mcmxlix Translate	Roman Numeral for 1000	How to Read Roman Numerals	Roman Numeral Conversion Table	Google Roman Numeral Converter
1627250	Draw Fashion Eyes	Easy Eye Drawings	Cartoon Eye Drawings	Fashion Drawing Templates	Pencil Drawing Eyes
1627986	Work Your Way up the Corporate Ladder	The Corporate Ladder Movie	Move Up The Corporate Ladder	Climbing Up The Corporate Ladder	Moving Up The Corporate Ladder
1628150	Buy Depression Medication	Anti Depression Medication List	Buy Medication Online	Best Depression Medications Women	List Depression Medication	Side Effects of Depression Medication	Best Anxiety Depression Medication
1633543	Start a Page in Wikipedia	When was Wikipedia Started	Startpage Wikipedia
1634398	Do a Tiger Stripe Manicure	Tiger Stripe Cat	Tiger Stripe Fabric
1635932	Be a Gourmet Cook in 3 Easy Lessons	
1637342	Draft a Compromise Agreement Quickly and Cheaply	
1640789	Use an ATM to Deposit Money	How to Use ATM Card	Can You Make Cash Deposits at ATMs	Free Money ATM Code	How to Withdraw Money from an ATM	ATM Deposit Cash	ATM Deposits	ATM Deposit Available	ATM Check Deposit
1643253	obey your parents	Children Obey Your Parents Lesson	Obey Your Parents Coloring Pages	Obey Your Parents Song	Obey Your Parents Bible Verses	Children Obey Your Parents KJV	Children Obey Your Parents Bible	Obey Your Parents Crafts	Obey Your Parents Worksheets
164692	chew tobacco	Chew Tobacco Chew Tobacco Chew Tobacco Spit	Chew Tobacco Brands	Blake Shelton Chew Tobacco Spit	Chew Tobacco Effects	Tobacco Chew Side Effects	Chew Tobacco Chew Tobacco Spit	Types of Chewing Tobacco	Copenhagen Chew Tobacco
1648053	Work in Collaboration With a Narcissist	Can a Narcissist Love	Working in collaboration with
1648826	Add a Wall Switch to Light Fixture Controlled by a Chain	
165104	Make Leaf Images	
1651910	think big	Think Big Book	Big and Tall Casual Male XL	Think Big Store	The Magic of Thinking Big	The Power of Thinking Big	Big Thinking Quotes	Think Big Company	Think Big by Ben Carson
1652269	Clear Negative Energy	Smudging to Clear Negative Energy	Incense to Clear Negative Energy	Sage to Clear Negative Energy	Meditation to Clear Negative Energy	Clearing Negative Energy from Yourself	Crystals to Clear Negative Energy	Clear Negative Energy Spells	Sage for Cleansing Negative Energy
1656900	color pictures	Color	Pictures of All Colors	Free Printable Coloring Pictures	Disney Coloring Pictures	Halloween Color Pictures	Hair Color Pictures Highlights	Color Pages	Free Images to Color
1656908	Meet New People With Grooovy	Groovy New File	Groovy New Date	Meet New People	Groovy People Making Friends	Groovy New Line	New Groovy Girls	Songs with Groovy
1657113	love a pet	Love A Pet Adoption	Luvmypet	Love A Pet Store	Pet Vaccinations	Love A Pet Broken Arrow	Lotsa Love Pet Grooming	Love A Pet Winx Club	Luv My Pet Low Cost Vaccination Clinics
1657692	Be a QMRP	QMRP Job Description	QMRP Salary	QIDP	QMRP Definition	QMRP Conference	QMRP Certification Online Course	Qualified Mental Retardation Professional QMRP	QMRP Duties
1657711	Earn Extra Cash from Home	Make Money Online Free No Scams	Earn Extra Money From Home	How to Make Money on the Internet	How to Earn Money as a Kid	Free Money	Make Money at Home for Free	How to Earn Money Online	Make Money Fast
1658789	Buy More Time on an Overdue Assignment	
1659871	burn free music	FrostWire	Burn Your Own CDs Free	Download and Burn Music	Burn CDs for Free	Totally Free Music Burning Sites	Burn Free Music Downloads legally	Free Music Downloads	LimeWire Free
1663497	feed a corn snake	How Often Feed Corn Snake	Baby Corn Snake Food
1666135	Recognize Signs of Over Exercising	Warning Signs of Over Exercising	Problems with over Exercising	Causes of Over Exercising	Exercising Over 50	Dangers of Over Exercising	Over Exercising Effects	Over Exercising
1671058	Draw a Crater	
1676349	Do the Left Leg Splits	How to Do Side Splits	Left Leg Pain in Women	Stretches to Get Left Splits	Leg Split Machine	Swelling of the Left Leg	Leg Splits Video	Pain in Your Left Leg	Pain in the Left Leg
167954	visit niagara falls	Niagara Falls Hotels	Niagara Falls Things to Do	See Niagara Falls Canada	Niagara Falls Canada Tours	TripAdvisor Niagara Falls Canada	Canada Niagara Falls	Niagara Falls NY Attractions	Hotels in Niagara Falls Canada
168051	Find a Girlfriend at Summer Camp	Summer Camps in My Area	Find a Summer Camp Job	Find a Camp	Find Summer Camps Free	Find a Camp for Kids	Find Summer Camps	Find Summer Camps Near You	A Summer Camp
1682413	Choose a Baby Nursery Theme	Baby Nursery Themes	Baby Nursery Themes for Boys	Neutral Themes Baby Nursery	Nursery Themes for Boys	Baby Nursery Themes for Girls	Baby Themes for Nursery	Turtle Baby Nursery Theme	Nursery Themes for Girls
1682877	Maintain a Linoleum Floor	Linoleum Floor Covering	Linoleum Prices	Linoleum Floor Photos	Vintage Linoleum Floor	Kitchen Floor Linoleum	Cheap Linoleum Flooring
1683459	Identify Fruit and Vegetable	Identifying Vegetables in the Garden	Identify Produce	How to Identify a Fruit	How to Identify Vegetable Seeds	Identify Vegetables by Pictures	Produce Guide	Identify Root Vegetables	How to Identify Vegetables
1685583	report welfare fraud	Report Welfare Fraud in Pennsylvania	Report Welfare Fraud California	Report Welfare Fraud Florida	Welfare Fraud Facts	Report Welfare Fraud in Illinois	Report Welfare Fraud New York	Report Welfare Fraud Indiana	Report Welfare Fraud NJ
1687390	Choose the Best Broadband Router for Your Network	
1688274	Get a Doctorate in Economics	Getting a PhD in Economics	Education Doctorate	Doctorate in Nursing	Doctorate in Psychology	PhD in Economics	Doctorate Program	Doctorate in Economics Programs	Doctorate Degree in Economics World
1688633	play poker for free	Free Texas Hold'em Game Room	Texas Hold'em Free Games	Books on Video Poker	Free Poker Tournaments for Cash	Free Online Poker No Money	Play Poker for Free Games	Free Poker Star	Play Poker for Free Money
1690	Start Your Own Exercise Regimen and Stick to It	
1695637	build a maze	Make A Maze Online	Making a Corn Maze	Make A Maze Free	Maze Creator	How to Solve A Maze	Create a Maze Game	Build Your Own Maze	Build A Maze Outdoor
169620	Straighten Out a Dollar Bill	Straighten Out Definition	Straighten
1696326	download world of warcraft	Download Minecraft	World of Warcraft Free Full	Download Wow Full Version	Download Warcraft Full Game	World of Warcraft Sign in	World of Warcraft Download Online	Play World Warcraft	Warcraft Free Download Full Version
1698614	Do a Kickoff in Cheerleading	Kickoff News	Kickoff Football Game	Kickoff Football
170296	Fight Like Your Favorite Videogame Fighter	Your Favorite Video Games	What's Your Favorite Video Game	Girl Fight Video Game	Play Your Favorite Games
170309	Make a Credit Card Flower Box Magnet	Make a Free Credit Card	Make Gift Card Box	Do Magnets Affect Credit Cards	Magnet Effect on Credit Cards	Card Magnets	Do Magnets Ruin Credit Cards
170625	search the internet	How to Find Internet	Search Engines for the Internet	Internet Research Jobs	Yahoo Web Search	Search The Net	US Search	Internet Searcher	Search the Internet for People
1709671	Live the &quot;Perfect&quot; Teen Life	The Perfect Teen Room	A Perfect Life Movie	The Perfect Life Blog	The Perfect Life 2011	Perfect Life 2010	Living The Perfect Life	The Perfect Life Song	The Perfect Life Movie
1711188	find arelative	Trying to Find a Relative	Finding My Relatives	Find Your Family	How to Find Family Members for Free	Find a Relative Free	PeopleFinders	Find Relatives for 100% Free	How to Find Missing Relative
1713843	Plan a Trip to Croatia	Trips to Croatia and Slovenia	Trip to Croatia Cost	Plan A Trip to France	Package Trips to Croatia	Plan A Trip to Italy	Plan A Trip to Disney	Plan A Trip to Miami	Plan A Trip to Spain
171736	Make Citrus Spray	
1722072	Make Fried Dough	Fried Bread Dough Recipe	Italian Fried Dough	Fry Bread Recipe for Indian Tacos	Recipe for Indian Fry Bread	Italian Fried Dough Powdered Sugar	Indian Fried Bread Recipe Easy	Recipe for Fry Bread	How to Make Fried Bread
172525	Loop Music on an iPod	Putting Music on an iPod	Put Music on iPod	Downloading Music on an iPod	Music on Your iPod	How to Attach iPod Loop	Apple iPod Touch Loop	Loading Music on an iPod	iPod Touch Loop Replacement
1729639	Become a Pretty and Popular Teenage Girl	Dating A Popular Girl	Being A Popular Girl	Popular Girl A Names	I Like A Popular Girl	Girl Becomes A Boy	A Popular Girl Likes Me	Girl Becomes A Woman	Man Becomes A Girl
1729863	request high school transcripts	Official School Transcripts	Request High School Transcript Letter	Florida High School Transcripts	Official High School Transcripts California	Free High School Transcripts	Official Transcript Request	Official High School Transcripts Calif…	Lakewood High School Transcript Request	How to Get High School Transcripts
1731294	live it up	Live It Up Jennifer Lopez Lyrics	Live It Up mp3	Isley Brothers Live It Up	Live It Up Music Video	Live It Up Meaning	Live It Up Owl City	Live It	Airbourne Live It Up
173973	do the right thing	Do The Right Thing Quotes	Watch Do The Right Thing	Do The Right Thing Analysis	Do The Right Thing Pizza	Do The Right Thing YouTube	Do The Right Thing Essay	Do The Right Thing Characters	Do The Right Thing Full Movie
1741796	Download the Soundtrack from a YouTube Video Using SnipMP3	
1747504	Ditch Insincere Friends	Insincere Person	Another Word for Insincere	Insincere Synonym	Insincere People	Dealing with Insincere People
1749248	reinstall outlook express	Microsoft Outlook Express	Install Outlook Express Windows XP	Reinstall Outlook Express Windows XP	Uninstall Reinstall Outlook Express	Install Free Outlook Express	Reinstall Outlook Express WinXP	Outlook Express for Windows 8	Free Outlook Express Repair
1755256	Make Fruit Pops	Fruit Juice Popsicles	Make Popsicles at Home	Frozen Fruit Popsicles	How to Make Popsicle Molds	All Natural Fruit Popsicles	Fruit Popsicles Brands	Popsicle Pictures	Real Fruit Popsicles
1757655	meet russian women	
1760155	Set up a Letter	Formal Letter Set Up	Basic Letter Set Up	Letter Setup Example	Writing a Letter Set Up	Business Letter Set Up	How to Address an Envelope	Letter of Recommendation Set Up	Mail Letter Set Up
176049	Write a Speech about Your Dog for Show and Tell	
1760715	Prepare a Nursery for Twins	Nursery Themes for Twins	Twin Nursery Pictures	Twin Boy Nursery	Nursery Room Ideas for Twins	Cribs for Twins Nursery	Nursery for Twins on Pinterest	Twin Girls Nursery Ideas	Bedding for Twin Nursery
1764083	Train for Rowing	Training Plan Rowing	Weight Training for Rowing	ERG Machine	Row Machine Workout	Rowing Machine Benefits	Rowing Machine Exercise	Weight Training for Rowing Competition	Rowing ERG
1764928	find a girl friend	Find a Girl to Date	Find a Girl Online	Find a Girl Scout Troop	Find a Girl to Marry	Find Girlfriends Online Free	Find a Girlfriend For Me	Find a Girl For Me	Single Ladies Near Me
1768128	Begin an Oregon Divorce	Oregon Divorce Process	Oregon Divorce Help
1770693	fun stuff to do	Fun Stuff to Do Outside	Fun Stuff to Do for Kids	Cheap Fun Things to Do	Fun Stuff to Do Online	Fun Things to Do Outdoors	Fun Stuff to Do at Home	Cheap Things	Fun Games
1771500	Heal from a Collapsed Lung	Treatment for Collapsed Lung	How to Treat Collapsed Lung	Collapsed Lung Recovery	Treatment for a Collapsed Lung	Surgery for a Collapsed Lung	A Collapsed Lung Mean	Reasons for Collapsed Lung	Recovery from Collapsed Lung
1771689	Create a Tag and Perform a Revert in TortoiseSVN	
1771708	Make a Paper Shield	How to Design A Shield	How to Make Paper Shields	Create Shield Logo	Create a Shield Logo
177442	Go to the Chiropractor Without Fear	Word for Without Fear	Live Without Fear
1775552	Dry Squash Seeds	Saving Butternut Squash Seeds	Drying Butternut Squash	Saving Squash Seeds for Planting	How to Dry Out Squash	Drying Squash Seeds for Planting	Drying Acorn Squash	How to Preserve Squash Seeds	Drying Zucchini Seeds
1777039	trace your family tree	How to Trace My Family Tree	Trace Your Genealogy	Family History Free	Free Family Tree Search	Trace My Family History	Trace Your Ancestry for Free	My Family Tree	Trace Family History for Free
1778463	Get Back at Members on Club Penguin	Club Penguin Membership	Free Member on Club Penguin	Club Penguin Videos	Member Club Penguin Accounts	Club Penguin Member Code	Club Penguin Free Member	Club Penguin Member	Penguin Club
177944	freeze strawberries	Best Way to Store Fresh Strawberries	Freeze Strawberries Without Getting Mushy	How to Freeze Strawberries Martha Stewart	Freeze Blueberries	Freeze Strawberries Without Gettin…	Freezing Whole Strawberries	Freeze Strawberries for Smoothies	How to Properly Freeze Strawberries	How to Store Strawberries	How to Freeze Strawberries Martha …
1779662	shop and save	Shop &amp; Save Pittsburgh PA	Shop N Save Bridgeville PA	Shop N Save Application	Schnucks	Shop N Save Belleville IL	Shop 'n Save Jobs	Shop and Save Weekly Circular	Save A Lot Weekly Ad
1783960	Make Homemade Stickers and Embellishments	3 D Embellishment Stickers	Cheap Embellishments	Paper Embellishments	Embellishments for Scrapbooking	Recollections Stickers &amp; Embellishments	Jolee's Stickers Embellishments	Scrapbook Stickers and Embellishments
178567	play paintball	Paintball Gear	Paintball Guns Amazon	Paintball Guns	Paintball Online	Zephyr Paintball	Play Paintball Games	Ultimate Paintball	Paintball Games for Kids
17901	Help Someone Who Has Swallowed Gasoline	Someone Who Helps Others	Swallowed Gasoline Treatment
179096	volunteer overseas	Best Volunteer Abroad Program	Volunteers Abroad	Overseas Volunteer Trips	Overseas Volunteer Opportunities for Seniors	Free Volunteer Abroad	Projects Abroad	Overseas Volunteer Opportunities for …	Peace Corps	Get Paid to Volunteer Overseas
1792171	Change a Background in Adobe Illustrator	Remove Background Adobe Illustrator	Change Background in Illustrator	Change Illustrator Background Color	Adobe Illustrator Backgrounds	Adobe Illustrator Background Effects	Backgrounds in Illustrator	Change Background Color Illustrator CS6	Adobe Illustrator Background Color
179435	travel with kids	Travel with Kids Paris	Travel with Kids Tips	Places to Travel with Kids	Travel with Kids Show	Japan Travel with Kids	Travel with Kids Europe	Travel with Kids Blog	Boston Travel with Kids
1795033	donate food	Food Banks Near Me	Donate Food San Diego	Donate Food Bank	Places to Donate Food	Donate Food to Africa	Donate Food for Thanksgiving	Where Can I Donate Canned Goods	Food Donation Centers
179736	Use the Reloading Tool in Resident Evil 3	
179835	use your imagination	How to have an Imagination	Use Your Imagination PBS Kids	Ways to Use Your Imagination	Use Your Imagination Promo	Using Your Imagination While Depre…	Use Your Imagination Ft Myers	Using Your Imagination While Depressed	Games Using Imagination	Use Your Imagination Lyrics
1807042	exercise after childbirth	Best Postpartum Workouts	Best Post Pregnancy Workouts	After Pregnancy Workouts	Pelvic Floor Exercises After Childbirth	Postnatal Exercises	Kegel Exercises After Childbirth	Exercise After Baby	Tummy Exercises After Pregnancy
180919	find a snake	Types of Snakes	10 Most Venomous Snakes	World's Largest Snake	Free Play Snake Games	All Snakes	Snakebite Treatment	Poisonous Snakes	World's Largest Snake Found Dead
1811663	lose weight super fast	Super Fast Weight Loss Pills	Diet Plans to Lose Weight Fast	Super Quick Weight Loss Tips	Extremely Fast Weight Loss	Fast Weight Loss Plan	Diets for Quick Weight Loss	Good Diets to Lose Weight Fast	Extremely Fast Weight Loss Pills
