484844	Work Well As a Team on Left 4 Dead	
4850297	talk to god	Talk to Jesus Online	Talk to God Book	Chat with God	Talk to Jesus	How God Talks to Us	Need to Talk to God	Chat with God for Real	God Where Are You
485928	Make Bran Water for Cleaning	How to Make Clean Water
486587	Make a Sewing Box	Accordion Sewing Box	Homemade Sewing Box	Make Your Own Sewing Box	Make Your Own Sewing Basket	Cantilever Sewing Box	How to Sew a Box	DIY Sewing Box	Wooden Sewing Boxes Plans
486643	thrift shop	Goodwill Thrift Store	Thrift Shop Stores	Thrift Shop Song	Find Thrift Stores Near You	List of Thrift Stores	Online Thrift Stores	Salvation Army Thrift Store	Shop Thrift Stores Online
486687	Explore the Rumen of a Fistulated Cow	What is a Rumen	Cattle Rumen	Rumen Fistulated Cow	Location of Rumen in Cow	Fistulated Human
4877381	Make Two Ingredient Play Dough	Cookie Dough Ingredients	Two Ingredient Recipes	Ingredients to Make Dough	Recipe to Make Play Dough	Bread Dough Ingredients	Play Dough Videos	Play Dough Ingredients	Best Play Dough Recipe
4879882	Test a Kenmore Ultra Dishwasher Model 66513743k603 That Will Not Start for a Defective Control Board or Control Panel	
4889246	Identify Genuine Leather	Genuine Leather Sofa Sets	Genuine Leather Jackets	Genuine Leather Wallet	Genuine Leather Bags	Genuine Leather Shop	Genuine Leather Handbag
490610	Make Plant Name Markers from Ice Cream Containers	
490789	play scrabble	Scrabble Game Amazon	Scrabble Games for Sale	Scrabble for PC	Free Online Scrabble Board Game	Scrabble Against Computer	Word Play Scrabble	Play Scrabble Free No Download	Play Scrabble Alone
4923512	Take Your Teddy Bear on a Bike Ride	
4925077	buy cigarettes	Order Cigarettes Online	Buy Cigarettes Online	Buy Cigarette Wholesale	Buy Cigarettes Online Legal	Buy Cigarettes Online Free Shipping	Buy Cigarettes Online Cheap	Where to Buy Tobacco Online	Buy Cigarettes Online USA
49305	Perform a Taekwondo Front Kick	Taekwondo Kick Bag	Taekwondo Kicks Videos	List of Taekwondo Kicks	Axe Kick Taekwondo	Taekwondo Kicks in Korean	Front Kick Taekwondo	Taekwondo Kicks Techniques	Types of Kicks in Taekwondo
495025	teach kids about money	How to Get Money for Kids	Teach Children to Save Activities	Personal Finance Education Lesson Plans	Kindergarten Coin Games	How to Teach Money to Second Graders	Personal Finance Education Lesson Pl…	Managing Money	The Mint	Savings for Children	How to Teach Money to Second Grad…
4959111	bible journal	Online Bible Journals	NIV Journal Bible	Bible Journal PDF	Journal Bible Study Notebook	Life Journal Bible	Printable Bible Journal	Journaling Bible ESV	Take Note Bible
49611	Make One Chicken Last a Week	Make a One Week Calendar
496368	Make Vegan Brown Sugar Champagne Frosting	Sugar Free Vegan Frosting	Brown Sugar Frosting for Spice Cake	Vegan Brown Sugar Cookies	Vegan Frosting Without Powdered Sugar	Homemade Brown Sugar Frosting	Pink Champagne Frosting Recipe	Brown Sugar Buttercream Frosting	Easy Brown Sugar Frosting
496493	Organise a Three Shelved Book Case	Bookcase White 3 Shelves	Ladder Shelves Bookcases Leaning	How to Organize Kitchen Shelves	Organize Racks and Shelves	Folding Shelves Bookcase	5 Shelf Bookcase	Lowes Shelves Bookcases	3 Shelf Bookcase Plans
496537	Be a Toddler or Baby on Club Penguin	
4971357	find a persons phone number	Need a Phone Number Free	Phone Number Lookup	PeopleFinders	Have Phone Number Need Name	Find a Person Free of Charge	Find a Phone Number Free of Charge	A Person's Cell Phone Number	Free Cell Phone Numbers Using Person's Name
4971831	Do Perfect Winged Eyeliner Anytime	Best Eyeliner for Winged Eyeliner	How to Do The Perfect Eyeliner	Winged Eyeliner with Pencil	1960S Winged Eyeliner	Bad Winged Eyeliner	Different Winged Eyeliner
498012	design shirts	Custom Girl	Design Your Own Shirt	Custom Ink Shirts	Design Tank Tops	Shirt Design Maker	Cheap Tees	Shirt Design Cheap	Team Shirt Designs
4994101	Avoid Weak Hip Hop	Hip Hop Music	Hip Weakness with Dull Pain	Hip Hop Videos	Weak Hip Muscles Hip Pain
4995560	Plant a Seed You Don't Know How to Plant	
4998605	buy disney stock	Disney Drip	Disney Stock Split 2014	Dis Stock Price Today	Buy One Share Disney Stock	Walt Disney Company Stock	Should I Buy Disney Stock	Buy Disney Stock for Kids	Disney Stock Price
5000780	Build an Oak Wood House on Minecraft	Minecraft Build a House Free	Cool Wood Minecraft Houses	Minecraft Build House	Build Your Own House Minecraft	Modern Wood House Minecraft	Houses to Build on Minecraft	Dark Oak Wood Minecraft	Minecraft Oak Wood ID
5025273	Cope with Your Parents As a Teen	Helping Teens Cope	Helping Teens Cope With Depression	Helping Teens Cope with Anxiety	Helping Teens Cope with Moving	Helping Teens Cope with Stress	Helping Teens Cope with Death	Helping Teens Cope with Grief	Helping Teens Cope with Anger
5035056	Do a Unit Rate	Unit Rate Examples for 7 Grade	Unit Rate Videos	Unit Rate Definition	Unit Rate Examples	Unit Rate Calculator	How to Find the Unit Rate	Unit Rate Worksheet	Unit Rate Examples for 6 Grade
5037864	Draw a Neopoprealist Illustration &quot;PEACE&quot;	Short Sermons Outlines	Sermon Illustration Peace with God	Free Sermons for Today	Bible Sermon on Peace	Illustration on Peace of God	Sermon Outline on Peace	Steps to Peace with God	Peace of God Sermon
5038708	sell rare books	Rare Books Appraisal	Book Buyback	List of Rare Old Books	Vintage Books Value	Sell Textbooks	Antique Books Price Guide	Amazon Book Buyback	Alibris
50769	exchange links	Link Exchange Software	Farmville 2 Link Exchange	Free Link Exchange Directory	Internet Marketing	SEO Link Exchange	Search Engine	CastleVille Link Exchange	ChefVille Link Exchange
508123	Make a Gillitini	DIY Guillotine
509259	Find Something to Wear on a School Occasion	
509377	Film a Kung Fu Fighting Scene (Kids)	Kung Fu Fighting Games	Kung Fu Kid Full Movie	Best Kung Fu Scenes	Best Kung Fu Fighting Movies	Kung Fu Fighting Video	Kung Fu Kids Movies	Kung Fu Fighting Song	Kung Fu Fighting Download
510113	be real	Be Real Fitness	Got To Be Real Song	Homes for Sale	To Be Real YouTube	Just Be Real	Got To Be Real	Let's Be Real	Real Estate Agencies Billerica MA
5106101	Avoid Being Tricked by a Garage Door Repair Company	
511001	Make a Internet Browser With Realbasic 2008	
5111501	believe in magic	Do You Believe in Magic	I Believe in Magic Lyrics	I Believe in Magic YouTube	Got to Believe in Magic	Believe in Magic Charity	Believe in Magic Quotes	Believe in Magic Song	Have to Believe in Magic
513758	Improve Your Tone on the Flute	Improve Your	Flute Tone Production	Flute Tone Exercises	Earth Tone Flutes
513836	Make Mushroom Broccoli Casserole	Broccoli Mushroom Soup Casserole	Chicken Broccoli Mushroom Casserole	Recipe of Broccoli Casserole	Broccoli Casserole Cream of Mushroom Soup	How to Make Broccoli Casserole	Broccoli Mushroom Recipes	Broccoli Casserole	Recipe for Broccoli Casserole
514745	make coffee syrup	Coffee Syrups	Iced Coffee Syrup	Torani Syrup	Caramel Flavoring for Coffee	Homemade Coffee Syrup Recipe	Caramel Syrup for Coffee	Torani Caramel Syrup	Flavored Syrups for Coffee
5149130	Animate in Pencil 2D Animation Software	2D Animation Software Mac	2D Animation Software Free	Free 2D Animation Software Downloads	Best 2D Animation Software	Best Free 2D Animation Software	Pencil Animation Free Download	2D Animation	Top 10 2D Animation Software
516373	Get Special Pet Foods in Webkinz	Webkinz in Stores	List of Webkinz Pets	Places to Get Webkinz	How to Get Webkinz Codes	Webkinz World Online Pet Game	How to Get Free Webkinz	Where Do You Get Webkinz	Special Pet Food
516635	Make Rose Madeleines With Glittered Honey Lemon Glaze	
516749	Store Partially Baked Bread	Oven Baked Bread Recipe	Home Baked Bread Recipes	How to Make Baked Bread	Homemade Baked Bread
5173601	learn italian	Learn Free Italian	Learn Italian Online Free Audio	Learning Italian for Beginners	Italianpod101	Basic Italian for Tourists	List of Italian Words	Basic Italian	Italian Phrases
5178516	Travel the World Safely Alone As a Woman	
517867	Make Blueberry Banana Bread	Best Blueberry Banana Bread	Bisquick Banana Blueberry Bread	Banana Blueberry Cake	Healthy Banana Blueberry Bread	Moist Banana Blueberry Bread	Banana Blueberry Bread Buttermilk	Banana and Blueberry Bread	Giada Blueberry Banana Bread
518730	Play Truth or Dare at a Sleepover	Truth or Dare Games for Teenagers	Truth or Dare Games for Teens	Scary Sleepover Truth or Dare	Dares for Sleepovers	Truth or Dare Sleepovers	Truth or Dare for Kids Girl	Sleepover Dares for Kids	Let's Play Truth or Dare
518909	bend it like beckham	Bend it Like Beckham Analysis	Keira Knightley	Bend it Like Beckham Quotes	Bend it Like Beckham Wikipedia	Bend it Like Beckham Cast	Bend it Like Beckham Netflix	Parminder Nagra	Bend it Like Beckham Full Movie
51994	ballroom dance	Types of Ballroom Dances	Ballroom Dance Classes	Ballroom Dance Names	Free Ballroom Dance Lessons	Ballroom Dancing Lessons	Ballroom Dance Videos	Cheap Ballroom Dance Dresses	Ballroom Dances List
521321	Pass a Class Without Really Studying	100% Pass Without Exam
521972	repair hardwood flooring	Patching a Hardwood Floor	Hardwood Flooring Repair Tips	Floor Repairs	Hardwood Flooring Repair Kit	Bruce Hardwood Flooring Repair Kit	Floor Restoration	Local Flooring Contractors	Restoration of Hardwood Floors
5224643	watch south park	South Park Season 17	South Park Episode List	Watch South Park Studios	Comedy Central South Park Full Episodes	Watch South Park Free Online Full Episodes	South	Full Episodes of South Park	Watch American Dad
522707	Make a New Dress from an Old Halloween Costume	
5236	Make Yard Sale Signs	Cheap Garage Sale Signs	Making Yard Signs	Create Garage Sale Signs	Garage Sale Kit	How to Print Yard Signs	Personalized Lawn Signs	Funny Garden Signs	Make Yard Sale Signs Free
523870	Improve Your Footwork in Soccer	Fast Footwork Soccer	Soccer Drills to Improve Footwork	Improve Footwork Basketball	Fast Footwork Soccer Drills	Best Soccer Footwork	How to Improve Soccer Footwork	Drills to Improve Basketball Footwork	Soccer Footwork Video
5240654	Convert and Play iTunes Movies on Galaxy Note 4 by Using Avs4mac iTunes Converter	
5246820	Keep Away from Water, if You Can't Swim	
52509	Relax Before Singing on Stage	Kids Singing on Stage	The Singing Stage Forum	Girl Singing on Stage	Singing on Stage Studios
525144	Be a Classical Girl	Girls Classic League Lake Highlands	Top 100 Classic Girl Names	Classic Girls Dresses	Classic Girl Names	Girls Classic Clothing	Girls Classic League Soccer	Jane's Addiction	Beautiful Classic Girl Names
5257913	Own an Imaginary Dragon	Imaginary Dragons Band	Imaginary Dragons Radioactive	Imaginary Dragons Demons	Imaginary Dragons Demons Lyrics
5259311	have a nice day	Have A Nice Day Graphics	Have A Nice Day Images	What A Nice Day	Have A Nice Day Wishes	Nice Day Text Messages	Have A Nice Day Quotes	Have A Nice Day Sign	Have A Nice Day Album
526042	Make a Christmas Tree Snowflake	Snowflake Christmas Tree Decorations	Snowflake Christmas Tree Skirt	Christmas Ornaments with Snowflakes	Snowflake Christmas Tree Ornaments	Snowflake Christmas Tree Garland	Snowflakes Christmas Lights	Snowflake Christmas Tree Topper	Christmas Snowflake Images
5266292	get rid of urine smell	Dog Urine Smell	Human Urine Odor Remover	Getting Rid of Pet Urine Smell	Dog Urine Odor Removal	How to Remove Urine Smell	Eliminate Urine Smell	Cat Urine Odor in House	Urine Odor Remover
526661	Draw a Black Cat	Black Cat Drawings Halloween	Black Cat Sketch	How to Draw a Kitten	How to Draw Cats Step by Step	How to Draw Cats	How to Draw Halloween Cat	How to Draw A Scared Cat	How to Draw Cartoon Kittens
5268708	Be a True Warrior Cats Cat	What Warrior Cat AM I	Play as a Warrior Cat	Be A Warrior Cat	Make a Warrior Cats	Warrior Cat Game	Warrior Cats Movie	Warriors What Cat Are You	Be A Warrior Cat Online
52806	stamp concrete	Concrete Stamping Mats	Stamped Concrete Patio Designs	Concrete Stamp Patterns	Cost of Stamped Concrete Patio	Concrete Stamp Rental	Concrete Stamps Home Depot	Stamps Shop	Concrete Stamps for Sale
5287223	catch a falling star	Catch A Falling Star Summary	Catcha Falling Star Negril Jamaica	Catch A Falling Star by Kim Culbertson	Catch A Falling Star Song	Catch A Falling Star Bangor	Catch A Falling Star Resort	Catch Falling Star Lyrics	Catch A Falling Star DVD
5289387	Make Your Software Releases Much Better	Make Much Better	How to Make Better Love
5298200	Get Free Beauty Products	Try Beauty Products for Free	Free Giveaways by Mail No Shipping Charge	Free Hair and Makeup Samples	Free Makeup Samples by Mail	Free Beauty Samples by Mail	Get Free Beauty Samples	Makeup Freebies	Free Coupons for Beauty Products
531427	set time	Correct Time	Reset Time on Computer	Change Time on Computer	Set Time in Windows 8	Set Time on Kindle HD	Clock for Windows 8	Set Clock on Kindle Fire	Clock
532757	Make a Trebuchet with Popsicle Sticks	Trebuchet out of Popsicle Sticks	How to Make a Popsicle	Catapult Designs With Popsicle Sticks	Easy Popsicle Stick Catapult	Size of a Popsicle Stick	Popsicle Stick Catapult Steps	Catapult Popsicle Sticks Instructions	Building a Popsicle Stick House
5328610	do your own pest control	Do Your Own	Terminix	DIY Pest Control Supply Store	Exterminators in My Area	Do My Own Pest Control Coupon	ePestSolutions	Orkin Prices for Pest Control	Orkin Man
5345976	Make Beats Like Kanye West	Kanye West Beats List	Kanye West Best Beats	Kanye West Gets Beat Up	Beats for Kanye West	Kanye West Type Beat	Kanye West Be Like	Kanye West Beats	Kanye West Beat Tape
534956	buy wine	Wine Country Gift Baskets	Wine Best Buy	Buy Wine Online USA	Buy Wine Wholesale	Buy Wine Bulk	Buy Wine Online Free Shipping	Wine Express	Wine Baskets
5353	define love	Define Friend	Christian Love Defined	Define Being In Love	Unconditional Love Defined	God's Love Defined	Definition True Love	Characteristics of Love	Love defined in the Bible
5354013	Prevent Abuse	Prevent Abuse Now	Preventing Abuse Conference	Strategies to Prevent Abuse	How to Prevent Mental Abuse	Preventing Child Abuse and Neglect	Preventing Abuse Foundation	How Can You Prevent Abuse	Prevent Abuse Now Register
5354298	Stand Up from a Bully	Question from a Bully	Profile of a Bully	Guy Beats Up Bully
5360341	Make Austrian Bullets with Feta Cheese	What is Feta Cheese	Feta Cheese Brands	Feta Cheese Recipes	Homemade Feta Cheese Recipe	Make Feta Cheese at Home	Sheep Feta Cheese	Recipes Using Feta Cheese	Feta Cheese for Sale
536292	Spot if Your Boyfriend Is a User, Cheat or a Player	
5364011	Pick a Healthy Sugar Glider	Buying a Sugar Glider	Price of Sugar Gliders	Where to Buy Sugar Gliders	A Sugar Gliders Diet	Sounds of a Sugar Glider	Free Sugar Gliders	Cost of a Sugar Glider	Buy a Sugar Glider Online
5366362	pets and animals	Fun Animal Games	Pets and Animals in Distress	MSN Pets and Animals	Animal	Animal Games for Kids	YouTube Pets and Animals	Animal Game	Animal Planet Game
537055	Get Your Parents to Sign a Bad Report Card Without the Nagging	
537381	Write a Captivating CV for Jewellery and Watch Jobs	
537750	Know if a Beer is American Made	Best American Made Beer	American Made Beer List
538327	Sit Beside a Girl in School	
5391628	flick .	Flickr Home Page	Flickr Search	Model Flickr Swimsuit	SmugMug	Slip Model Flickr	Flickr Photos	Photobucket	Teen Flickr
539939	read poetry	How to Read Poems	Free Poems to Read	Poetry Read Out Loud	How to Read Poetry Aloud	Writing Contests	Poetry	Rd Poetry Contest	Read Poetry Online
5418372	Get Over a Prank	Send a Prank Call Free	How to Do A Prank	Getting Over A Girl	Getting Over A Girlfriend
5420644	Make Holiday Kids' Crafts	Crafts for Kids to Make	Pinterest Kids Holiday Crafts	Holiday Crafts for Kids Free	Holiday Crafts Kids Can Make	Easy Kids Holiday Crafts	Holiday Kids Crafts Ideas	Holiday Crafts for Kids	Christmas Crafts Kids Make
5421340	Life a Fulfilling Life	Living A More Fulfilling Life	Fulfilling Life Without Children	More Fulfilling Life	What Makes Life Fulfilling	Live A Fulfilling Life	Living a Fulfilling Life Single	Quotes on a Fulfilling Life	Having a Fulfilling Life
542543	sell diamonds	Sell Diamonds New York	Sell Diamond Engagement Ring	WP Diamonds	Diamonds Selling Price Guide	Sell Loose Diamonds	Sell My Diamond Earrings	Places to Sell Diamonds	Cash4Gold
5433491	Become More Popular than the Other Popular Girls	
544040	Make Nasturtium Flower Sandwiches	Edible Flower Nasturtium	Nasturtium Flowers for Sale	Nasturtium Flowers Photos	Can You Eat Nasturtium Flowers	Nasturtium Pictures
5440574	Be Like Tiffany from Silver Linings Playbook	Silver Linings Playbook Movie	Tiffany Maxwell Silver Linings Playbook	Silver Linings Playbook DVD	Silver Linings Playbook Wikipedia	Silver Linings Playbook Quotes	Silver Linings Playbook Tiffany Disorder	The Silver Linings Playbook Wiki	Silver Linings Playbook
5444618	Make a Fairy House from Two Shoe Boxes	
54450	find free stuff online	Free Samples by Mail No Surveys	Get it Free	Free Games	Best Free Stuff Online	Free Things to Get Online	Totally Free Stuff	Women Get it Free	Free Electronics
545145	Make Cinnamon Apple Strips	Cinnamon Apple Rings	Cinnamon Candy Apples	Healthy Cinnamon Apples	Cinnamon Apple Vine	Baked Cinnamon Apples
545648	Choose a Nickname on a Pet Site	Help Me Choose a Pet
5456675	find cities	Find Cities Using Coordinates	Find Zip Code City	Three Cities Find	Find Cities in Germany	Find Cities by Area Code	Find Cities in Tennessee	Magnet Schools Find Cities	Find Cities by Satellite
545832	Start a Humming Bird Club	Hummingbird Track Club	Buy a Hummingbird	Hummingbird Club Washington MO
5459138	Save Money on Your Air Conditioning Bill	Ways to Save on Air Conditioning	Save on Air Conditioning Bills	Bill's Air Conditioning Service	Reduce Air Conditioning Bills	Save Money on Electric Bills	Cut Air Conditioning Bill	Saving Money On Air Conditioning	Save Electricity Air Conditioning
545954	Protect Your Computer With a Firewall	Protect Your Computer with	How to Access Computer Firewall	Protect Your	Find Firewalls on My Computer	Protect Your Computer from Viruses	Free Computer Firewall	Best Computer Firewalls	Free Computer Firewall Protection
546265	Create Masks Using Audio Software	Data Mask Software	Create Software for Free	Create Audio CD Software	How to Create Audio DVD
5468118	best way to train a puppy	Best Way to Train a Dog	Best Way to Housebreak a Puppy	Obedience Training	Puppy Training Housebreaking	Best Way to House Train Dogs	Training a Puppy to Go Outside	How to Housebreak a Puppy	How to You Potty Train a Puppy
5471177	Not Get wikiHow Users to Hate You	How to Use Get Tube
5474696	Play Flat Notes on the Violin	All Notes on Violin	Play Violin Online	Notes on the Violin Strings	Violin Note Chart	How to Play Violin Notes	How to Read Violin Notes	Music Notes for Violin	Violin Notes for Beginners
5475145	Identify Entity Types (DBMS)	Entity Type Definition	DBMS Types SAS
5475404	Warm Up Your Voice: 3 Steps	Step Up 4	Step Up 3 Movie	Voice Warm Up Exercises	Voice Warm Ups	Professional Voice Warm Up Exercises	How to Warm Up My Voice	Voice Warm Up Windows 7	Voice Warm Up for Singers
5480683	Watch a Holiday Movie with Others	The Holiday Movie Watch Free	Watch Holiday Movie	The Others Watch Online Free	Watch Holiday Movies Online Free	The Others Watch Online	The Holiday Full Movie Free
5480805	Play Midfield in Girl's Lacrosse	How Many Girls Play Lacrosse	Midfield Lacrosse Heads	LAX Midfield	Basic Girls Lacrosse Plays	Midfield Lacrosse Shafts	Midfield Soccer Role	Midfield Lacrosse Sticks	Best Midfield Lacrosse Stick
5482010	Take Care of Your Hamster Properly	How to Use Your Properly	Tips for Taking Care of a Hamster	How to Take Care of a Hamster
5485899	fake tan	Spray on Tans Do They Work	How to Self Tan	Best Faux Tan	Tanning Salons Near You	How to Look Tan	Tanning Store	Moisture Tan	Artificial Tan
5486013	Visit the Universal Orlando Resort	Universal Resorts Orlando FL	Royal Pacific Resort Universal Orlando	Tips for Universal Orlando Visit	Orlando Universal Hotel	Best Time Universal Orlando	Best Days for Universal Orlando	Universal Orlando Resort	Hotels near Universal Orlando
5492699	Roleplay on San Andreas Multiplayer	San Andreas Multiplayer Wiki	GTA San Andreas Roleplay Servers	San Andreas Multiplayer for Mac	Play San Andreas Multiplayer	San Andreas Multiplayer Game	GTA San Andreas Roleplay	San Andreas Multiplayer Servers
5494867	Find a Payday Lender in Los Angeles	Ace Payday Loans	Ace Loans	Ace Express	Payday Loans in Aurora	Payday Loan Stores Los Angeles	Payday Advance Los Angeles	Cash Loans Los Angeles	Ace Cash Express
5500570	Tie a Re Threaded Figure of 8 with a Stopper Knot	
550068	create a code	Create a Secret Code	Create Your Own Coded Message	ATT Create a Code	How Do I Create a QR Code	Secret Codes for Kids	QR Code Generator Google	The QR Code Generator	Code Games for Kids
5501441	crappie fish	Crappie Magazine	Crappie Fishing Tips	Crappie Fish Fry Recipes	How to Clean Crappie Fish	Bluegill	Black Crappie Fish Pictures	How to Cook Crappie Fish	Crappie Fish for Sale
5504302	Dispute a Demand from a Debt Recovery Company for a Phone Bill	
5506873	Take Care of a Beta	A Beta Care
550768	Write a Nature Haiku	Haiku Examples	A Haiku About Nature	Write a Haiku Online	What is a Haiku	Write a Haiku Worksheet	Examples of Nature Haiku Poetry	Examples of Haiku	How Do You Write Haiku
550994	order flowers	Order Flowers for Funeral	Edible Arrangements	1800Flowers Coupons 25% Off	Cheap Flowers	From You Flowers	Flower Shipment	ProFlowers Coupon Code 25 Off	Order Flowers Online Cheap With Free Delivery
5513354	play chess online	Play Chess Online Free Against Computer	Free Online Chess vs Human	Chess Play Now	Free Chess No Sign Up	Play Chess Online Yahoo	Play Free Chess Games	1 Player Chess Online	Play Chess Online No Registration
551375	Encourage Multiple Cats to Get Along with Each Other	
5514264	Make a Vegetarian Taco Pie	Taco Pie Recipe with Pie Crust	Vegetarian Tacos Black Beans	Vegetarian Pie Crust Recipe	How to Make Vegan Tacos	Vegetarian Tacos with Avocado	Recipes for Taco Pie	Vegetarian Taco Filling	Healthy Vegetarian Tacos
5520202	Better Understand Fracking	Better Understand or Understand Better	Better Understand Your
552250	print posters	Order a Poster Online	Poster Arts	Large Poster Printing	Staples Poster	Have a Poster Printed	Walmart Poster Prints	Amazon Prints &amp; Poster	Kinko Poster Print
5526402	Gain More Followers and Get More Likes	Get More Followers on Instagram	Get More Followers on Vine	Gain More Followers Tumblr	Gain More Followers Instagram	Gain More Followers on Twitter	Get More Followers on Twitter	Get More Followers Fast	Gain More Followers Free
553387	Express Anger Without Hurting People	Helping Without Hurting Book	Ways to Express Anger	Hurting People	How to Help Without Hurting	How Do You Express Anger	Pictures of Hurting People	Helping Without Hurting Seminar	Suicide Without Hurting Others
5535178	Sing Happy Birthday in German	Translate Happy Birthday into German	Happy Birthday in German Written	Zum Geburtstag Viel Gluck	Hoch Soll Sie Leben Translation	YouTube Happy Birthday in German	German Birthday Song	Happy Birthday in German	YouTube German Birthday Song
5535986	teach summer school	Should Schools Teach Sex Education	Reasons to Teach School	Summer School Programs	Elementary Summer School
5536018	Add Dirt to a Zombie Costume	Zombie Costumes for Women	Ideas for a Zombie Costume	Just Add Zombies	Making a Zombie Costume	Add Zombie Games
5537277	Get Ready to Do Homework	Ready to Do Your Will	Best Way to Do Homework	How to Like Homework	Homework to Do Online	How Do You Do Homework	How to Do Homework Online	Do Homework for Me	Best Time to Do Homework
5540042	Curl Hair, Heat Free, Products Free	Curl Care Products	Best Curl Products	Curl Free Curl Activator	Heat Free Hair Reviews	Care Free Curl Products	Curl Products for Natural Hair	Curls Hair Products at Target	Curls Product Line
5541345	play games online	Shooting Games Play	Play Free Online Games	1000 Free Online Games	Online Play Games Car Racing	Play Games Online Free Without Do…	Want Play Free Games Now	Play Games Online Free Without Downloading	Polly Pocket Games Play Online	GTA 5 Online Gameplay
5541449	Stop Being Islamophobic	Reasons for Islamophobia	Islamophobia Quotes	Islamophobia Articles	Islamophobia America	Islamophobia Attacks	Islamophobia After 9 11
5543398	make a site	Build a Web Page	Build a Website	Build a Website for Free	GoDaddy Website Builder	Make a Site Free	Weebly Make a Site	Webs Sign in	Free Website Design
5545517	Learn from Everthing That Happens	How to Learn Everything Possible	Everything Happens to Me	Everything Happens for the Best	Including Everything That Happens	Everything Happens For A Reason	Everything Happens in Threes	Everything Happens in God's Time	Believe That Everything Happens
5550514	play boy	
5550593	make your own logo	Make Your Own Logo Printable	Free Logo Design	Make Your Own Logo Shirts	Free Logo Design Templates	Create Your Own Designs Free	Starbucks Logo Make Your Own	Do It Yourself Logo	Make Your Own Hat
5561772	free running	Fighting Games	Running Games	Play Runner 2	Temple Run	Extreme Free Running	Free Runner 2	Free Running Miniclip	Running Games for Kids
5562202	Boat Train Your Dog on Plastic Grass	
5562881	Be Successful on Shark Tank	Shark Tank Episode List	BZ Box	Shark Tank 2014 Episodes	Shark Tank items	Shark Tank Gifts	Shark Tank Store	How to Get on Shark Tank	Watch Shark Tank
556545	learn to ride a motorcycle	How to Start Riding A Motorcycle	Learn to Ride Motorcycle Classes	Motorcycle School	Motorcycle Riding Classes	Learn to Ride TN	Motorcycle Riding School	Learn 2 Ride	How to Ride a Motorcycle for Beginners
5566233	Stop the Windows Shutdown Process	Stop Automatic Shutdown	Windows 8 Stop Shutdown	C# Shutdown Process	Stop System Shutdown	Linux Shutdown Process	Windows 7 Shutdown Process	Prevent Windows Shutdown	Windows XP Shutdown Problem
