1000676	show rabbits	show rabbits breeds	rabbit breeds	eddie alder&#39;s stud of show rabbits	show rabbits game	show rabbit supplies	how to show rabbits in 4-h	show rabbits for sale	show bunnies
1007358	Become a Green Beret	become special forces	become ranger	become air force special forces	become delta force	become army ranger	become navy seal	become marine special forces	become army special forces
1007699	Make Focaccia Style Flax Bread	flax focaccia bread recipe	how to make focaccia bread fluffy	how to make focaccia bread without yeast	flax meal focaccia bread	low carb flax focaccia bread	how to make focaccia bread in breadmaker	flax seed focaccia bread	how to make focaccia bread from pizza dough
1008097	clean hardwood floors	clean hardwood floors make them shine	clean bruce hardwood floors	clean old hardwood floors	how to deep clean hardwood floors	clean hardwood floors with vinegar and water	steam clean hardwood floors	hardwood floor cleaner	clean hardwood floors with vinegar
1008853	Eat Formally	how to eat at a formal dinner	how to eat properly
1009188	Get Your Facebook Page Noticed	how to invite people to like your facebook page	how to merge facebook page and place	how to delete business facebook page	facebook page or place	how to use a facebook page	groups vs pages	how to make someone admin on facebook page	business facebook pages
1010825	Bid Farewell in Russian Language	bid farewell killswitch engage	bid farewell in a sentence	bid farewell definition	bid farewell lyrics	bid farewell synonym	bid farewell quotes	bid him farewell	bid you farewell
1014833	design a web site	create a website	design a website in photoshop	design your own website	website templates	build a website	design a website for free	design on a dime website	free website templates
1015737	Get Brass Key on RuneScape	runescape cheats	brass key runescape 07	how to get brass key runescape 2007	how to get brass key for hill giants	how to get big bones in runescape	runescape brass key location	how to get brass key south park	runescape brass key lure
101827	Remove Undesirable ASCII Characters from a Site Created With Apple iWeb	
1019142	Stop Deer from Eating Your Plants and Trees with Soap	keep deer eating fruit trees	deer eating garden plants	stop deer eating roses	stop deer eating shrubs	prevent deer from eating plants	how to deter deer from eating plants	how to keep deer from eating plants	stop rabbit eating plants
1020624	make your own game	make your own video game	make your own pc game	make your own online game	make your own board game	make your own character game	make your own person game	make your own game for kids	game maker
1021142	play with dogs	play with dogs at animal shelter	games to play with dogs inside	play games dogs	play with dogs online	play horses	good games to play with dogs	play cats	play with dogs for a day
10215	call 9-1-1	911 emergency calls	what to do when you call 911	why is 911 the emergency number	how did emergency 911 start	911 emergency script	is 911 universal	is 911 a universal number	911 telephone
102638	Deal With Heat Exhaustion	heat exhaustion in dogs	how to treat heat exhaustion	heat exhaustion prevention	how long does heat exhaustion last	heat exhaustion symptoms	heat exhaustion vs heat stroke	heat exhaustion in children	heat exhaustion in toddlers
1026880	Teach Your Children Good Driving Skills by Example	
1027282	Be Beautiful at Seventy	
1029612	Use a Fish Finder	how to use a garmin fishfinder	how to use a fish finder	how to use a fishfinder video	how to use a fishfinder on a kayak	use a fishfinder to catch bass	how to read a fishfinder	how to use a fishfinder john adams
1031679	enjoy the life	enjoy life sayings	enjoy life poem	enjoy life cereal	enjoy life golf balls	enjoy life magazine	enjoy life quotes	injoy life	thesaurus life
1033040	Flirt Using Body Language (Girls)	how do guys flirt using body language	flirty body language	flirty body language men
103358	Eat Fewer French Fries	how to eat french fries with braces	eating french fries after working out	how to eat french fries with fork	eating french fries at night	eating french fries everyday	eating french fries after wisdom teeth	eating french fries on a diet	eating french fries when sick
103802	blend in	blend in photoshop	blend in meaning	blend in trailer	blend in definition	blend in synonym	blend in crossword	blend in movie	how to blend in illustrator
1040045	Look Asiatic when You're Not	
1041196	Lime Render a Wall	lime render specialists	lime render mix for external walls	lime render repairs	lime render fireplace	lime render internal walls	lime render suppliers	lime render specification	lime render recipe
104193	tease your hair	tease your hair meaning	best way to tease your hair	tease your hair without teasing comb	how to tease your hair big	how to un tease your hair	tease your hair video	tease your hair tutorial	can you tease your hair
1044273	Recognize Cellulitis Symptoms	cellulitis symptoms nose	cellulitis symptoms foot	orbital cellulitis symptoms	cellulitis symptoms hand	cellulitis symptoms ear	cellulitis symptoms in horses	nasal cellulitis symptoms	cellulitis symptoms lower leg
104810	Make a Quarter Staff With PVC Pipe	
1048912	down load yahoo messenger	download yahoo messenger for android	download yahoo multi messenger	download skype	download yahoo messenger 11	download yahoo messenger 9	download yahoo messenger 7	download yahoo messenger for blackberry	download yahoo messenger 8
104948	steal a myspace layout	stole myspace layout	steak myspace layout	stealth myspace layout	steal private myspace layout	steel myspace layout	seal myspace layout	steal myspace layout codes	myspace layouts
1052158	apply for medicaid	apply for medicare	apply for medicaid nj	medicaid eligibility	apply for food stamps	documents needed to apply for medicaid	apply for medicaid pa	who can apply for medicaid	apply for medicaid online
105261	Install a Mail Slot	make mail slot	how to install a mail slot through a wall	how to install mail slot in wall	how to install a mailbox	how to install a mail slot in a metal door	mail slot dimensions	install mail slot in glass door
1053218	Insert a Cannula	history cannula	intravenous cannulation	iv cannulation procedure	how to put a cannula iv	iv cannula insertion	intravenous cannula	cannulation technique	cannulation procedure
1055281	Defeat Barbarrcia in Final Fantasy IV	
105608	Put a Fancy Edge on a Pie Crust	decorative pie crust tops	decorative pie crust leaves	how to make decorative pie crust edges	what does it mean to flute pie crust	fluted edge pie crust	decorative pie crust edges	decorative pie crust cutters
1062857	Buy a Wok	
1063997	Make a Hide out for Kids	how to make a hideout in the woods	how to make a hideout in minecraft	how to make a hideout outside	how to make a hideout in a tree	how to make a hideout in your room	kids hideout ideas	how to make a hideout in your closet	how to make a hideout in minecraft pe
1064414	Dress up As Ed from Ed, Edd	ed edd n eddy dress up games	ed edd n eddy dress up
1066797	practice acting	free practice acting scripts for kids	how to practice acting alone	practice acting scripts for kids	practice acting scripts by yourself	movie scripts to practice acting	practice acting scripts online	practice acting scripts for teens	practice acting scripts
1066834	color hair	color hair dye	color hair with chalk	color hair tumblr	color hair with kool aid	color hair online	hair color ideas	color hairstyles	color hair at home
106763	storm chase	red bull storm chase	storm chase tours	storm chase game	storm chaser	live storm chase	virtual storm chase	storm chase vehicle equipment	storm chase video
1069014	Survive Retirement	retirement 60s	how to survive retirement book	how to survive retirement with no money	retirement survival kit in a can	retirement relationships	how to survive retirement with your spouse	retirement survival guide	retirement survival kit for teachers
1072586	buy a computer	buy a desktop computer	buy a gaming computer	best buy	buy a computer online	buy a computer with payments	buy a computer with bad credit	buy a laptop	best places to buy a computer
107603	find an apartment	find an apartment with bad credit	find an apartment with a broken lease	how do i find an apartment	find low income apartment	find an apartment near an address	find an apartment near me	best way to find an apartment	find an apartment for me
1076997	collect unemployment	collect unemployment ny	applying for unemployment benefits	collect unemployment if you quit	collect unemployment if fired	collect unemployment while in school	collect unemployment if quit	can self employed collect unemployment	collect unemployment and social security
1077005	sell your wedding gown	wedding gowns under 1000	second hand bridal	used wedding dresses	resell your wedding dress	who buys wedding dresses	wedding dress for sale	want to sell your wedding gown pinoy	rustic wedding dresses
1078662	Pull a Prank on Mischief or Goosey Night (Halloween Eve)	
107983	express yourself	express yourself lyrics	express yourself song	express yourself labrinth	express yourself nwa	express yourself quotes	express yourself diplo	express yourself charles wright	express yourself madonna
108019	Ask a Lady Out If You're Shy	
1081221	open compressed files	open compressed files on ipad	use winzip open compressed files	open compressed files online	open compressed files windows 7	open compressed files windows 8	open compressed files mac	open compressed files on iphone	open compressed files without password
1082159	Relieve Stress when Revising	how to relieve stress for teenagers	how to relieve stress at work	how to relieve stress and anxiety	how to relieve stress and anger	how to relieve stress from school	ways to relieve stress	how to relieve stress headaches	how to relieve stress and anxiety naturally
108340	make bagels	make homemade bagels	make bagels with pizza dough	make bagels in bread machine	make bagels from scratch	make bagels thermomix	make bagels soft	how do they make bagels	bagel recipe
1084355	dress like paris hilton	dress like paris hilton for halloween	paris hilton does dress	dress like kim kardashian	dress like heiress	how to dress like nicole richie	dress like britney spears	dress like pamela anderson	heiress paris hilton dress
1084790	Appear Hygienic	
1084802	Make a Kesha Costume	kesha costume ideas halloween	kesha songs	how to make a lady gaga costume
1085483	compare colleges	compare colleges academically	compare colleges college board	compare college rankings	college rankings	college reviews	compare online colleges	compare colleges by major	compare universities
1087435	make your own glitter words	make your own glitter sayings	make glitter graphics words	make your own glitter pictures	make your own text generator	make your own glitter letters	make your own myspace graphics	your own glitter graphics words	your own glitter images
1089128	'play' '	play tetris	play framework	svt play	play cloths	play solitaire	play hub	play it again sports	play pink
1089466	Lose Weight by Doing Things You Like	lose weight doing yoga	how to lose weight by doing nothing	lose weight doing zumba	how to lose weight doing cardio	can i lose weight doing yoga	can cardio help you lose weight
1090547	apply for personal loans	apply capital one	apple personal loans	apply unsecured loans	apply credit cards	apply business loans	apply debt consolidation	apply payday loans	apply student loans
1090555	count money	count money app	count money slot machine	count money song	count money worksheet	how to count money fast	teaching kids to count money	how to count money back	count money machine
10928	Become a Hair Stylist	qualifications do need hair stylist	become fashion designer	become a hair stylist online	become famous hair stylist	need to become a hair stylist	become hairdresser	become cosmetologist	become celebrity hair stylist
1094943	Be a Scarecrow for Halloween	halloween scarecrow ideas	halloween decorations	halloween scarecrow mask	scarecrow halloween prop	halloween scarecrow punch	scarecrow halloween costumes for womens	scarecrow halloween costume	halloween scarecrow pictures
1096701	make your own free website	make your own free business website	how to make your own free website with own url	make your own free website custom domain	make your own free flash website	make your own free website google	make your own free game website	make your own free website for kids	make your own free website with free domain
1096937	Confirm the Authenticity of a Property Title	
1099968	have a party	have a party lyrics	have a party mobb deep	have a party with your bear day	let&#39;s have a party lyrics country	reasons to have a party	let&#39;s have a party toby keith	have a party meaning	have a party mp3
1102029	Apply for a Marriage License in Virginia	marriage license virginia lookup	marriage license virginia loudoun county	marriage license application virginia	commonwealth of virginia marriage license	copy of marriage license virginia	marriage license virginia cost	marriage license records virginia	marriage license virginia chesapeake
1102545	adopt a kitten	adopt a baby kitten	adopt a kitten petsmart	adopt a kitten rescue	adopt a kitten petco	humane society	free kittens	petsmart	best age to adopt a kitten
1103301	organize your office	do organize your home office	organize your office in no time	how to organize your office space	best ways to organize your office	organize your office supplies	organize your office or work space	office framework	how to organize your office files
1103959	Make Bubble Blowing Tools	bubble blowing history	bubble blowing spongebob movie	how to make bubble blowing solution	bubble blowing toys	all bubble blowing babies	spongebob bubble blowing technique	bubble blowing lawn mower	bubble blowing pipe
1106235	Make a Raw Vegan Brownie	raw vegan brownie icing	raw vegan brownies deliciously ella	raw vegan brownies with raw chocolate frosting	raw vegan brownies banana	raw vegan brownies coconut oil	raw vegan brownies calories	raw vegan brownie avocado	raw vegan brownie bites
1106648	get rid of birds	how to get rid of birds nest	best way to get rid of birds	get rid of birds in trees	how to get rid of birds nesting in eaves	get rid of birds with sound	get rid of birds on porch	bird control	get rid of birds in attic
1106719	Build Muscular Strength	build cardiovascular fitness	develop muscular strength	build muscular endurance	build flexibility	can build muscular strength	build cardiovascular endurance	build agility	build endurance
1107812	send flowers	send flowers cheap	cheap flowers	send flowers today	send flowers internationally	send flowers free shipping	send flowers coupon	send gifts	send flowers reviews
1107815	Hold a Pick	best way hold pick	how to use a pick	different ways to hold a guitar pick	trouble holding guitar pick	hold pick to play bass guitar	use a guitar pick	how to properly pick a guitar	how to hold a guitar pick properly
1108213	Smile When You Are Angry	angry smiley face	the angry smile book	the angry smile ebook	the angry smile pdf	angry smiley	the angry smile signe l. whitson	sad smile
1108896	apply for medi-cal	how to apply for medi-cal online	apply for medi-cal by phone	apply for medi-cal solano county	apply for medi-cal benefits online	apply for medi-cal online contra costa	apply for medi-cal over the phone	apply for medi-cal online ca	how to apply for medi-cal insurance
1114572	Have a Sleepover when You Are Grounded	
1115517	Make Herb De Provence	herbs de provence substitute	what spices are in herbes de provence	how to make herbes de provence at home	herb of provence ingredients	herbs de provence ingredients	recipe for herbes de provence	herb d&#39;provence	homemade herbes de provence
11157	Make an Oil Lamp	make kerosene lamp	repair oil lamp	convert oil lamp	make oil heater	display oil lamp	buy oil lamp	make oil candle	make can of tuna
1115868	Make Lavash	lavash dough	lavash recipe	lavash bread pizza	lavash sandwich	make lavash pizza	lavash calories	make armenian lavash	noon lavash
1117895	Make Homemade Pom Poms	homemade yarn pom poms	make string pom poms	how to make pom poms out of construction paper	ball pom poms	homemade pom pom maker	make best pom poms	like a pom pom	diy cheerleading pom poms
111838	Select a Go Kart Racing Gear Using Gears and Tires	go kart racing gear for kids	pocket bike racing gear	atv racing gear	go kart racing apparel	go kart racing gear ratio chart	go kart racing suits
1118979	buy carpet	buy carpet online	home depot	empire carpet	lowes	carpet prices	how much does carpet cost	buy rug	home depot carpet
1118986	test for diabetes	online test for diabetes	how do doctors test for diabetes	ogtt test for diabetes	urine test for diabetes	test for diabetes type 1	home test for diabetes	quiz diabetes	test for diabetes type 2
1121148	Enjoy a Visit to Goa	visit goa in monsoon	visit goa in march	visit goa in july	visit goa in january	visit to goa in december	visit to goa essay	visit goa in august	visit goa in september
1121960	Control Your World	who control the world banking system	make my world	how to control the world population	who control the world economy	do jews control the world	control the world with your mind	people who control the world	get my world
1123143	Tolerate Getting Wisdom Teeth Pulled	getting wisdom teeth pulled scared	after getting wisdom teeth pulled	getting wisdom teeth pulled recovery time	does getting wisdom teeth pulled hurt	getting wisdom teeth pulled cost	getting wisdom teeth pulled without anesthesia	getting wisdom teeth pulled awake	getting wisdom teeth pulled what to expect
1123205	cure dry hair	cure damaged hair	cure hair loss	cure oily hair	ways cure dry hair	cure dry scalp	cure very dry hair	cure frizzy hair	cure dry and damaged hair
1124979	Negotiate a Job Offer That Involves Relocation	how to negotiate a job offer salary	how to negotiate a job offer via email	job offer negotiation strategies	how to negotiate a job offer with a counter offer	how to negotiate a job offer salary letter	how to negotiate a job offer vacation	how to negotiate a job offer over the phone	how to negotiate a job offer what to say
112607	hit a home run	hit a homerun game	hit a homerun in spanish	first person to hit a homerun	youngest player to hit a homerun	hit a homerun synonyms	has pujols hit a homerun yet	easiest ballparks to hit a homerun	hit a homerun in first major league at bat
1126110	Be a Reclusive Author	reclusive author j.d. salinger	top 10 most reclusive celebrities	most reclusive authors
1128280	decorate a livingroom	redecorate living room	decorate a living room wall	decorate living room photos	decorate small living room	decorate modern living room	decorate a living room online	decorate a living room window	decorate a living room on a budget
1129308	get paid to travel	get paid to travel abroad	get paid to take surveys	get paid to travel the world for free	get paid to travel and take photos	get paid to travel the world	travel careers	get paid to drive	get paid to travel jobs
1129868	download i-tunes	download tunes of mahabharat serial	itunes download	tunes download free	download mp3 tunes	download tunes of mahabharat star plus	download tunes for mobile	limewire download	download tunes of guitar
113084	Steal a Base	steal a base game	steal a base steal a taco	steal a base rangers	can you steal a base on a walk	when can a runner steal a base	best way to steal a base	taco bell steal a base	can you steal a base in softball
1134177	qualify for medicaid	medicaid income guidelines	qualify for medicaid pregnancy	transferring assets to qualify for medicaid	how does a person qualify for medicaid	medicaid qualifications	qualify for medicaid michigan	qualify for medicaid nursing home	qualify for medicare
1137924	build free websites	wicks website	make your own website for free	gmail websites	how do you make your own website	free website templates	my freewebs	weebly login	free website builder
1140091	gain flexibility	long does take gain flexibility	long gain flexibility	much flexibility can you gain	gain flexibility your hips	gain flexibility your legs	how to gain flexibility fast	cheer flexibility	gain flexibility with power yoga
1144176	Use Your Digital Camera's ISO Setting	dslr camera iso setting	digital camera iso comparison	digital camera iso chart	digital camera iso meaning	camera iso setting explained	nikon iso setting	digital camera iso range	what is the best iso setting for digital camera
1144914	Enjoy a Snow Day	
1146291	ghost a hard drive	ghost external hard drive	how to image a hard drive using ghost	norton ghost hard drive	how to ghost image a hard drive	ghost a hard drive windows 7	norton ghost	ghost laptop hard drive	how to use ghost to clone a hard drive
1147796	Paint Laminate Cabinets	how to paint laminate cabinets to look like wood	paint laminate cabinets white	spray paint laminate cabinets	paint formica cabinets	paint laminate kitchen cabinets	paint laminate cabinets without sanding	paint laminate cabinets before and after	paint laminate bathroom cabinets
1147817	sell an idea	sell an idea to google	sell an idea to apple	sell an idea for an app	ways to sell an idea	sell an idea for an invention	how to patent and sell an idea	sell an idea to facebook	do sell an idea
1147818	sell jewelry	sell engagement ring	sell jewelry online	sell diamond jewelry	sell handmade jewelry	sell diamonds	sell diamond ring	sell jewelry from home	jewelry parties
11485	Make Jello Cake	jello cake pan	make jello poke cake	make jelly cake	jello cake recipe	strawberry jello cake	lemon jello cake	make pudding cake	make white cake
1150778	look good in a bikini	would i look good in a bikini	do i look good in a bikini	have a bikini body	look good in a bikini fast	exercises to look good in a bikini	wear bikini	look good in a bikini tomorrow	will i look good in a bikini
1151604	report phishing	report spam	report phishing phone calls	report phishing to yahoo	report phishing apple	report phishing means	report phishing gmail	report phishing text message	report phishing fbi
1151606	whitewater raft	saturn whitewater raft	inflatable raft	best place to whitewater raft	whitewater raft for sale	whitewater raft brands	used whitewater raft	whitewater raft reviews	nrs
1151664	Write a Creative Diary	creative diary entries	creative diary titles	creative diary 2014	creative diary ideas	creative writing journal	creative diary covers	creative diary design	creative writing journal prompts
1152172	Search for Last Minute Cruise Deals	royal caribbean last minute cruise deals	last minute all inclusive cruise deals	last minute disney cruise	last minute vacation deals	last minute celebrity cruises	last minute carnival cruise deals	last minute travel deals	last minute cruise packages
1153175	Make Indian Dry Mutton	how to make indian mutton curry	dry mutton recipe in hindi	dry mutton recipe in urdu	dry mutton fry	dry mutton recipes indian	dry mutton recipe sanjeev kapoor	dry mutton recipe in marathi	mutton dry recipe youtube
1156408	send dried flowers	dried flowers bulk	dried flower wreaths	dried flower bouquet	dried flowers wholesale	roxanne&#39;s dried flowers	dried pressed flowers	dried flowers for sale	how to preserve dried flowers
1156730	Become a Magistrate	becoming a judge	become a magistrate application form	can become a magistrate	qualifications become a magistrate	become a magistrate judge	do you become a magistrate	training become a magistrate	duties of a magistrate
1158147	Throw Your Friend	
11593	listen to music	listen to music lyrics	listen to youtube	listen to music songs	listen to country music	listen to free music online without downloading	listen to hip hop music	listen to r&amp;b music	listen to music at school
1159373	Listen to KISS 95.1 on the Computer	kiss 95.1 listen online	kiss 95.7 listen live	kiss 95.1 listen live
1160300	divorce in california	divorce in california forms	divorce records in california	legal separation in california	divorce advice	uncontested divorce in california	cost of divorce in california	filing for divorce in california	divorce laws
1161348	Convert Video to Sony Psp Video Mp4 Format With Avs4You Software	
116162	Choose a Wedding Officiant	wedding officiant speech	wedding officiant license	wedding officiant script	become a wedding officiant	wedding officiant non religious	wedding officiant cost	pick wedding officiant	become a wedding officiant online
116596	create a super hero	create a character	create a car	create a hero	create a monster	create a superhero team	create a south park character	create a person	create a avatar
1169307	open a checking account	free checking account	best bank to open a checking account	open a checking account without chexsystems	open a checking account online with no deposit	open a checking account and get 200	how old to open a checking account	open a checking account with bad credit	open checking account deals
117223	Accept a Close Friend's Sexual Orientation	
1173504	Think of a Good wikiHow Article to Write	how to write a story wikihow	best wikihow articles
117372	Host a Birthday Sleepover	birthday sleepover invitation wording	birthday sleepover ideas for 12 year olds	birthday sleepover ideas for 13 year olds	birthday sleepover stabbing	birthday sleepover ideas for boys	birthday sleepover ends with 12-year-old close to death	birthday sleepover at hotel	birthday sleepover ideas for 15 year olds
1176576	Kiss an Enemy	
1178431	shoot the moon	shoot the moon hearts	shoot the moon norah jones	shoot the moon card game	shoot the moon meaning	shoot the moon lyrics	shoot the moon vests	shoot the moon game	shoot the moon dominoes
1181532	build a closet	home depot	build a closet online	design a closet	framing a closet	build a closet organizer	build wardrobe closet	build a closet in a bedroom	ikea
1181540	sell insurance	sell insurance from home	sell insurance from home jobs	how to sell insurance independently	sell life insurance	sell commercial insurance	sell car insurance	sell insurance online	sell health insurance
