2652509	Find the Volume of an Irregular Object Using a Graduated Cylinder	how to find the volume of an irregular object that floats	how to find volume of an irregular object without using water	how do you find the volume of a irregular object	how to find the volume of a liquid using a graduated cylinder	how to find the volume of a regular object	describe how you can use a graduated cylinder to measure the volume of an irregular object	how to find the volume of an irregular object that dissolves in water
2654122	flamenco dance	flamenco dance history	flamenco dance facts	flamenco dance steps	flamenco guitar	flamenco music	flamenco dance youtube	flamenco history	flamenco dance video
2655358	Take Your Medicine Every Morning	
268798	Make a Program in AppleScript	applescript application dictionary	how to make an applescript run automatically	applescript application	applescript application commands	applescript application to front	applescript application properties	applescript application system events	applescript application icon
2689248	Wear a Blazer Like a Fashionista	how to wear a navy blazer	how to wear a blazer professionally	how to wear a blazer pinterest	how to wear a blazer with a collared shirt	how to wear a blazer men	how to wear a blazer casually	how to wear a blazer with jeans	how to wear a black blazer
2699516	buy and sell books	sell my books for cash	buy and sell books in recto	amazon sell books	half price books	buy and sell books seneca	buy sell old books	buy and sell textbooks	buy and sell books for profit
269998	Keep Someone from Breaking Into Your Car	breaking into a car trunk	breaking into a car without damaging it	breaking into a car boot	breaking into a car law	breaking into a car with a screwdriver	breaking into a car with a plunger	breaking into a car with a tennis ball	breaking into a car dog
27033	Make Friends All over the World	random pen pal	want make friends all over the world	find friends worldwide	meet people around the world online	how to make friends over 50	top friendship sites	make friends around the world online	top friendship websites
2704102	buy a car with bad credit	bad credit auto loans	buy a car with no credit	buy a car with bad credit and no money down	carmax	carmax bad credit	used cars for sale	buy a car online	buy a car with bad credit and no license
270866	pitch from the stretch	pitch from the wind up	pitch from the stretch mean	what does it mean to pitch from the stretch	pitch from the stretch vs windup	pitch the windup	fast pitch stretch	pitch from the stretch in baseball	have perfect pitching mechanics stretch
2711495	regrow hair	empress regrow	propecia	regrow hair products	regrow hair naturally	does rogaine work	minoxidil	regrow hair for men	regro hair products
2718147	get someones attention	quotes to get someone&#39;s attention	get someone&#39;s attention twitter	how to get someone to like you	the best way to get someone&#39;s attention	how to get a guy attention	say get someone&#39;s attention	can get someone&#39;s attention	how to get someone attention on facebook
2735918	decorate easter baskets	easter basket with curls	easter basket for a toddler	boys easter baskets	how to make an easter basket	homemade easter basket ideas	easter craft ideas	easter crafts	how to make easter decorations
274239	Sell World of Warcraft Accounts Effectively	trade world of warcraft accounts	how much do world of warcraft accounts sell for	sell runescape accounts	how to sell world of warcraft characters	sell world of warcraft gold	auction world of warcraft accounts	buy and sell world of warcraft accounts	sell wow accounts
274323	Go From Geek to Chic	geek chic clothing	geek chic style	how to go from geek to hot	geek chic daily	geek chic sword	geek chic shark tank	geek chic glasses	geek chic blog
2745727	french manicure toes	french tips toes	solar french manicure	french manicure fashionable	acrylic nails toes	french pedicure toes	french manicure airbrush	french manicure toes at home	pedicure toes
276815	have some fun	have some fun lyrics	have some fun dj felli fel	have some fun music video	have some fun mp3	have some fun lyrics pitbull	have some fun sheryl crow	have some fun juicy j	have some fun dj felli fel mp3
2775911	fold shirts	fold shirts for travel	fold polo shirts	fold shirts like stores	fold t shirts	best way to fold shirts	fold shirts like a ninja	fold dress shirts	fold shirts with cardboard
277600	make a box and whisker plot	make a box and whisker plot online free	make a box and whisker plot of the data 67 57 52	make a box and whisker plot in excel	make a box and whisker plot of the data 67 57	make a box and whisker plot worksheet	make box and whisker plot online	make a box and whisker plot of the data 24 18 29	make a box and whisker plot in excel 2013
2776276	Make Sweet Lemonade	how to make sweet lemonade with lemon juice	how to make sweet lemonade without sugar	make the lemonade cleanse	how to make homemade lemonade	sweet lemonade recipe	sweet lemonade lyrics	sweet lemonade joelle james	how to make sweet tea
277685	Use Modbus Protocol	basics of modbus	modbus protocol tutorial	modbus dos	open modbus protocol	modbus command format	modbus howto	modbus protocol interview questions	modbus protocol analyzer
2795192	booty clap	
280522	Say Hello in Russian	say hello in korean	say hello in spanish	say hello in german	say thank you in russian	say hello in different languages	say hello in italian	do you say hello in russian	say goodbye in russian
28073	stick fight	stick fight animation	xiao xiao	stick fight game	stick games	stick fight unblocked	stick fight videos	stick death fight	stick fight games online
2809151	retire in mexico	retire in mexico cost of living	homes for sale in mexico	retire in mexico on social security	retire in mexico 2014	lake chapala jalisco	retire in mexico blogs	how much does it cost to retire in mexico	retire in belize
2809997	Be Kind to Others Without Looking Like a Sycophant	
281142	Be Like Manny Santos from Degrassi	
281309	read manga	read yuri manga	read manga naruto	read manga books	read magi	read bleach manga	read manga one piece	read bleach	read manga books online
2813129	Create a Flash Slideshow with Kvisoft Flash Slideshow Designer	
28144	Make a No Bake Chocolate Peanut Butter Ball	vegan no bake chocolate peanut butter cookies	no bake chocolate peanut butter cookies without milk	no bake chocolate peanut butter fudge	no bake chocolate peanut butter oatmeal balls	no bake chocolate peanut butter cookies	healthy no bake chocolate peanut butter balls	no bake chocolate peanut butter cookies with chocolate chips	no bake chocolate peanut butter bars
281506	find money	best places to find money	unclaimed money	find money owed to me	find money owed to you	find money owed to me for free	find money now	i need money	free money
281523	Be Confident and Popular in Private School	
2828	become a mortician	become a medical examiner	how many years does it take to become a mortician	become a funeral director	mortuary science	do you become a mortician	what do you have to do to become a mortician	become a mortician online	mortician salary
283899	play swords	play swords and sandals 3	play swords and sandals 4	play swords and sandals hacked	foam swords	play pirate swords	play swords and sandals 2	nerf swords	toy swords
2839404	Be a Complete Noob	
284150	bubba scrub	bubba scrub pictures	bubba scrub youtube	motocross scrub	scrub jumps	bubba scrub budds creek	james stewart	james stewart bubba scrub	bubba scrubs and whips
284580	do it yourself	do it yourself projects	do it yourself crafts	instructables	do it yourself electronics	do it yourself clothing	do it yourself magazine	do it yourself car repair	do it yourself decorating
2858254	Make a Basil Berry Martini Cocktail	
2858878	Become an Admin, Owner, or Guest on Your Bukkit Server	
2863266	build a church	build a church craft	build a church online	build a church in africa	build a church in a day	build a church website for free	how to build a church website	build a church pulpit	build a church app
287045	Play Fetch With Your Cat	does your cat play fetch	cats object permanence	cats play fetch too	fetch cat sitting	fetch cat food
2871472	Pack for a Airplane Ride	airplane ride on toy little tikes	airplane ride at lagoon	first airplane ride	airplane ride simulation	airplane ride share	airplane ride waiver	airplane ride with toddler	airplane ride motion sculpture lamp
2885673	Eat Healthily at a Japanese Restaurant	how to eat healthily at university	how to eat healthily at a festival	how to eat healthily when pregnant	how to eat healthily on a budget	how to eat healthily on a low budget	how to eat healthily and lose weight	how to eat healthily at uni	how to eat healthily on £1 a day
289902	Not Watch T.V. when You Are Grounded	
2900145	fly standby	can you still fly standby	fly standby cheap	fly standby southwest	fly standby american airlines	fly standby delta	fly standby jetblue	fly standby united	best days fly standby
2910960	price used cars	maxie price used cars	price used motorcycles	ray price used cars	price used cars wetumpka al	low price used cars	edmunds	fair purchase price used cars	kelley blue book
2916	Paint Wallpaper Using Gardz	
2916022	Make Poor Man's Brew	
2930547	Upgrade to Snow Leopard	upgrade to snow leopard online	upgrade to snow leopard download	should i upgrade to snow leopard	upgrade to snow leopard free	upgrade to snow leopard without losing data	upgrade to snow leopard without disc	upgrade to snow leopard without dvd	upgrade from tiger to snow leopard
2932159	Send Video Messages on Kik	how to delete individual messages on kik	how to delete messages on kik	kik chain messages	how to delete messages on kik on iphone	messages on kik wont send	how to delete messages on kik on ipad	dirty chain messages for kik	kik messages to forward
293438	Make Low Fat Mousse	low calorie chocolate mousse	taste of home pumpkin mousse	make craving for chocolate	low carb mousse recipe	low carb mousse
29413	become a notary	how long does it take to become a notary	become a notary wisconsin	reason to become a notary	become a notary online	notary salary	how much does it cost to become a notary	notary fees	become a notary in texas
2947492	Make Grilled Puffer Fish in Harvest Moon: Animal Parade	harvest moon animal parade cooking	harvest moon animal parade cooking contest
2960955	Make an Animated GIF Banner with GIF Banner Maker	animated gif maker open source	animated gif maker freeware	animated gif banner maker software free download	animated gif maker mac	animated gif maker youtube	animated gif banner maker online	animated gif maker from video	animated gif maker text
2962568	Make Grilled Barracuda in Harvest Moon: Animal Parade	harvest moon animal parade cheats	harvest moon animal parade review	harvest moon animal parade bells	harvest moon animal parade recipes	harvest moon animal parade characters	harvest moon animal parade marriage	harvest moon animal parade bachelors	harvest moon animal parade walkthrough
2970384	Win a Civil Lawsuit	how to win a civil case without a lawyer	how to win the lottery	how to win a civil lawsuit for credit card debt
297106	be a better dancer	how to be a better dancer at club	how to become a stronger dancer	how to be a better daughter	how to be a better hip hop dancer	how to be a better dad	how to be a better ballet dancer	how to be a good dancer	how to become a better dancer
297647	quit smoking	quit smoking patch	quit smoking pills	quit smoking tips	quit smoking products	what happens when you quit smoking	quit smoking methods	quit smoking cold turkey	benefits of quitting smoking
2988329	find out if someone has a crush on you	how do you know if a guy has a crush on you	how to know if someone has a secret crush on you	how do you know if a boy has a crush on you	someone has crush you quiz	how to find out if someone has a criminal record	how to find out if someone is married	how do you know if someone has a crush on you	how to find out if someone has a crush on you test
2992420	Make Drawstring Bag with Lace Edge	how to make a drawstring bag without sewing	how to make a drawstring bag out of duct tape	how to make a drawstring bag with a round bottom	how to make a drawstring bag for kids	how to make a drawstring bag out of a t shirt	how to make a lined drawstring bag	how to make a drawstring bag by hand	how to make a double drawstring bag
299291	Do a Wheelie on a Ripstick	
2997517	Make Mushroom Soup in Harvest Moon: Animal Parade	harvest moon animal parade cheats	harvest moon animal parade review	harvest moon animal parade bells	harvest moon animal parade recipes	harvest moon animal parade characters	harvest moon animal parade marriage	harvest moon animal parade bachelors	harvest moon animal parade walkthrough
2998661	Sign Up for AirBNB	airbnb sign up bonus	airbnb sign up with email	airbnb sign up coupon	airbnb registration fee	airbnb sign up code	airbnb sign up credit	airbnb sign up with facebook	airbnb register property
3003	record a cd	vinyl record cd	record music cd	record audio cd	record player cd	record dvd	record music	record cd software	record a cd party
300399	download ringtones	download funny ringtones	download bollywood ringtones	download ringtones samsung	download ringtones blackberry	verizon ringtones	download ringtones for iphone	download ringtones for android	download mp3 ringtones
3007043	build a mouse maze	mouse maze game	mouse maze designs	mice food maze	mouse maze experiment	mouse maze cheese	project mouse maze	build a mouse car	mouse in a maze science fair project
300726	cross over	crossover movie	crossover basketball	crossover audio	crossover mac	crossover vehicles	crossover download	crossover games	crossover cars
3016472	Bring a Stuffed Animal Home	how to take care of your stuffed animal	large stuffed animal dog	make stuffed animal dog	how to take care of a stuffed animal	stuffed animal dog bulk	stuffed animal cat	stuffed animal dog breeds	stuffed animal dog
3024472	Celebrate the Bright Autumn Festival	bright autumn festival 2014	bright autumn festival 2013
302573	Survive an Internship in Elementary Education	
3035762	Make Chestnut Rice in Harvest Moon: Animal Parade	harvest moon animal parade cheats	harvest moon animal parade review	harvest moon animal parade bells	harvest moon animal parade recipes	harvest moon animal parade characters	harvest moon animal parade marriage	harvest moon animal parade bachelors	harvest moon animal parade walkthrough
3036902	Make Omelet Rice on Harvest Moon: Animal Parade	harvest moon animal parade cheats	harvest moon animal parade review	harvest moon animal parade bells	harvest moon animal parade recipes	harvest moon animal parade characters	harvest moon animal parade marriage	harvest moon animal parade bachelors	harvest moon animal parade walkthrough
303743	Measure Your Torso to Fit Your Backpack	
3039532	Lessen the Chance of Evil Doers Coming Into Your Home	
3043395	find old movies	find all movies	find old movies by plot	find old movies on dvd	do you find old movies	find old horror movies	find new movies	find classic movies	find old movies online
3045719	Sing a Song to Your Crush	songs to sing to your guy crush	country song about a crush	song crush lyrics	songs to sing to my crush	songs to dedicate to your crush	song about a crush on a boy	whats a good song to sing to your crush	song about a crush not liking you
3049339	Log Into the Wikipedia IRC Channel on Freenode.Net	
3052956	Judge First and Second Prize in a Sports Raffle	
3053234	Find Out About Animes	find anime movies	find anime network	find good anime	find anime i like	find anime to watch	find anime online	find anime pictures	find anime conventions
305743	Play "The Sign" on an Acoustic Guitar	playing acoustic guitar outside	playing acoustic guitar in apartment	playing acoustic guitar quietly	playing acoustic guitar with small hands	playing acoustic guitar with a slide	playing acoustic bass guitar	playing acoustic guitar in the rain	playing acoustic electric guitar
3068185	live your best life	live your best life book	live your best life quotes	live your best life ever	live your best life now	live your best life poem	live your best life tour	live your best life today the fault in our stars	live your best life challenge
307110	Search for Available Domain Names	search available domain names free	domain name search engine	search for available domain names by keyword	domain search tool	domain checker tool	domain spinner	domain availability tool	domain finder
3071577	Add Item Modifiers on Square	
3073187	make a thank you card	make a thank you card online for free and print	make a thank you card for teacher	free thank you cards	make a thank you card for your teacher	make wedding thank you card	make a thank you card in word	craft thank you card	make a thank you card with photo free
308278	save the rainforest	save the rainforest organizations	save the rainforest foundation	save the rainforest facts	ways to save the rainforest	save the rainforest for kids	save the rainforest video	why should we save the rainforest	save the rainforest slogans
3084689	Properly Prepare a Hookah	where do you put the coal in a hookah	lighting a hookah	how to setup a hookah
309615	Make Beetroot Dip	healthy beetroot dip	beetroot yogurt dip	beetroot tahini dip	hot to make beetroot dip	beetroot dip calories	nice beetroot dip	fig dip	party food beetroot dip
309748	Do a Flip Turn (Backstroke)	how to do a breaststroke flip turn	backstroke flip turn video	how to do a freestyle flip turn	how to do a backflip	backstroke flip turn rules	backstroke flip turn rule change	backstroke flip turn lesson plan	backstroke technique
310831	Make a Short Hairstyle Cute	how to make cute hairstyles for short hair	cute long hairstyle	cute medium length hairstyle	cute short hairstyle for round face	cute medium hairstyle	cute short haircuts 2014	how to make short hair look cute	cute short hairstyle ideas
311782	set up a 401k	how to start a 401k plan	how to set up a 401k for a small business	how much can an employer contribute to a 401k	how to set up a 401k on your own	single 401k	small business 401k	does an employer have to contribute to a 401k	starting a 401k
313621	buy a book	buy a book get kindle version free	buy a book of shadows	buy a book of business financial advisor	buy a book on ipad	buy a book online	buy a book on kindle ipad	buy a book of stamps	buy a book on kindle
313847	Be Like Phoebe Halliwell	phoebe halliwell and cole turner	how to be like piper halliwell	phoebe halliwell age	phoebe halliwell mermaid	phoebe halliwell makeup	phoebe halliwell quotes	phoebe halliwell baby	phoebe halliwell powers
3142190	Be a Good Blue Peter Presenter	blue peter presenter simon	blue peter presenter gymnastics	blue peter presenter drugs	blue peter presenter job	blue peter presenter auditions	blue peter presenter suicide	blue peter presenter lindsey russell	blue peter presenter 2013
3150381	Do the "Fake iPad" Prank	how to make a fake ipad mini	how to make a fake ipad
3154362	mix songs	mix love songs	mix songs together online	mix songs online	mix songs together	party mix songs	mix mp3 songs	mix songs 2014	mix songs software
3162796	Uninstall the Sims 2 on PC	uninstall sims 2 patch	how to uninstall sims 2 apartment life	uninstall sims 2 downloads	how to uninstall sims 2 and expansions	how to uninstall sims 2 expansion packs	uninstall sims 2 pets	how to uninstall sims 2 ultimate collection	how to uninstall sims 2 without disk
31635	Clean and Disinfect Wooden Cooking Utensils	wooden cooking utensils set	wooden cooking utensils vs plastic	wooden cooking utensils bacteria
31639	deliver a baby	deliver a baby video	ways to deliver a baby	cost to deliver a baby	deliver a baby game	deliver a baby at home	deliver a baby game for adults	deliver a baby in water	virtual deliver a baby game
316961	Make a Three Fold Duct Tape Wallet	how to make a duct tape women&#39;s wallet	how to make a duct tape bifold wallet	make easy duct tape wallet	how to make a duct tape wallet youtube	duct tape wallet designs	duct tape wallet template	how to make a trifold duct tape wallet with pockets	how to make a trifold wallet out of duct tape
3175686	Hold and Create a Presentation As a Teen	
318064	Decorate Your Camp Cabin	summer camp cabin themes	rustic cabin decor	lake cabin decorating ideas	cabin decor outlet	make camp cabin seem more like home	small cabin decorating ideas	decorate camping trip	camp cabin decorating ideas
3192523	open a .dat file	open a .dat file mac	what program do i use to open a dat file	.dat file format	open a .dat file in matlab	how to read .dat files in windows	open a .dat file in excel	what program will open a .dat file
319271	play monopoly	play monopoly without downloading	play monopoly online with friends	play monopoly with friends	download monopoly	play monopoly 3	play monopoly online free no download	play monopoly against computer	play monopoly mcdonalds
319769	stop foreclosure	stop foreclosure sale	stop foreclosure government help	foreclosure assistance	loans to stop foreclosure	stop foreclosure now	stop foreclosure sale date	stop foreclosure program	does chapter 13 stop foreclosure
3208594	find a business address	four 11	find business ip address	find a consumer address	find business street address	find business yellow pages	find business zip code	find a business address by ein	find business reverse address
3218704	tan naked	
3242066	Make Lumberjack Nails	
324825	Overcome Fear of Disease	how to overcome fear of heights	how to overcome fear of rejection	overcome fear the doctor	how to overcome fear of fighting	how to overcome fear of failure	how to overcome fear bible	overcome fear getting disease	how to overcome fear of public speaking
3260106	Find Old Records of Christmas Music	
326859	Do a Superman on a Dirtbike	how much does a dirt bike cost	how to do a wheelie on a dirt bike with a clutch	how to do a stoppie on a dirt bike	how to do a backflip on a dirt bike	how to do a wheelie on a dirt bike	how to do a burnout on a dirt bike	how to do a wheelie on a dirt bike without a clutch	how to do a whip on a dirt bike
326955	Have a Small Waist No Matter the Body Type	
3271463	Prepare for a Baton Twirling Competition	baton twirling championships	baton twirling supplies	baton twirling competition 2014	baton twirling competitions 2015	baton twirling tricks	baton twirling competition videos	baton twirling competition dresses	baton twirling competitions 2013
328479	Look Like Whitney Port from "The Hills"	
3298960	Look Like Candice Swanepoel	candice swanepoel no makeup	candice swanepoel hair	candice swanepoel 2010	look like candice swanepoel video	does i look like candice swanepoel	candice swanepoel eyebrows	how to get candice swanepoel makeup look	candice swanepoel makeup tips
3303216	Make a Successful Group in Roblox	how to make a good group on roblox	roblox how to make a group only team	how to make a group on roblox 2012	roblox how to make a group fort	how to make a group on roblox without bc	roblox how to make a group logo	how to make a group on roblox 2014	roblox how to make a group place
3307452	Find Building Ideas for Minecraft	list of building ideas for minecraft	building ideas for minecraft pocket edition	easy building ideas for minecraft	building ideas for minecraft city	building ideas for minecraft pe	building ideas for minecraft survival	building ideas for minecraft ps3	building ideas for minecraft xbox 360 edition
3318814	lose weight while breastfeeding	diet pills while breastfeeding	lose weight while breastfeeding calculator	lose weight while breastfeeding meal plan	unable to lose weight while breastfeeding	can&#39;t lose weight while breastfeeding	eat well lose weight while breastfeeding pdf	fastest way to lose weight while breastfeeding	weight watchers while breastfeeding
33191	Bring out Natural Red and Blond Highlights	how to bring out natural red highlights in brown hair	brown hair with red highlights pinterest	how to bring out natural highlights in your hair
3322667	Overcome Your Carnal Problems and Have a Blissful Relationship with Your Partner	
332750	Beat the Mission Keep Your Friends Close on Vice City	
3328262	sell a business	business brokers	sell a business on ebay	how to sell a business quickly	small business for sale	how to sell a business fast	how much do you sell a business for	best way to sell a business	sell my business
3331810	Role Play Zombie Apocalypse	zombie apocalypse minecraft	zombie apocalypse quiz	zombie apocalypse roleplay ideas	zombie apocalypse movie	zombie apocalypse survival guide	zombie apocalypse roleplay game	zombie apocalypse roleplay starter	zombie apocalypse role playing game
333195	snipe hunt	snipe hunt definition	snipe bird	snipe hunting games	snipe hunt drinking	snipe hunt media	snipe hunt to kill a mockingbird	snipe hunt examples	snipe hunting rules
334730	Move to the Netherlands	relocation package netherlands	move to the netherlands forum	relocation to moving	move to the netherlands history	jobs in the netherlands
335525	learn chinese in china	learn chinese in 5 minutes	learn chinese in china cheap	learn chinese in china summer	learn chinese in china for free	learn chinese in taiwan	learn chinese in china scholarship	learn chinese in china language schools	learn chinese in china university
3362492	Be Your Sailor Moon Self	
3364372	Achieve an Achievement Badge in Cub Scouts (Boy Scouts)	requirements for boy scout merit badges	can cub scouts earn merit badges
33675	Tie a Hojojutsu Bundle	
338294	Register a Company in Kenya	registration of companies in kenya	requirements for registering a company in kenya
3385100	Send Cad©Cam Files with LeapFILE	
3387144	sue your employer	sue your employer for wrongful termination	sue your employer for hostile work environment	top reasons sue your employer	should you sue your employer	reasons to sue your employer	sue your employer for stress	successfully sue your employer	sue your employer harassment
