509377	Film a Kung Fu Fighting Scene (Kids)	kung fu fighter movie wiki	kung fu fighting movie	kung fu fighter 2013	foo fighters kung fu fighting	kung fu panda movie	kung fu hustle	kung fu fighter 2007	kung fu fighter movie 2014
510113	be real	be real crossword clue	be real meaning	be real urban dictionary	be reel	be real bet	be real rick bezet	be real tv	be real shoes
5106101	Avoid Being Tricked by a Garage Door Repair Company	garage door opener company	garage door service company
511001	Make a Internet Browser With Realbasic 2008	
5111501	believe in magic	believe in magic quotes	believe in magic song	believe in magic you muggle	believe in magic chords	got to believe in magic lyrics	believe in magic jim jones	believe in magic coldplay	believe in magic lyrics
513758	Improve Your Tone on the Flute	how to play flute better	improve saxophone tone	improve guitar tone	improve trumpet tone	improve clarinet tone	improve violin tone
513836	Make Mushroom Broccoli Casserole	paula deen&#39;s broccoli casserole	broccoli mushroom rice casserole	healthy broccoli mushroom casserole	chicken mushroom broccoli casserole	broccoli mushroom soup casserole	broccoli mushroom casserole vegan	broccoli mushroom casserole moosewood	broccoli mushroom casserole low carb
514745	make coffee syrup	make coffee concentrate	bake coffee syrup	easy coffee syrup	coffee syrup recipe	boil coffee syrup	make tea syrup	make coffee milk	coffee syrup ingredients
5149130	Animate in Pencil 2D Animation Software	pencil 2d animation software review	pencil 2d animation software free download mac	pencil 2d animation software free download for windows 7	pencil traditional animation software	pencil 2d animation tutorial pdf
516373	Get Special Pet Foods in Webkinz	
516635	Make Rose Madeleines With Glittered Honey Lemon Glaze	
516749	Store Partially Baked Bread	par baked bread recipe	half baked bread	par baked bread wholesale	par baked bread suppliers	half baked bread trader joe&#39;s	how to finish par baked bread	par baked bread rolls	par baked bread
5173601	learn italian	learn italian audio	learn italian online free audio	italian phrases	italian dictionary	learn italian phrases	learn italian software	learn basic italian	learn italian online free
5178516	Travel the World Safely Alone As a Woman	
517867	Make Blueberry Banana Bread	vegan blueberry banana bread	buttermilk blueberry banana bread	great blueberry banana bread recipe	blueberry banana bread with yogurt	blueberry banana bread greek yogurt	healthy blueberry banana bread	blueberry banana bread with oatmeal	blueberry banana nut bread recipe
518730	Play Truth or Dare at a Sleepover	
518909	bend it like beckham	bend it like beckham soundtrack	bend it like beckham trailer	bend it like beckham game	bend it like beckham full movie	bend it like beckham quotes	bend it like beckham summary	watch bend it like beckham	bend it like beckham watch online
51994	ballroom dance	ballroom dance youtube	types of ballroom dance	ballroom dance styles	ballroom dance crossword clue	ballroom dance lessons	ballroom dance steps	ballroom dance dresses	ballroom dance history
521321	Pass a Class Without Really Studying	
521972	repair hardwood flooring	repair carpet	can repair hardwood flooring	split hardwood floor	repair engineered hardwood flooring	repair tile flooring	repair hardwood flooring home	repair laminate flooring	repair bamboo flooring
5224643	watch south park	watch south park faith hilling	watch south park cash for gold	watch south park butterballs	watch south park mobile	watch south park reverse cowgirl	watch south park iphone	watch south park watch series	watch south park jewpacabra
522707	Make a New Dress from an Old Halloween Costume	old halloween costumes ideas	old navy halloween costumes	old greg halloween costumes	old halloween costumes in a box	old halloween costumes plastic	old halloween costumes for sale	2 month old halloween costumes	old people halloween costumes
5236	Make Yard Sale Signs	make printable yard sale signs	advertise yard sale signs	yard sale signs templates	yard sale signs home depot	signs great yard sale	make yard sale signs free	have yard sale signs	make your own yard sale signs
523870	Improve Your Footwork in Soccer	footwork soccer drills for kids	how to improve footwork in basketball	how to improve footwork in mma	how to improve footwork tennis	how to improve footwork in football	how to improve footwork in cricket	how to improve footwork in boxing	how to improve footwork in lacrosse
5240654	Convert and Play iTunes Movies on Galaxy Note 4 by Using Avs4mac iTunes Converter	
5246820	Keep Away from Water, if You Can't Swim	
52509	Relax Before Singing on Stage	singing stage fright	singing on stage quotes	singing stage forum	how to relax vocal chords for singing	singing on stage for the first time	how to relax before performing	singing stage blog	singing on stage dream meaning
525144	Be a Classical Girl	classic woman	classical baby names	classical boy names
5257913	Own an Imaginary Dragon	imaginary dragons it&#39;s time lyrics	figment the imaginary dragon	history of imagine dragons	imaginary dragon vanguard	imagine dragons demons	imagine dragons	imagine dragon stories	imagine dragon movie
5259311	have a nice day	have a nice day lyrics	have a nice day message	have a nice day quotes	have a nice day in japanese	have a nice day t shirt	have a nice day mick foley	have a nice day in spanish	have a nice day chords
526042	Make a Christmas Tree Snowflake	snowflake christmas tree topper	snowflake christmas tree lights	snowflake christmas tree ornaments	snowflake christmas tree decorations
5266292	get rid of urine smell	get rid of urine smell in mattress	get rid of urine smell in yard	get rid of urine smell in bathroom	get rid of urine smell in carpet	get rid of urine smell in clothes	get rid of urine smell in wood	get rid of urine smell outside	get rid of human urine smell
526661	Draw a Black Cat	draw a webkinz cat	draw a black cat in soft pastels	draw cartoon black cat	how to draw train heartnet	draw halloween black cat	draw realistic black cat	step draw black cat	how to draw black cat marvel
5268708	Be a True Warrior Cats Cat	warrior cats what cat are you	warrior cats cat maker	warrior cats clan	warrior cats cat creator	warrior cats cat generator	warrior cats clan game	warrior cats clan symbol maker	warrior cats clan names
52806	stamp concrete	stamp concrete tools	stamp concrete mats	stamp concrete molds	stamp concrete prices	stamp concrete forms	how to stamp concrete yourself	stamp concrete cost	stamp concrete sealer
5287223	catch a falling star	catch a falling star john anderson	catch a falling star chords	catch a falling star and put it in your pocket movie	catch a falling star ben 10	catch a falling star song	catch a falling star lyrics	catch a falling star movie	catch a falling star book
5289387	Make Your Software Releases Much Better	
5298200	Get Free Beauty Products	how to get free beauty products to review on youtube	get free beauty products in the mail	how to get free stuff	get free ringtones	get free beauty products to review	get free beauty products online	maybelline sample pack info	get it beauty products 2014
531427	set time	time zones	set time minecraft	set time on kindle fire	est time	set time linux	set time android	set time on ipad	set current time
532757	Make a Trebuchet with Popsicle Sticks	
5328610	do your own pest control	do your own pest control norcross ga	talstar p	do my own pest control coupon	do your own pest control coupon	do your own pest control reviews	diatomaceous earth	do your own pest control coupon codes	do your own pest control bed bugs
5345976	Make Beats Like Kanye West	bio of kanye west	top 10 kanye west beats	what program does kanye west use	kanye west bears	what does kanye west use to make beats	kanye west beats wheelchair basketball team	does kanye west make beats	kanye west&#39;s first beats (disc 1)
534956	buy wine	bevmo	buy wine free shipping	discount wine	buy italian wine	best place to buy wine online	buy wine near me	total wine	best buy wine refrigerator
5353	define love	love quotes	meaning of love	define making love	define fondness	define true love	define real love	definition of love	love poems
5354013	Prevent Abuse	prevent drug abuse	prevent spousal abuse	prevent domestic abuse	prevent abusive relationships	prevent physical abuse	prevent emotional abuse	prevent verbal abuse	thesaurus abuse
5354298	Stand Up from a Bully	how to stand up to a bully at school	how to stand up to a bully at work	how to stand up to a bully boss	what to say to a bully	how to stand up to someone	how to stand up to a bully wikihow	how to stand up for yourself	how to stand up to your parents
5360341	Make Austrian Bullets with Feta Cheese	
536292	Spot if Your Boyfriend Is a User, Cheat or a Player	how to find out if boyfriend is cheating online	how to tell if boyfriend is cheating	how to tell if boyfriend is cheating long distance	how to catch a cheating boyfriend for free	how to find out if boyfriend is cheating
5364011	Pick a Healthy Sugar Glider	is a sugar glider a good pet	sugar glider lifespan	how to pick up a sugar glider	sugar glider nutrition	healthy sugar glider diet	can sugar gliders eat cantaloupe	sugar glider health	sugar glider health risk
5366362	pets and animals	pets and animals for sale	pets and animals 0	pets and animals directory	pets and animals in german	pets dogs	pets and animals 8	pets and animals youtube	pets snakes
537055	Get Your Parents to Sign a Bad Report Card Without the Nagging	
537381	Write a Captivating CV for Jewellery and Watch Jobs	
537750	Know if a Beer is American Made	how to know if beer is expired	how to know if beer is bad	does unopened beer expire	how to know if beer is skunked	how to know if beer is fermenting
538327	Sit Beside a Girl in School	sit beside me quotes	i sit beside the fire and think poem meaning	sit beside me	i sit beside the fire and think poem	sit beside me my only son	i sit beside the fire
5391628	flick .	flick im	flick filosopher	eyebrows on flick	flick peek	dance flick	flick app	dvd flick	flick fishing
539939	read poetry	read love poetry	do you read poetry	read online poetry	must read poetry	read poetry in urdu	read poetry books online	read poetry out loud	read poetry with the melancholy curate and his sister
5418372	Get Over a Prank	how to make a prank trap	make phone prank	make scary pranks	make computer prank	how to make a prank bomb	prank hit by car snopes	rachel gets run over prank	how to make a prank call without getting caught
5420644	Make Holiday Kids' Crafts	easy holiday crafts for kids to make	holiday ornament crafts for kids	holiday crafts for adults	christmas crafts for kids to make	winter crafts for kids to make	holiday crafts for kids to make for parents	holiday craft projects for kids	holiday gifts for kids to make
5421340	Life a Fulfilling Life	live a fulfilling life quotes	live more fulfilling life	live life list	meaning fulfilling life	do live a fulfilling life	encourage fulfilling life	making a life list	lead fulfilling life
542543	sell diamonds	diamond prices	sell diamond jewelry	sell diamonds online	sell loose diamonds	auction diamonds	sell engagement rings	i do now i don&#39;t	diamond appraisal
5433491	Become More Popular than the Other Popular Girls	
544040	Make Nasturtium Flower Sandwiches	nasturtium flower jelly	nasturtium flower edible	nasturtium flower photos	nasturtium flower pesto	nasturtium flower salad	nasturtium flower pictures	nasturtium flower meaning	nasturtium flower recipes
5440574	Be Like Tiffany from Silver Linings Playbook	tiffany silver linings playbook diagnosis	tiffany silver linings playbook mental illness	silver linings playbook tiffany&#39;s coat	tiffany silver linings playbook quotes	silver linings playbook tiffany age	tiffany silver linings playbook monologue	tiffany silver linings playbook hair	tiffany silver linings playbook disorder
5444618	Make a Fairy House from Two Shoe Boxes	
54450	find free stuff online	find free games online	find freebies	find coupons online	get free stuff for free	find free money online	find coupons	find free furniture	find free samples
545145	Make Cinnamon Apple Strips	how to make cinnamon apple slices	how to make cinnamon apples on the stove	how to make cinnamon apples in the microwave	how to make cinnamon apple chips	how to make baked cinnamon apples	how to make healthy cinnamon apples	how to make cinnamon apple chips in a dehydrator	how to make cinnamon apples without brown sugar
545648	Choose a Nickname on a Pet Site	
5456675	find cities	find occupations	find animals	find states	find countries	find names	find cities on same latitude	find cities near me	find cities by latitude and longitude
545832	Start a Humming Bird Club	
5459138	Save Money on Your Air Conditioning Bill	save money air conditioning tips	ways to save on your energy bill
545954	Protect Your Computer With a Firewall	computer firewall free download	free computer firewall protection	how does a firewall protect a computer network from unauthorized access	computer firewall definition	computer firewall software	computer firewall ppt	computer firewall hardware	computer firewall test
546265	Create Masks Using Audio Software	
5468118	best way to train a puppy	best way to train a puppy to use a puppy pad	best way to train a puppy to sit	best way to train a puppy to come when called	best way to train a puppy not to bite	best way to potty train a puppy	best way to train a pitbull puppy	step by step puppy training	best way to train a puppy to walk on a leash
5471177	Not Get wikiHow Users to Hate You	
5474696	Play Flat Notes on the Violin	notes on violin sheet music	how to play fast notes on violin	notes on violin for twinkle little star	music notes violin	notes of violin strings	notes on a violin neck	notes on violin for let it go	how to play notes on violin for beginner
5475145	Identify Entity Types (DBMS)	weak entity types in dbms	types of dbms users	types of dbms languages	types of dbms models	types of dbms interfaces	types of dbms pdf	define entity in dbms	entity type in dbms example
5475404	Warm Up Your Voice: 3 Steps	how to warm up voice fast	warm up voice before speech	how to warm up voice for high notes	3 stages of a warm up	how to warm up voice before singing	warm up voice exercises	how to warm up voice in the morning	3 stages of a warm up in dance
5480683	Watch a Holiday Movie with Others	watch the holiday movie online megavideo	watch the holiday movie online with english subtitles	watch the holiday movie online megashare	watch holiday 2014 movie online	watch the holiday movie 2006	watch holiday hindi movie online	watch holiday movie online hd	watch holiday movie online akshay
5480805	Play Midfield in Girl's Lacrosse	lacrosse midfield drills	lacrosse midfield workouts	lacrosse midfield position	lacrosse midfield pocket	lacrosse midfield dodges	lacrosse midfield stick	lacrosse midfield shooting drills	lacrosse midfield defense
5482010	Take Care of Your Hamster Properly	how to take care of a hamster for beginners	take care golden hamster	how to take care of a hamster video	how to take care of a dwarf hamster	how to take care of a teddy bear hamster	take care hamster babies	take care syrian hamster	how to take care of a hamster for kids
5485899	fake tan	fake tan bottle	fake tan band	fake tan products	fake tan tips	best fake tan	fake tan reviews	fake tan for men	best fake tan lotion
5486013	Visit the Universal Orlando Resort	the point universal orlando resort	universal orlando resort packages	universal orlando resort map	universal orlando resort harry potter	universal orlando resort commercial	universal orlando resort one direction	universal orlando resort jobs	hotels near universal orlando resort
5492699	Roleplay on San Andreas Multiplayer	san andreas roleplay ip	gta san andreas role play	san andreas role play	san andreas roleplay servers	san andreas roleplay script download	san andreas roleplay wiki
5494867	Find a Payday Lender in Los Angeles	money tree los angeles	payday loans online	money store payday loans	payday loans in los angeles	check into cash los angeles	personal loans los angeles	cash advance los angeles	check n go los angeles
5500570	Tie a Re Threaded Figure of 8 with a Stopper Knot	
550068	create a code	create a qr code	create a code breaker	create a secret code	create a code 128 barcode	at&amp;t create a code	create a code of conduct	create a code lyoko character	create a coded message
5501441	crappie fish	crappie fish pronunciation	crappie fish recipes	crappie fish photos	walleye fish	world record crappie fish	crappie fish pictures	crappie fish facts	how to cook crappie fish
5504302	Dispute a Demand from a Debt Recovery Company for a Phone Bill	
5506873	Take Care of a Beta	take care crowntail betta	take care sick betta	how to take care of a betta fish in a bowl	how to take care of betta fish while on vacation	how to take care of a goldfish	how to take care of a betta fish in a vase	take care siamese fighting fish	how to take care of a betta fish youtube
550768	Write a Nature Haiku	nature haiku tumblr	nature haiku for kids	write haiku poem nature	famous nature haiku	nature haiku generator	nature haiku poems 5 7 5	nature haiku poems examples	nature haiku 575
550994	order flowers	order flowers online cheap	send flowers	best place to order flowers	mail order flowers and plants	order wholesale flowers	order flowers free shipping	order wedding flowers	order bulk flowers
5513354	play chess online	play chess online with friend	play chess online against people	play yahoo chess online	play chess online 2 player	play 3d chess online	play chess online against computer	play chess online multiplayer	yahoo chess
551375	Encourage Multiple Cats to Get Along with Each Other	how to make my cats like each other	how to make cats get along with each other
5514264	Make a Vegetarian Taco Pie	vegetarian taco salad dressing recipe	vegetarian taco casserole	vegetarian taco bell	vegetarian taco dip	vegetarian taco soup	vegetarian taco salad with doritos	easy vegetarian taco salad	vegetarian layered taco salad
5520202	Better Understand Fracking	
552250	print posters	print custom posters	print posters at home	print posters costco	print posters online	print posters cheap	print wall posters	print posters bulk	print posters staples
5526402	Gain More Followers and Get More Likes	how to gain followers and likes on instagram	gain followers on twitter instantly	gain followers on twitter free	gain followers on twitter fast	gain followers tumblr	gain followers on twitter without following back	gain twitter followers	gain followers on facebook
553387	Express Anger Without Hurting People	
5535178	Sing Happy Birthday in German	happy birthday song lyrics	sing happy birthday in spanish	sing happy birthday french	do you sing happy birthday in german	lyrics happy birthday german	sing happy birthday italian	sing happy birthday in german youtube	sing happy birthday in japanese
5535986	teach summer school	do you want teach summer school	never teach summer school make more money	teaching forum	teach summer school abroad	teacher summer school	idea to teach summer school	your teaching skills	much does teaching summer school pay
5536018	Add Dirt to a Zombie Costume	zombie costume ideas	homemade zombie costume	zombie couple costume	how to make a zombie costume	zombie costume makeup	zombie kids costume	zombie halloween costume	zombie pirate costume
5537277	Get Ready to Do Homework	how to do homework when you don&#39;t want to	how to do homework without throwing up	how to do homework without getting distracted	how to do homework fast	how to do homework really fast	do math homework	how to do homework in class	how to do homework at the last minute
5540042	Curl Hair, Heat Free, Products Free	how to curl hair without heat or curlers	how to curl short hair without heat	how to curl hair without heat	how to curl hair without heat fast	how to curl hair without heat using a sock	how to curl hair without heat overnight	how to curl black hair without heat	how to curl hair without heat and within an hour
5541345	play games online	play kids games online	play monopoly online	play racing games online	play games online for free without downloading	play adventure games online	online games	play shooting games online	play mario games online
5541449	Stop Being Islamophobic	
5543398	make a site	make a site mobile friendly	make a game site	how to make a site map	make a site responsive css	make a site mobile	make a site like facebook	make a site like reddit	make blog site
5545517	Learn from Everthing That Happens	everything happens for a reason poem	everything happens dr horrible	everything happens for a reason bible verse	everything happens so much	everything happens for a reason quotes	everything happens don&#39;t say for a reason	everything happens to me lyrics	everything happens in threes
5550514	play boy	
5550593	make your own logo	make your own logo free download	make your own logo design	make your own sports logo	make your own business logo	make your own logo for fun	make your own shirt logo	make your own logo app	make your own superhero logo
5561772	free running	free running games online	extreme free running	learn free running	free running training	parkour videos	free running 2	free running videos	free running games
5562202	Boat Train Your Dog on Plastic Grass	
5562881	Be Successful on Shark Tank	successful shark tank ideas	kevin harrington shark tank bio	how to prepare to be on shark tank	shark tank kevin	who is the lady on shark tank	shark tank business success	pitching to shark tank	kevin harrington off shark tank
556545	learn to ride a motorcycle	learn to ride a motorcycle class	learn to ride a motorcycle harley davidson	learn to ride a motorcycle download	learn to ride a motorcycle video	best way learn ride motorcycle	motorcycle rider course	harley davidson	learn to ride a motorcycle safely
5566233	Stop the Windows Shutdown Process	stop windows 8 shutdown	how to stop installing updates on windows shutdown	windows abort shutdown	stop windows update on shutdown	stop windows shutdown command	disable windows shutdown event tracker	how to shutdown without installing updates
5567931	Be Your Own Beauty	own barber shop	own beauty ltd	own beauty school reality show	own beauty reviews	own spa	own nail salon	own beauty salon	own beauty quotes
5569486	Wait for Christmas when It Is November	how to wait for christmas when it&#39;s months away	christmas in november pigeon lake	cant wait for christmas	christmas in november reviews	christmas in november chateau frontenac	christmas in november stormville flea market	christmas in november song	november christmas cast
5569749	Create a Denim Bag	denim bag tutorial	denim bag ideas	make denim tote bag	denim shoulder bag	denim bag diy	denim messenger bag	denim coach bag	how to make a denim bag from old jeans
5571339	acne scar treatment	acne scar treatment laser	acne scar treatment cream	acne scar removal treatment	acne scars home remedies	acne scar cream	acne scar home treatment	mederma acne scar treatment	natural acne scar treatment
5588142	treasure coast realty	treasure coast apartments	gold coast realty	treasure coast reality	treasure coast foreclosures	treasure coast realty sebastian	space coast realty	treasure coast real estate	treasure coast realty team
5589994	Make a Cupcake Club	cupcake of the month club	cupcake club cafe	cupcake club coco simon	magnolia bakery cupcake club	cupcake club sheryl berk	cupcake club series in order	cupcake club website	cupcake club royal icing
5590453	build your own wine rack	wine rack plans	build your own wine rack plans	homemade wine racks	build your own wine cooler	build your own wine cellar	diy wine rack	wine racks	build your own wine cabinet
5590883	Find the Perfect Gift for Anyone	find the perfect gift quiz	how to find the perfect gift for your best friend	how to find the perfect gift for your boyfriend	how to find the perfect gift for your girlfriend	find the perfect gift for him
5596113	Study for School	study school shootings	study tips school	case study school	study island school	study high school	study abroad school	sleep study school	study school uniforms
5596705	Find Wireless Networks	find sprint	find wireless internet	find cell phones	search wireless networks	my laptop wont find wireless networks	windows 7 can&#39;t find wireless networks	find cell phone companies	find linksys
5598814	Feed a Baby from Your Body on Animal Jam	animal jam birthstones	animal jam birth
5604175	Millions of Websites Affected by Drupal Hack Attack	
5604582	Prevent Corrosion of Metals for FE Prep Course	
5604896	enamel paint	enamel spray paint	lacquer paint	enamel paint for metal	enamel car paint	acrylic paint	sherwin-williams enamel paint	acrylic enamel paint	latex enamel paint
5606150	walk away	walk away the script	walk away christina aguilera lyrics	walk away five finger death punch	walk away joe walsh	walk away paula deanda	walk away lyrics	walk away ben harper	walk away meaning
561272	Snow Blow Your Driveway	snow plow driveway markers	snow plow driveway cost	how to snow plow a driveway	driveway snow blowing inc
56172	instant message	instant message for instagram	instant message online	gmail instant message	instant message programs	instant message iphone	instant message google	text message	microsoft instant message
564383	add binary numbers	add binary numbers in c	binary calculator	add binary numbers java	binary multiplication	multiply binary numbers	subtract binary numbers	binary multiplication calculator	add binary numbers using one&#39;s complement
564439	Kill a Big Daddy in Bioshock	bioshock kill first big daddy	bioshock harvest or rescue	bioshock kill big daddy ps3	bioshock how to kill big daddy on hard	bioshock kill big daddy no little sister	bioshock walkthrough	bioshock 2	bioshock cheats
