1501612	Bring Home a Guy Your Parents Don't Think Much Of	
1502144	Order Chinese Food Over the Phone	how to order chinese food in mandarin	how to order chinese food vine	order chinese food online barrie	order chinese food online with paypal	how to order chinese food healthy	how to order chinese food for a large group	order chinese food hamilton	how to order chinese food gluten free
1504159	borrow money	payday loans	borrow money with bad credit	borrow money online	personal loans	borrow money fast	free money	bad credit loans	money mutual
1504204	Buy a Fruit Basket	buy gift baskets	buy fruit trees	top gift basket companies	dave fruit	where can i buy fruit baskets	buy fruit basket online
1504435	sea walk	sea walk dance	sea walk apartments	sea walk condo sea ranch	sea walk urban dictionary	ocean walk	seal walk	sound walk	c walk
1506269	major in photography	photography degree	can you major in photography	good minor a major in photography	fine arts major photography	colleges photography majors	universities photography majors	want to major in photography	basic info on photography
1506285	make your own stinkbait	homemade catfish dough bait recipes	make your own catfish bait	best homemade bait for catfish	catfish bait recipes	catfish bait ingredients	how to make catfish bait recipes	best homemade fishing bait	make your own catfish stink bait
1506383	sugar flowers	sugar flowers for sale	how to make sugar flowers	sugar flowers for cake decorating	sugar flowers recipe	royal icing flowers	sugar flowers for wedding cakes	sugar flowers tutorial	how to make sugar flowers for cakes
1507321	Control Oily Hair	control oily scalp	often oily hair	control greasy hair	control oily skin	do control oily hair	really possible control oily hair	can control oily hair	home remedies for oily hair
1507410	buy fireworks	wholesale fireworks	buy fireworks near me	black cat fireworks	buy fireworks asda	buy professional fireworks	cheap fireworks	buy adobe fireworks	buy fireworks online free shipping
150783	Recruit New People for wikiHow	
1508910	order checks online	personal checks	current checks	order checks online walmart	walmart checks	order checks online free shipping	order business checks online	order checks online reviews	order checks online chase
1509266	Decorate Your Room With Household Objects	home decorative items wholesale	home decoration items for diwali	decorative objects for home	home goods decorating ideas pinterest	home goods decorating ideas	home decorative items	home decorative items with waste material	home decoration items making
151030	Be Aware of Hidden Costs for a First Time Renter	
1510626	Teach Your Kids to Tie Their Shoes	tying shoelaces for kids	shoelace practice	how do i teach my child to tie his shoes	shoe tying instructions for kids	shoe tying steps for kids	learning to tie shoelaces	how to tie a shoelace for kids step by step	how to teach shoe tying for kids
151090	design clothes	design a dress	design your own clothes	design clothes online	design shirts	design your own t-shirt	design clothes software	design clothes app	design clothes games
1512733	Grow Plants With Grow Lights	grow light bulbs for plants	grow lights for plants at home depot	grow boxes plants	what type of bulb to grow plants	grow lights for plants walmart	grow lights for indoor plants	grow lights house plants	led grow lights for plants
1513292	Draw a Cartoon Kiss	how to draw cartoon people kissing	cartoon kiss wallpaper	cartoon kiss me	cartoon kiss sound	cartoon kiss lips	cartoon kiss images	cartoon kiss sound effect	cartoon kiss gif
1514	Force Windows Explorer to Start in the Folder You Want	how to open windows explorer to display the libraries window	windows explorer start in specific folder	make windows explorer open where you want
1514710	Draw a Cartoon Skunk	cartoon skunk feet	step draw skunk	draw skunk feet	how to draw an easy skunk	draw realistic cartoon skunk	how to draw a cartoon skunk step by step	skunk coloring pages	draw cute skunk
151666	airbrush nails	airbrush nail stencils	airbrush nails at home	airbrush nails designs	airbrush acrylic nails	airbrush paint nails	solar nails	airbrush kit nails	airbrush makeup
1516745	wetset hair rollers	how to put on rollers	using hot curlers short hair	how to put rollers in your hair	hot rollers vs curling iron	how to use hot rollers on curly hair	hair is added	how to set rollers in your own hair	how to put in curlers
1517927	Get Into The Imperial Age on Age of Empires 2	
1518382	Preserve an Autograph on a Baseball	how to preserve an autograph on a guitar	how to preserve an autograph on a shirt	how to preserve an autograph on glass	how to preserve an autograph on a phone case	how to preserve an autograph on plastic	how to preserve an autograph on a t shirt
1520477	Develop As a Musician	piano for the developing musician	piano for the developing musician 6th edition	piano for the developing musician (media update)(w/access) edition 6th	piano for the developing musician pdf	piano for the developing musician 6th edition concise	piano for the developing musician pdm 6	piano for the developing musician 6th edition ebook	piano for the developing musician media update
1521885	help kids	does wetopia really help kids	jobs that help kids	math help kids	activities to help kids focus	how to help kids focus	foods to help kids poop	games to help kids read	how sports help kids
1523932	live a happy life	have a happy life	live a happy life quotes	live a happy life bible verse	richard bandler how live a happy life	tips to live a happy life	live a happy life essay	live a happy life alex and ani	live a happy life book
1526423	Select an Arizona Window Sunscreens Dealer	
1526438	Use a Battery Charger	how to use a motorcycle battery charger	use schumacher battery charger	12v battery charger	auto battery charger	make battery charger	how to read a battery charger	use car battery charger	how to use battery charger lawn mower
1526934	Balance School and Life (Teens)	how to balance school and social life	work school life balance
1529713	Find Free Craft Supplies	free craft kits	free craft ideas	free scrapbooking supplies	free craft patterns	free craft samples	free craft supplies catalogs	free craft supplies for teachers	free craft supplies by mail
1532733	adopt a highway	how much does it cost to adopt a highway	adopt a highway history	seinfeld adopt a highway	adopt a highway jobs	adopt a highway cost	adopt a highway benefits	how much is it to adopt a highway	what does adopt a highway mean
1532921	train a dog not to bark	how to train a dog not to bark in the crate	dog obedience training	how to train your puppy not to bark	how do i teach my dog not to bark	train a dog not to bark at visitors	train a dog not to bark when left alone	train dog not to bark excessively	training a puppy to not bark
1538449	buy baby food	buy baby formula	buy homemade baby food	buy heinz baby food	buy baby food with ebt	buy baby food bulk	buy gerber baby food	buy organic baby food	buy beech nut
1539887	Write a Human Resources Resume	human resources coordinator resume	human resources resume cover letter	human resources manager resume	entry level human resources resume	human resources resume objective statement	human resources resume objective	human resources assistant resume	entry level human resources resume sample
1544251	import furniture	world market	import furniture online	mexican import furniture	pier one import furniture	import furniture warehouse	import furniture clearance	kube import furniture	far fetched import furniture
15473	Make Your Eyes the Spotlight	
1547386	buy a keg	where to buy a keg tap	keg prices	buy a keg of beer	how much is a keg	buy a keg online	buy an empty keg	rent a keg	buy a keg near me
1547958	Fit in at a British High School	
1548	sand box	sand box plans	paypal sand box	sand box amazon	walmart	diy sand box	sand box game	sandbox software	sand box cards
1548590	Shave With Shaving Oil Blade/Electric	shaving oil electric shaver	remington electric shaver blades	razor blade or electric shaver	panasonic electric shaver blades	panasonic 5 blade electric shaver review	panasonic 5 blade electric shaver	single blade electric shaver	norelco electric shaver blades
1549506	Prepare for Getting a Job in a Medical Office	
1552048	dress up	monster high dress up	y8 dress up	dress up clothes	dress up meaning	dress up store	dress up anime	barbie dress up	cooking games
1555862	Prepare a Pre Teen for Puberty Changes	
1558124	Make One Eye Go up and One Eye Go Down	how to make swollen eyes go down from crying	how to make a swelling eye go down from a punch	how to make a swollen eye go down after a fight	how to make a swollen eye go down fast	how to make a puffy eye go down	how to make a swollen eye go down	how to make a swollen black eye go down	how to get a swollen eye to go down
1558395	Make Almond Crusted Salmon	almond crusted salmon red lobster	grilled almond crusted salmon	honey almond crusted salmon	almond crusted salmon recipes	baked almond crusted salmon	almond crusted fish	almond crusted salmon food network	almond crusted salmon paleo
156033	Get a a Better Reaction for a Card Trick	best card trick ever	best card trick	best card magic trick	best card trick revealed	best card trick tutorial	best card trick ever james galea	best card trick book	best easy card trick
1564270	saute' mushrooms	sauteed mushrooms	how to saute mushrooms and onions	how to cook mushrooms	saute mushrooms recipe	how to saute whole mushrooms	how to saute mushrooms in butter	how to saute mushrooms for steak	saute mushrooms wine
1565829	travel to romania	travel to romania with schengen visa	travel to romania from us	train travel romania	travel agency romania	travel to romania from canada	travel to romania safety	travel to romania from uk	travel to romania visa
1566238	buy a dog	buy a dog in skyrim	buy a dog online	buy a dog at petsmart	buy a dog meme	buy a puppy	best place to buy a dog	should i buy a dog	buy a dog song
1567764	beat egg whites	beat egg whites thermomix	beat egg whites until stiff peaks form	beat egg whites stiff peaks	beat egg whites until stiff	beat egg whites until stiff by hand	beat egg whites and bake	beat egg whites in vitamix	beat egg whites by hand
1569526	Plan a Child's Birthday Party	party city	child birthday party games	child birthday party place	child birthday party ideas	child birthday party supplies	how to plan a wedding	child birthday party locations	child birthday party invitations
1569675	battle rap	epic rap battles of history	battle rap stars	battle rap videos	url battle rap	battle rap lyrics	battle rap forum	battle rap lines	battle rap arena
1571249	Plan and Film a Sims 2 Movie	sims 2 movie ideas	sims 2 movie star career	sims 2 movie a dog love story	sims 2 movie theater	sims 2 movie making cheats	sims 2 movie career	sims 2 movie making tips	sims 2 movie making hacks
1573064	Be a Cool Preteen Girl	
1575162	Pretend You're a Novelist	
158440	read a clock	read time clock	read stop watch	child read a clock	teach kids read clock	read a clock hands	read analog clock	read time	red clock
1589702	Get Lost in a Good Book	is the lost symbol a good book	lost in a good book pdf	the well of lost plots
1591407	date a dentist	tips for dating a dentist	date management	how to date a dental student	dating a dentist jokes	date romance	if you were dating a dentist	davis hc date with a dentist	date a doctor
159170	Create and Develop an Original Character	create an original character online	how to create a good original character	how to create an original story	original character development quiz	how to draw an original character	original character development questions	how to make an original character	how to create an original character design
15930	Race a Junker on a Dirt Track	
1593704	Get Rid of Cats from Your Garden	how to get rid of cats pooping in your yard	how to get rid of cat urine smell	get rid of cats in your yard	how to get rid of cats in your backyard	how to get rid of cats on your property	how to get rid of stray cats	how to get rid of cats without killing them	how to get rid of cats naturally
1593832	make money writing	work from home writing	make money writing reviews	freelance writing	make money writing fiction	make money writing blogs	make money writing articles	make money poetry	make money freelance writing
1594752	Become Confident and Improve Yourself	how to improve your self confidence at work	how to improve your self confidence	how to be more confident about yourself	improve your self confidence in a relationship	how to have confidence in yourself	how to improve your self confidence pdf	improve your self confidence in business	how to improve your self confidence in hindi
1594774	calculate your final grade	calculate my overall grade	how to calculate your final grade with percentages	how to find out what your grade is	calculate your final grade in class	equation for finals exams	do determine final grade	do you calculate my final grade	do you calculate your final grade
1596530	Verify That a French Business/Professional Is Appropriately Registered	
1601345	Overcome Selective Mutism As a Teen	how to cure selective mutism	selective mutism in adults	treat selective mutism teenagers
160151	Keep Your Books Neat	neat store	how to keep your school books neat	neat bookshelves	neat store names	keep neat freak	neat online
1609011	Make a Xenomorph Costume	how to make an alien costume	xenomorph costume kids	xenomorph costume amazon	xenomorph costume ebay	xenomorph costume prank	xenomorph costume kit	xenomorph costume head for sale	xenomorph costume for sale
1609543	read aloud	read aloud books online	read aloud lesson plans	read aloud text	read aloud strategies	read aloud app	text to speech	read aloud books	read aloud definition
1611485	Do a Knee Tuck	knee tuck ups exercise	knee tuck isometric	knee tuck push up	knee tuck hold	knee tucks in plank position	knee tuck crosses	knee tuck surgery	how to do a seated knee tuck
1611845	Grow Cucumbers to Pickle	how to grow pickling cucumbers trellis	planting pickling cucumbers	how to grow pickling cucumbers indoors
1612068	Buy a Retired Police Dog	retired police dog fund	retired police horse	adopt a retired greyhound	retired german shepherd	adopt a retired service dog	retired police dog adoption	retired police dog rescue	retired police dog shot
1612443	Scream in a Hardcore Punk Band	pop punk bands	classic punk bands	top 20 punk rock bands
1618687	Make a Lemon and  Herb Italian Sandwich	how to make lemon and herb sauce	how to make lemon herb chicken	how to make lemon and herb sauce for fish
1621010	Improve Your Mother Daughter Relationship	mother daughter relationship quotes	mother daughter relationship poems	mother daughter relationships in the joy luck club	mother daughter relationship books	abusive mother daughter relationship	strengthen mother daughter relationship	mother daughter relationship advice	difficult mother daughter relationship
1624419	Remove a Candle from a Mold	taper candle molds	antique candle mold	beeswax candle mold	candle mold diy	candle mold release	silicone candle molds	candle mold skull	candle mold release spray
1625210	Grow Patchouli	gardening patchouli	patchouli cuttings	patchouli houseplant	best way to grow patchouli	patchouli edible	patchouli seeds for sale	growing patchouli from seed	do patchouli grow
1625507	Buy Pieces of Driftwood	where to buy large driftwood	large pieces of driftwood for sale	driftwood for sale on ebay	small driftwood pieces	driftwood pieces for crafts	large driftwood for sale	small driftwood for sale	driftwood for sale
162606	Manage Your Time over Summer Break	what to do over summer break at home	when is summer break over 2014	what to do over summer break for kids	what to do over summer break high school	what to do over summer break for teenagers	what to do over summer break college	what to do over summer break	fun things to do over summer break
16261	build a hydroponic garden	hydroponics systems for beginners	build aeroponic garden	hydroponics for beginners	build a hydroponic garden step	build a complete home hydroponics system	build aerogarden	build indoor hydroponic garden	how to make a hydroponic system
1626710	convert roman numerals	convert roman numerals algorithm	convert roman numerals to decimal	convert roman numerals into hindu-arabic numbers	convert roman numerals to normal numbers	convert roman numerals to numbers c++	convert roman numerals to arabic in excel	convert roman numerals to decimal c++	convert roman numerals to arabic
1627250	Draw Fashion Eyes	
1627986	Work Your Way up the Corporate Ladder	how to work your way up in a company	moving up the corporate ladder meaning	how to move up the corporate ladder	how to rise up the corporate ladder	move up the corporate ladder synonym	how to climb up the corporate ladder	moving up the corporate ladder mcgraw hill
1628150	Buy Depression Medication	natural depression medication	people have said that depression	types of depression medication	depression pain medication	clinical depression medication	depression medication list	depression medication side effects	buy depression medication online
1633543	Start a Page in Wikipedia	
1634398	Do a Tiger Stripe Manicure	tiger stripe stencil printable	tiger stripe rainbow loom	tiger stripe urban dictionary	tiger stripe ice cream	tiger stripe desert eagle	tiger stripe camo pants	tiger stripe camo	tiger striped nails
1635932	Be a Gourmet Cook in 3 Easy Lessons	
1637342	Draft a Compromise Agreement Quickly and Cheaply	
1640789	Use an ATM to Deposit Money	how to deposit money in atm without card	how to deposit money in atm westpac	how to deposit money in atm anz	how to deposit money in atm sbi	how to deposit money in atm gta 5	how to deposit money in atm icici	how to deposit money order in atm	how to deposit money in atm chase
1643253	obey your parents	should children obey their parents	10 commandments	obey your parents video	obey your parents lesson	obey your parents commandment	obey your parents scripture	obey your parents craft	obey your parents quotes
164692	chew tobacco	chew tobacco statistics	chew tobacco brands	chew tobacco store	chew tobacco song	chew tobacco effects	chew cigarette tobacco	chew tobacco for sale	chew tobacco spit song
1648053	Work in Collaboration With a Narcissist	work narcissistic personality disorder	how to work with a narcissistic coworker	how to work with a narcissistic boss
1648826	Add a Wall Switch to Light Fixture Controlled by a Chain	
165104	Make Leaf Images	maple leaf images clip art	oak leaf images identification	autumn leaf images	maple leaf images free	tree leaf images	green leaf images free	fall leaf images	leaf images black and white
1651910	think big	think big store	think big sites	think big slogan	think big book	think big analytics	think big ben carson	think big quotes	think big movie
1652269	Clear Negative Energy	clear negative energy from room	clear negative energy meditation	release negative energy	clear negative energy from home	clear negative energy music	clear negative energy from office	clear negative energy from your home	best way clear negative energy
1656900	color pictures	color pictures of people	disney color pictures	color pictures online	color pictures online disney	color pictures history	color paint pictures	color pictures of flowers	color animal pictures
1656908	Meet New People With Grooovy	
1657113	love a pet	love a pet randfontein	love a pet rescue	love a pet winx club	love a pet edenvale	pet love coupons	love a pet broken arrow	my pet cat	pet love beverly center
1657692	Be a QMRP	qmrp qualifications	qmrp training	qmrp requirements	qmrp salary	qmrp jobs	qmrp job description	qmrp responsibilities	qmrp certification
1657711	Earn Extra Cash from Home	earn extra cash from home packing	earn extra cash working from home jobs	earn extra cash from home stuffing envelopes	earn quick cash home	how to make some extra money from home	earn extra cash from home typing	what can i do to make extra money from home	making extra money from home
1658789	Buy More Time on an Overdue Assignment	
1659871	burn free music	youtube	burn free music to cd online	free music downloads	burn free music to cd	burn napster	burn limewire	youtube to mp3	limewire
1663497	feed a corn snake	how often should i feed my corn snake	best time feed a corn snake	should feed my corn snake	can corn snake	what do baby corn snakes eat	often to feed a corn snake	do i feed my corn snake	best way feed a corn snake
1666135	Recognize Signs of Over Exercising	symptoms of over exercising heart	signs and symptoms of over exercising
1671058	Draw a Crater	
1676349	Do the Left Leg Splits	leg split technique	leg splits training	leg split workout	leg split yoga	leg split wrestling	leg splits benefits	leg splits injury	leg splits machine
167954	visit niagara falls	visit niagara falls usa side	visit niagara falls from toronto	visit niagara falls with kids	visit niagara falls in winter	visit niagara falls canada	visit niagara falls canada visa	visit niagara falls without passport	visit niagara falls visa requirements
168051	Find a Girlfriend at Summer Camp	search summer camp	boy summer camp	summer camp directory	summer camp finder	find summer camp jobs
1682413	Choose a Baby Nursery Theme	baby nursery theme ideas	baby boy nursery theme	baby nursery themes pinterest	nursery school themes	baby nursery bedding	nursery decor themes	baby nursery rhymes	baby nursery themes disney
1682877	Maintain a Linoleum Floor	linoleum floor installation	how to clean linoleum floor	linoleum vs vinyl floor	linoleum wood floor	linoleum floor lowes	linoleum floor removal	linoleum floor cleaner	linoleum floor repair
1683459	Identify Fruit and Vegetable	identify fruit by picture	fruit and vegetable identification guide	identify fruit tree by leaves	identifying fruits and vegetables kindergarten	identify fruit tree	identifying fruits and vegetables worksheets	fruit and vegetable identification quiz	identify tropical fruit
1685583	report welfare fraud	social welfare fraud report	welfare benefits	report welfare fraud anonymously	report welfare fraud bc	contact to report welfare fraud	do you report welfare fraud	can report welfare fraud	welfare fraud cases
1687390	Choose the Best Broadband Router for Your Network	best broadband routers 2013	pcmag best wireless router	best adsl router for bsnl broadband	fastest wireless broadband router	best adsl router modem	best adsl router for airtel broadband	best adsl router for mtnl	fastest broadband router
1688274	Get a Doctorate in Economics	doctorate in economics programs	phd in economics	doctorate in economics online	doctorate in economics salary	doctorate in finance	masters in economics	certification in economics	doctorate in political science
1688633	play poker for free	play poker for free no download	play poker real money free	play poker online for free without downloading	play poker for free win prizes	play pokerstars free	play poker online	play poker for free and win real money	play poker for free against computer
1690	Start Your Own Exercise Regimen and Stick to It	
1695637	build a maze	building garden maze	build a maze game	build a maze for kids	build a mouse maze	build your own maze	make maze	build games	building maze puzzle
169620	Straighten Out a Dollar Bill	straighten out bed head	straighten out headphone cord	straighten out lyrics	straighten out gigs	straighten out toes	straighten out bunion pain	straighten out crossword clue	straighten out driver
1696326	download world of warcraft	download world of warcraft full version	download world of warcraft private server	download world of warcraft mac	download world of warcraft client	download world of warcraft online	world of warcraft download full game	download world of warcraft free trial	download world of warcraft mists of pandaria
1698614	Do a Kickoff in Cheerleading	
170296	Fight Like Your Favorite Videogame Fighter	
170309	Make a Credit Card Flower Box Magnet	
170625	search the internet	search engines	search the internet for a certain midi file	search the internet anonymously	search the internet with a picture	search the internet using google	search the internet with google	search the internet for a face	search the internet on roku
1709671	Live the "Perfect" Teen Life	
1711188	find arelative	find a lost relative	find relative location	find a relative for free	find a relative who was adopted	trying to find a relative	how to find a relative maximum	find a relative in england	search relative
1713843	Plan a Trip to Croatia	trip to croatia cost	map croatia	things to do croatia	trip to croatia packages	trip planner croatia	trip to croatia itinerary	travel blogs croatia	trip advisor croatia
171736	Make Citrus Spray	how to make citrus spray for dogs	citrus tree spray	how to make a citrus spray to deter cats	homemade citrus spray for cats	citrus spray for fleas	how to make citrus spray for ticks	how to make citrus spray for cats	citrus magic spray
1722072	Make Fried Dough	make funnel cake	make elephant ears	fried bread dough	knead pizza dough	make fried bread dough	make fried doughnuts	fried dough recipe	make fried cookie dough
172525	Loop Music on an iPod	loop music on ipod nano	ipod loop strap	ipod loop video	apple ipod loop	ipod loop review	ipod loop fix	ipod loop playlist	ipod loop song
1729639	Become a Pretty and Popular Teenage Girl	
1729863	request high school transcripts	send high school transcripts	parchment docufide	how to send high school transcripts to colleges	send my transcripts	official high school transcripts	request find high school transcript	find my high school transcript	getting high school transcript
1731294	live it up	live it up mp3	live it up lyrics	live it up quotes	live it up group 1 crew	live it up kid ink	live it up john legend	live it up brantley gilbert lyrics	live it up meaning
