1567764	beat egg whites	franklin delano roosevelt first 100 days in presidensy	i'm in love with a stripper remix lyrics	wwe diva micky	regina high school and hyatsville maryland	everly brothers	pineapple upside down pie	uesed chevrolet hub caps	detached retinas in dogs	walking with monsters from abc	trek bicycles	craigslist nj	http www.geocities.com swiper200 superdme.html	cheats for nba ballers phenom	opera singer simon	cal poly pomona	r f harnett artist	www hotmail	arbor mortgage.com	marian christine mckinnie dunham	fallen angel reviews	softball sleeveless jersey	ny boxing incorporated	patio table parts	assasin bug picture	owen realty rockdale	bernard griffith basketball coach	real estate rockdale texas	dedricks tsui river lodge	caifornia super lotto	nordstrom purses	creflo dollar	casablanca real estate	cartoon netwurk	regionb.georgiaoas.org servlet a2l	birmingham michigan bbgun arrests	americanblindand wallpaper	james avery	little rock christian academy	stuffed cabbage recipes	gloucester county college	grey's anatomy	inheritance tax	birthplace of constantine the great	mobile company employee directory	fitzgerald mall.com	pharmacy college	reatach retinas in dogs	joseph calandro	how does it feel	sensual ecard	joe rice paperweights	hickory hills il zip code	bank of america	free music	coaster iron beds	michigan public records	cal ripken's birthday	union halls of the machinists local 1781	the wig club	folk nation tattoos	society for california archaeology	amerisuites and blacksburg va	free rape pic	lyrics donovan crazy bout a woman	washington national parks	norton antivirus	masco corporation	trans am fuel cap	craigslist northern california	picnic pavillion	lincoln 2004 ls	lobster tail	university of washington	wwe diva micky michele	barbie games	g the heart	american airlines center	georgia aquarium	praise dancing	belmont county court	tsui river alaska	www.ourchannelislandsbeach home.com	blue crab	u.s. national wrestling championships in las vegas	ky treasury	blu martini	thrift books.com	what are different types of gases	unicycling in pittsburgh	new york knick leather jacket	ventura raceway seaside park	weekender shirts	jack spade	patio table umbrella ring	cory montville	womans gray t shirt	oral b sonic complete	the nostradamus code world war 111	addiction center warsawin.	cal ripkin j	defintion of disease	espn stock car challenge	city of homestead	ellington darden diet	short pile plush	children'sspecializedhospital in mountainside nj	www.sciencediet breeder	how to dress bass	pictures of sugar cane	east bridgewater election	cal ripken jr	goergia aqurium	la classe de	nigeria dating	wow wigs	transfer express	72 vw bug cataloge	american airlines	truck toolbox acc	kitchen sinks	presidents of south vietnam	transfering money by e checks	who killed soulja slim	owen real estate rockdale texas	pepper spray	mens gold necklaces	ecco shoes	sugar cane	marion christine mckinnie dunham	mma news	aspen glen	the klu klux klan	blu 20martini	build park paviollion	www.morganfield ky forclosuers on homes	www.union co forclosured homes	staduim seats	realty one	diesel backpacks	beef stroganoff blue ribbon	chicken marsala	eastern mountain sports	www.thegreatproduct.com dpr	feet fetish directory	pics of michael jordon	rainforest cafe	simon birch	newport news	smith school in tenafly	first step	i will rejoice i will rejoice and be glad	build a paviollion	atlantic city nj	walking with monsters	lloyd belt	short pile fur	weather 91948	rattelli shirts	nausicaa of the valley of the wind the movie	joseph johnny fasullo died of	www.home depot.com	g sats	radford university	sands of time antiquities	victory solutions	free download software	archie reid of princeton	united state map	abdominal excercises	sumbarine pacific mountain ranges	tyler perry	crossing jordan	pay less shoes	ethiopian air	runescape leo dig grave and place	caffeine and pregnancy	rattellis for barneys of new york	natural cut stone patterns	there is a riverthat made glad the city of our god lyrics	blu martini in greenville	trial news	hawaiian and recipe and dessert	guinea pigs	pink razor phone	english and scotish football league	srt8oc com	all inclussive hotels	passover recipes	east bridgewater sewer	benjamin franklin waters salem ma	a 1.0 molar solution of which of the following has the highest ph	http singlesnet.com my email	free state unclaimed money databases	6 point crowns	morgan stanley	excel vr 2500 power washer	diagram of ocd	my history	lil bowwow	cheats for nba ballers 2	holand amera line	architect salary	rock singer brian	singer island marriott	3954 farris ct.	amadeus soundtrack	beach cake	american blind and wallpaper	bookcase headboards	ipod support will not load musuc	ipod support will not load	pictures kd formal eastern illinois university	born to make you happy	adress of masco corporation foundation	wells fargo	6 point crown tattoos	sugar cane in south america	alexander de marco	the lost and found washington dc	massachusetts state police academy	white pages black river new york	dog eye surgery	myspace profile editor	magazine articles on franklin roosevelt	truck hub caps	magazine articles on franklin roosevbelt	cartoon network	maple square in delaware	millington baptist church	travel guide	geo tracker parts	pictures of beaches	public trials of 1993	overnight prints	express clothing	fashion designers	tom hulce	diabetes signs	mabel's stories	gale leigeber	bike stores	century 2600 wa	downtown greenville	www.marianjocelhotmaul com	alaska railtours	people search	ken shamrock	sinder lavigne	masters golf live on cbs	ask jeeves	men and eating disorders	cleveland drill bits	c murder killed solja slim	currency exchange	beef stroganoff blue rinbin	paris pass	asian consoles tables	driving directions	star telegram ftw tx	beef stroganoff	lost and found washington dc	background layouts for myspace	1985 honda 250es big red	free cell phone number directory	free rape photos	betrayal of a friend poems	dress form	ww.oxnard beach rental.com	best glbt over 50 communities	house flipping forums	beef stroganoff blue	regionb.geogiaoas.org servlet a2l	assassin bug picture	wwe trish stratus	how to make an international call	german ww2 helmets	person search by cell phone number	playing cards	gary evans	nude women over 45 pictures	siemens 20medical	i will rejoice i will rejoice and be glad song	york technical college rock hill sc paralegal degree	waashington national parks	addiction centers	how to call out of the united states	hilton gardens inn	parks in new windsor ny	children's specialized hospital in mountainside nj	risk of financing with debt	solutions for hair fair oaks	free cd burning software	sea to sky photo playing cards bear	cuddle cove	sex milfs	pursuit 2870	wisconsin lottery	folk tattoos	tropical fish	mcclarty park rockledge	alexander de markoff comestics	nikon cool pix 2000 instructions	city of rockledge florida	christian cards free	swim suits for fuller size women	myth busters	best communities for lesbians over age 50	where is coogee beach located	clothing alteration shops in jacksonville florida	www.chat avenue	culinary hospitality business resort troy	www sai gon com	gale liegeber	wig warehouse com	rottelli shirts	the contents of air	patio tablet	hot 99.5 and washington	carnival cruise mexico	the tailor shop ink	kristin cavallari hair styles	life cycle of the annelids	free police reports	picnic pavillion city park	east bridgewater express	tree farms florida	ap chem question	dominion gas company	motor cycles	air france.com	morgan freeman	alterations shops in jacksonville florida	clarkdale attendance center	us mens clay court championships	shrimp cocktail	music videos	simple man lyrics	cps houston	hotel jobs	dating stages	how do you know when to euthanize your sick dog	myspace editors	spiegel catalog	life cycle of the annelidas	silver fox	ecce homo	where to hold carnivals	windows media user interface not registered	regina high school and religious of jesus and mary	800 number for ipod	hiking boots	fm radio station in syracuse ny	jewelry trays	bratz bed in a bag	franklin delano roosevelt first 100 days in presidency	who did c murder kill	regina high school and hyattsville maryland	eastern illinois university	craugs furniture	tattoo pictures	sensual ecard free	simply irresistible by robert palmer	what is the limit on inheritance	successor definition	carnival location	archibald reid	mirrors and feng shui	menotti operas	utah lilies	vetheuil en	symptoms of borderline personality	dellrebatesstatus cin	wwe diva mikky	eating disorders	brett harris tucson az	lli's of barneys of new york	shepherdstown bed and breakfasts	aol alerts	sprint application forcell phone	eaton springs	orange and black beetles indiana	advance for laboratory	when to euthanize your dog diagnosed with lymphoma	weekender clothes	arlington hilton hotel	la boite en bois ny ny	dedricks tsui	walking with monsters board game	cleveland dreambooks	london pass	middlesex county college	home depot	realty one athens tx	i'm moving on lyrics rascal flatts	table grommet	nurses day	kona radio old time show	tree farms tampa	jet magazine	run girl	www.3954 farris ct..com	california super lotto	ct airports	march 2006 bb gun arrests in birmingham michigan	barnes and noble	live coverage from masters golf	ogden nash- the hippopotamus	military camp beds	quotes from grey's anatomy	keanu reeves	cabbage recipes	san bruno hall	crown tattoos	super d me	old navy	there is a river lyrics	glass tiles	santo cristo in south san francisco	nutrition author davis	geo tracker	the adventures of tom sawyer quotes	ella moss	www.morganfield ky foreclosures on homes	g stats	www.l950 santas.com	spectre power boats	faux bamboo chairs	supernatural childbirth	2006 bb gun arrests in birmingham michigan	butt exercises	spyware defence-	the city of our god lyrics	steve-o and nicole richie	apartments in orange tx	c murder killed soulja slim	nancy nussbaum at austin neurological	masters golf live	house of guitars.com	mass. rv dearlers	how long after arraignment is sentencing in mi	beef stroganoff blue ribben	table gromnet	learn powerpoint for free	massachutts state police academy	american idol	razor phone	application for cell phone service	wal mart	tn 20lottery 20numbers	lois palau	outback restuarant stafford va	real estate cameron texas	i will rejoice	dennis kirk.com	marriage listings sallie garnett allen l905	johnny fasullo dies	msn games	raising fractions to higher terms	hotel in lexington nc	speed world	archie reid of princeton new jersey	impression obsession	wwe micky	gay-friendly communities	flagstar bank	ocean's eleven	mable's storys	fried bass recipe	vincent donofrio	wwe micki	mitral valve	www. union bank forclosures in morganfield ky	britney spears statue	united states senators email addresses	www.dps .org	birmingham michigan b b gun arrests march 2006	picholine ny ny	modeling ford	search for bike stores	ipod support will not load music	brett harris	used hot tubs for sale in west michigan	web sites	haile salassie	utah department of motor vehicles	international flights	sparknotes for catcher in the rye	western maryland center in hagerstown maryland	heart art stamps	sean paul	boston lesbian communities	arber morgue.com	wwe divas	west fork terrier	armored car services	free rape pics	yellow pages	800 number for i pod	sean paul concerts	merritt island florida	miami home & decor	eye twitching	yu di oh cards	camden acquirium	veteran cemetaries gary indiana	symptoms of borderline personalit	ny boxing incorporated ridgewood ny	greyhound bus lines	financing with debt	public trials of 1993-1995	hopes and fears album lyrics	sidney ohio	gaylord opryland	pregnancy photography	kitchen sinksr	living in panama	tama drumsticks	bowling green ky	summitt hospital baton rouge	folic acid	crystal jewelry	pictures of formal eastern illinois university	manadalay bay casino las vegas	dennis kirk .com	yakima reality	cannon cameras	inheritance tax usa	nj transit schedules	harding in virginia	king crowns pics	soles of feet itch	ut hospital knoxville	owen real estate rockdale	unclaimed money	maple story	bamboo flooring	letter linker	hotel hofwirt salzburg	free macfee	author zora hurston	middle tennessee property	www.forclosuer data bank	how to install pavers	6 point crowns pics	georgia lottery	owen realty	first grade science projects the dancing magnetic paper clip	grand hyatt new york	deep fried recipes	amtrak to harrisburg pa	dltk easter'	caffiene and pregancy	antelope valley college	crystal meth support groups	speed world in az	lloyd belt service	the masters	barneys of new york	i will rejoice and be glad lyrics	omni whole house water filter	how to call argentina from united states	beech cake recipe	wilsonart laminate counter tops	dedricks lodge	acronym for scab	is al no3 3 an acid	crowns kings	alexander de marcoff	italy's di garda	free rape	cell phone number directory	shes the kind of girl you bring lyrics	kristin cavallari celebrity hair styles	first step inc	trea depot.com	marijuana possession in michigan	walkthrough for nba ballers phenom	risk of debt financing	san bruno rental hall	reattach dog retina	ut memorial hospital knoxville	washington nc	buck creek road adolphus ky	telephone directory new jersey	ashley lor'en bellamor	salzbergen & population	majiuana possesion in mi	art paint brushes	summit county	wwe lillian&john cena	http www.cheap life like dolls.com	teen chat rooms	automotive performance t shirts	owen real estate	sunny quotes	gallatin tn newspaper	drafting boards	net care dental services	tenafly middle school	athens daily review	california trials of 1993	wwe new divas	awake direct nutrition	alexander de markoff cosmetics	deitricks lodge	the da vinci code	what are the risks associated with financing with debt	myspace.com la bellareina	www lanebryant.com	sugar cane pictures	tropical fish stores	used furniture	bedroom furniture	warsaw in bowen center	the lovin'spoonful	michigan auctioneers	catholic churches	first step credit	www viet nam com	animal sos fund	diabetic neuropathy signs	who did c-murder kill	velboa fabric	www.people search.com	phat farm	m s society in st cloud fl	german ww2 visor ornaments	dublin christian academy	torrance public library	power washer sale	excel power wr	banana republic	magic school bus	salzbergen & wind energy plant	straight line depreciation	vw bug cataloge	st cloud ms	away messages	ace hardware	book of judas	merritt island florida parks	lobster facts	sea to sky photo playing cards	mountain unicycling in pittsburgh	holiday menus	tree houses	just walk away	old time radio stations	thy neighbor's wife author	santo cristo	kiwanis island merritt island florida	at the pixie pit in the scrambled egg-heads game room.	stenography training	rattellis for barneys	colimbia house music	printer ink cartridges	cleveland lottery	holand amera cruises	local weather	build a bear	al no3 3	www.s iegel.com	lloyd belt pontiac	ethan allen used furniture	black widow	better business bureau	kiely williams pics	york technical college rock hill sc	littleton coin company	used chevrolet hub caps	ap chem questions	www.michigan.gov sos	wwe diva micky michelle	orange county tax collector ca	wwe lillian	tread depot.com	wilson hospital	curious george	police reports birmingham michigan march 26 2006	jack dahm	ballagio resturant	weekender clothing company	toys r us	graduate record exam	west for terrior	moble company employee directory	holand america cruises	ammonia accidents in san francisco	random tile patterns	cannon s21s	target .com	dove rich moisturizing cream	help with ekgs	cleveland ohio dream books	cross tattoos with banners	free easter songs and activities preschoolers	buy cake yeast	pennsylvania child molesters	cool whip angelfood easter cake
34763	plan a road trip	aspen co	midwest airlines	frontier airlines
1695637	build a maze	cartoon network
344841	get over it	free willy	grosse point tv	havana nights	the eagles band	gossip movie	grosse point	letter from hell
54450	find free stuff online	get free stuff online
1371717	make a homepage	make and aol homepage
8093	cross train	soup du jour	as a stand alone
5224643	watch south park	download south park halloween special for free	download south park pinkeye	download south park episode pinkeye for media	watch south park now episode 107	download south park episode pinkeye	watch south park episode pinkeye now for free	download south park pink eye	south park downloads	south park episode pinkeye
2477881	divorce in florida	i am divorced and get ssdi can my exhusband support alimoni	disability divorce can get pension from husband	bank of america.com	bartow florida	divorce disability in florida	i get ssdi when i divorce can husband pay some from his salary	divorce news	divorce laws in florida	divorce forms in florida	apartments in timonium md	apartments in towson md
677859	splatter paint	streaky paint	myspace generator
4208453	play cake mania online	dropheads online game	play lunch rush online
178567	play paintball	paintball fields
1118986	test for diabetes	diagnosis for diabetes	high sugar in urine	a1c test
2543392	canal jump	canal jump;glamis
