10215	call 9-1-1	call 9-1-1 lyrics
51994	ball room dance	manassas dance	ballroom dance - manassas
521972	repair hardwood flooring	professional wood floor contractor huntsville al
57513	design your own engagement ring	the fabulous life of vh1	antique engagement rings	bezel set marquise	too many popups help	bezel set marquise ring	marquise diamond engagement rings	floating diamond ring	floating diamond	engagement rings	arthur bendel	fine jewelry	diamonds actual size	aurthur bendel	neil lane
1000676	show rabbits	lilac rabbits	lilac rabbit breeder
1316594	make crossword puzzles	make free crossword puzzles
1020624	make your own game	used cheap laptop	kids choice awards	make a game
2699516	buy and sell books	bow wow	sohh blogs	10 year olds	covenant school in redford	vercy miller	erica johnson from oak park michigan	the simpsons
64044	learn russian	russian phrases	log home floor plans
1274155	create your own cursor	create your own cursor codes
198180	star gaze	pro skater for emerica	emerica pro skaters	pro skater of emaerica	emerica proskaters
4850297	talk to god	love you
1451039	report child abuse	child abuse	report abuse florida	report abuse
107983	express yourself	motown artist expression	charles wright & the watts	express yourself lyrics	express yourself the song	do what you wanna do by the isley brothers	r&b group the expression	music by the group expression	there is nothing new under the sun	do what you wanna do by the expressions	there is nothing new under the shn	charles wright & the watts 103rd street rhythm band	the shaggy dog	music by expression	expressions the singing group	expression old school group	its your thang by the expressions
633079	penguin slide	classic motorized penguin
5606150	walk away	jon and bons chico ca	psp codes	kelly blue book	nba throwback jerseys	mi vi charters	zimmer holdings	global protection inc.	the lobster pot	meriam johnson	michigan university and colleges	disney channel.com	aloha airlines	google search engine	cartoonist hollander	mattress factory outlet tulsa	mills pride	rishi tea	athanasius became like us	nissan armada 2005 used on ebay	worked for us company in iraq rebuilding	basil matthews	the beatles ........leaving home	bellsouth email	soccer tricks	fanizzi's by the sea	oklahoma lottery	gloucester county college	edible arrangements milltown nj	torso burns	yahoo group	2joggers hit by car on pch sat. april 8	justice of the peace savannah	babies r us	e bay	no deposit no purchase flash casinos	recipe for buffalow chicken pizza	nj golf courses	san antonio tx	joggers hit by car on pch	how to use balloon decorating strip	pet gates	myrtle beach discount hotels	csi college	jan's tropical fish	animated signatures	sunterra pond filters	soups stews bisques gumbo	nm game and fish	georgia tech lacrosse	flooring stores in pa.	wackenhut services	aertos treads	earth artist	chicago weather	monclair plaza	9 to 5	http 69.0.163.232 published sites gen providence health generated pages index.html	driver hits joggers in san clemente	seminole high school football	meditation techniques	beep- pcd	shreveport teams no problem for parkway airline - bossier press-tribune online	hamster cages	stack em stck em	apartments florida state university	switchblade you really are out of your fucking mind	mills rogers business broker	thanks for smoking	haiti images	pennsylvania department of revenue	walk away-kelly clarkson	bonnie and clybe	http bratz world.com	jerry seinfeld scholarship	mccall's quick quilts july 2004	seminole county public schools	calhoun county sheriff department. org	chronicles of narnia action figures	taking back sunday downloads	re-creation veterans	hudson mi vi charters	aa in orlando florida	fred tunick	religion and sexuality	vermont america sawblades	longhorn cafe	busch gardens	intique gold two tone wedding band	flooring store	pet smart	phantom lighting sweeper	dynaco pas 2 preamp	bright star kennel	new york and company	utahs hogle zoo	test given to newborn babies	stratford indian motorcycle	thai ridgeback	marazzi tile stores	bitter enemies during the rwandan civil war	dr. dodds website	danbury harley	sulpher springs realty	post card stamps	ken burns pictures	in last week's devotional i wrote an article entitled the cross is that all there is in that article i posed the question do we place too much emphasis on the cross in our relationship with christ and by doing so are we overlooking the other critic	der komisar song	hide away hampers	grateful dead american beauty	frenchie davis	wwwseashoreline camper resort.net	christina aguilera	partner promotion	prudential clear water realty washington nc	home depot promotions	willmington delaware	beep lyrics- pussycat doll	http www.graduation.invitations4less.com	stack em	sinker cypress logs	artcarved wedding bands	bayou city crawfish festival	nautilus strength system ns200	zoom kobe 1	yamaha star blaze	jared of panic room	edible 20arrangements	buffalo blast newspaper	chris brown in connecticut	calvary christian school dover de	donate mattress tulsa	rhubarb pie	naber & 1833	aarp magazine	gay actors matchmaking	south holland illinois	oregon's state tree	chase bank	currency calculator	non profit organization	grand canyon	cardiac c reative protein	key west boats	margaret brannon presbyterian tennessee	mohegan sun	security cameras	yahoo maps	photos of balloon centerpieces	marilyn mcdougall	early worning radar detectoe	ron jon waterpark	www.southwestairlines.comthindicatorcode kia	windows xp crack	kyocera kx2 remove the sim card	super clubs	my space	ebay motors	continental airlines.com	spca houston	working for an american firm in irag taxed	distrubitor 667 south street reading pa	cute overload	orlando 20florida	mens wedding rings	delaware online	chocowinty nc lots for rent	type style	sunbelt business brokers	west virginia	calvary christian academy	ministers savannah elopement	www. animecornerstore.com	kitchen backsplash tile	2 joggers hit by car on pch sat. april 8	anime corner store	kitchen chalk boards	the african queen	gordon setter - akc official description	cute is what we aim for	customer satisfaction baltsun com	dysfunctional family and the church	rebecca frances scottie	tucson mls	fats waller one never knows.....	minotaur home	ask jeeves	great expectations. com members keyword	dr. lewis feder	lyrics music of the night	like sartre's no exit	timeshares jacksonville fl	ford explorer sport trac	seafood fettuccini recipe	lands end	polish easter ham	re-creation singers	e200 motor with gear for belt-driven	www.hamden youth lacrosse.org	all childerens hospital st petersburgh florida	mary winkler	flying buscuit cafe	jonas brothers	business plan	yankee stduim.com	cast of star trek n.g.	flavor flav	do we place too much emphasis on the cross in our	http ty testhttp viewmorepics.myspace.com index.cfm fuseaction viewimage&friendid 36567937&imageid 600541777&mytoken 780e4eb3-50e7-455b-a3da-a0135a9bc4f4	cardiac c reactive protein	noion plates	www.bikes for kids.com	volkswagen gti quarter mile time	wisconsin department of natural resources	bowen center	coach charged pennsylvania	rockey horror picture show	solar heating	'road runner cartoon'	james blunt boodbye my lover	reverend robert brannon tennessee	little teen sex	easter sunday	need a zip code for northbrook il	greesboro north carolina volunteer	function of chondrocytes	animal contro; houston	yankee stadium.com	gilmer texas	marriott hotel	dog events	e-business companies only	extreme body burns	coppola wine	spider bites	www.yahoo com	shelby county texas genealogy	eteamz 9u panthers .com	real estate in wa	travel & cleveland & cocoa beach & florida	music videos	car parts	joggers hit by car on pch sat. april 8	virual menegitiss	anklyosaurus dinosaur	hot chicken pizza sauce only	wildlife park; dickinson texas	towson university	electrons and protons in hydrogen	my yahoo	making a proco fat rat	popular science	hyatt hotel	keen cortinas	definition ata 100	itching on yorkies	re-creation singing group	adult fanfiction	ryan swears davison	duct yape	general theological school	martini glasses	taxes on income while working in iraq war zone	summons for dummies	schedule se	apartments florida state univ	richmond business brokers	dodge srt-4 quarter mile times	http www.graduation.invitations 4less.com	excalibur vegas	letter from marie to judy	att wireless	recipe for buffalo chicken pizza	florida divorce	sally's beauty supply joplin mo	nebraska democratic party	john cena- fanfiction	new jersey high voltage proximity act	waterloo cedar falls courier	map quest	metropolitan opera house	american heart assn	t pain im sprung	better homes	local drug stores	home depot	movie theaters in new york city	john mc vicar pictures	study sheets for the north carolina ged test	buy babka pans	travel stores in bay area california	barnes and noble	a little less sixteen candles a little less touch me	great adventure	circumferential burns	piedmont park atlanta	state of ohio income tax	ga controllers office	marazzi tile stores in pennsylvania	drudge report	all american rejects	devoted friend of greek legend	joas brothers	camp mahackeno westport	star trek n. g. engineer	fl lotto results	soapy supplication	great lakes realty	rascal flats songs	bright star gordon setters	musical once on this island	michael nemescal alert ambulance	greeting cards	studing for the north a ged test	fishing in nebraska	hot school items	rite aide shampoo products	joggers hit by car on pacific coast highway	winfield belhaven	immigration news	hotels in tallahassee fl	owner of the history channel	hershberger plain city	sanfrancisco zip code	check express	nautilus strength system	hustead hyundai	laura van wormer	sally beauty supply joplin mo	craigslist cities	coldwell banker	recipe for buffalo chicken pizza sauce	jason ford site hometown.aol.com	ottoman govenor	want ad digest	aventura mall florida	singer anderson of jethro tull	american idol	walk away by kelly clarkson	hydrocodone addiction	msa instrument division	part b intermediary letter 70-2	haiti baeches	business brokers in virginia	md jobsite	fl lottery	pulmonary hypertension	forbes business brokers	wickes lumber	online bible	fidelity contra fund	ambulance service in ma	what state was the pledge flmed in	wives xxx pics free	tweenie pix	balloon centerpieces	avian flu goggles	dr. mccool	what state was the pledge filmed in	6 bristol court little rock	the funny bone springfield il.	stck em	basset hound rescue fl.	car partsfor dodge caravan	herman hospital	health insurance that covers pregnancy	stupid george bush	jarkey games	basset hound	ohio revised code	td waterhouse	www.myecount.com toyota	most beautiful males	www.dineey chanel.com	grocery store	three dat diet	douglas h cohen podiatrist	eminem lyrics	earned income credit	yellow pages	teddy geiger	don anddonnas adventureyes	eye twitching	ky lottery	customersatisfaction baltsun com	onolulu star bulletin	landstaronline com	lamps r us	creole restaurant and jazz	www.hotbars games.com	yellow book	voyeur web	birnbaum and glucksman	dallas news	sharon rexroad	mn state lottery	suicide bomber	mark jacskon realty east tennessee land	700 club	autopsy photos in oklahoma	jericho post office	french dressing sleepwear collection	pennsauken country ckub	dodge srt-4 quarter mile time	night drive all american rejects	cheapest baseball bats on enternet	emory university height study	bats mosquito control	john aravosis	nj pick 3 lottery	tax forms detroit	posion bamd	jenny from the block	laptops new orleans	electronic plans	feel good inc.	electronic mice trap	how much to charge for services	dark hunters fanfiction	bernard d. naber & 1833	beauti control consultant	eaw la speaker models	expensive escorts	internal revenue service	popping my collar	whats new on aol	kelly clarkson	in-wall doggie door	degas work la classe de	columbus zoo	skirted swimsuit	degas work la classe da	spanish festival	marazzi tile	softsheen carson	autposy photo's in oklahoma	select comfort	james blunt goodbye my lover	flava flav	craftsman lathes	tattoo designs	nj transit	dl chronicles	michigan lake front homes for sale	ymca middletown ohio	criminal law and business	miami happenings	pit bulls	mei tai carrier	colligate fabric	calvary christian academy dover	upper 20milford 20township	upper 20milford 20township pa	laser quest in ft. lauderdale	barefoot dances	norwalk la mirada school district	massey yellow paint	plumbing distrubitor 667 south street reading pa	www.service pro parts .com	premiere trader	astronaut crippen cap	dr. mccoul	ryan sweers davison	southland mall taylor	yankee staduim.com	recreation management magazines	jenny fron the block	nathans hot dogs	metro pcs	free tetris game	brightstar kennel	j. k. rowling pics	nissan armade push bar	altoffer farm equipment	what a girl wants lyrics	transfer letters	prince tennis rackets	yankee stadium	ebay registation	frozen goatmeat	city of villans	pratt institute	chase bank.com	tile stores	michigan colleges	hostage negotiation training new york state	recipes to lower cholesterol	5point credit union	cheesecake recipes	vintage 80's tees	it was named for the infant jesus	night drive	stacey kiebler	mackie products	lateral filing cabinet	ford oil cooler	movies guys jerking	recreation magazines	rhumitoid arthritis	catholic war veterans	florida lottery	wheels & deals	firstgear venom jacket	bridgeport harley	mt rushmore sd	free nextel games downloads	cas and far	supreme school supply	hair loss	marc antony's love	ken burns nude pictures	african american hair salons minnesota	adventure elf	melvin morse	walmart products	copper distrubitor 667 south street reading pa	mariott hotel	putnams history magazine	the hangman's beautiful daughter	tax liability while worked in iraq	welcome 20screen	full armor of god	list all rentals car	ulrich ehrentraut	joan almedilla	idaho real estate listings	im sprung	arapahoe county registered sex offenders	http www.rootsweb.com nydelawa	road runner cartoons	bed and breakfast fort william scotland	ata 100	restaurants in shreveport louisiana	poison band	teens pussy gallery	college of the siskayous	hindu dietary considerations	teens pussy gallert	prudential clear water realty washinton nc	kentucky marshall county sheriff department control frequency	trump casino	meriam johson	46 news atlanta.	new york knicks dance team audition 2006	toni love in bloom american character	pathway ambulance in ma	free baby things	grendel and beowulf	baby 20banz	google.c om	beautyrest mattress	espresso rub	firefly cell phones	honolulu star bulletin	st john collection	free slots	indo iranian language	goodwill thrift store tulsa	simple wills	serpent staff medical	meadows rv park	jane heller	dip set	mark jacskon realty tennessee land	reverend bob brannon tennessee	emory university growth study	jimmy swaggart	jamba juice modesto	barry white music	chase bank in chicago	gordon setter - akc description	crystal meth	pathway ambulance milford ma	real estate school	aol games	anniversary invitations	balloon decorating strip instructions	www.hbo sports.com	bernard diedrick naber & 1833	lenox cipresso	bob and doug mckenzie	seminole high school	girl friend	tile paint	bells amusement park in tulsa	www.girlsgone wild.com	rhoda holmes nicholls	don anddonnas adventure	how media violence effects children	12 steps	california public utilities commission	last living souls	recreation veterans	origami dog	synthetic oils	calvary assemby of god dover school	employee advantage program carefirst	david's episcopal church in northwest washington	wooster daily record	escalade stretch limos	altorfer farm equipment	plumbago white	fsu student directory	ford 302 oil cooler	lace curtains	savemart modesto	summit mall	american standard	busch gardens of tampa	crazy frog	acid reflux air bubble chest	houses for sale in castle rock	babes thegoose	ken burns model	stone bunny of atlanta georgia	google maps	barefoot dates	zoom advertising chicago	tabernacle church salem ma	marazzi tile retail stores	black booty	henrico north rotary club	tegeler & bauer iowa	softsheen carson step 1 breakthru shampoo	sheet music	maternity insurance	come back lines	che pasta in aventura mall florida	http; www.aaa.com racephoto	www sees com.	rescueheroes com	helzberg diamonds	clearwater hotels	www voyeure.com	....tzu dog	coach coupon	barrington library	fox wallpaper mural	marazzi tile stores in philadelphia pennsylvania area	ryan sweers	ncaa champions official shirt	sabrina eisenberg	song colorado	the avenue	all children's hospital st petersburg florida	allman brothers band	calvary christian school dover	bump on her lip	www. anime corner store.com	myspace contact tables	joggers hit on pch	where is 617-962	banta genealogy	national criminal	aint that funny	food network	emile henry pitcher white	jean dodds	1035 aberdeen mundelein il	chris brown website	t pain	alice hide hospital	basil matthews elmore abbey	hotel des saints-peres	north mississippi hospital	funny bonz springfield il.	fire fly cell phones	travel smith bereley ca	e-business only	sharyn mccrumb	masters golf	card center chico ca	ll bean	ga unclaimed funds	bcbg shirt	exercise equipment	united healthcare	lane bryant catalog	radio shack	scottish costumes	us bank.com	bayou wildlife park	pogo games	cms cr 3625	http dl chronicleshttp viewmorepics.myspace.com index.cfm fuseaction viewimage&friendid 36442971&imageid 295233571&mytoken 1587fca8-fe87-441a-b05e-bf404f9dbce6	state of new york municipal police training council	old navy stores	chicago 20suntimes 20newpaper	free stuff to do in colorado	tennessee lottery	facial twitching	fall out boy downloads	atl soundtrack	anniversay verses	valerie parhill	take swelling down	williamsville ny	harley davidson dealers michigan	castaic brick	rishi tea organic earl grey	walk away lircks	ohio administrative code	kyocera kx2 sim card removal	colorado real estate school	nissan armada 2005 in long island	studying sheets for the north carolina ged test	azera sweepstakes	brian doyle	tide water real estate belhaven nc	ismn m-2034-2931-9	special education in utah	teaching jobs at ramstein	irc section 911	seder dinner	mx ga	the summit hotel	the grand rapids press	jvc mini camcorder	venting pipes for pellet stoves and specifications	maricopa az	www.wenig stocks.com	journey tickets	kresson golf course	barefoot walking	tern exporters.com	california public utilities comission	pointer sisters posters	waldenwoods resort	me and my girl friend	berri berri disease	rasta's messiah	vic 20theatre	nissan armade in long island	april 8 two joggers were hit by a car the fled the scene	mens underwear	vidal sassoon in miami	united states map	kyocera kx2 sim card	logan airport	james blunt	rebecca frances scottie band	usi retirement	online games for kids	don and donnas adventure	home prices in hurlock maryland	www yahoo com	taxes software	stack em sock em	gay actors	stalnaker wrestling	bright star setters	oem sales	georgia lotterywinnforlife	bird store in chester njchester bird store in	colors of rainbow	free nextel games	dress up games	www.myspace .com	custrsatisfaction baltsuncom	spiritual warfare	phoenix first assembly	hancocks fabrics	park city lift tickets	medical supplies oakland ca	wallpaper special.com	gardens danbury	want ad digwst	home listings in hurlock maryland	how to check email addresses on old site	gordon setter - official description	montclair plaza	fivepoint credit union	breakthru shampoo	sierra glass tile	palm tree photos	wewstern michigan university	tweenie sex	civil war clubs illinois	tau datiatos	epic theaters in hendersonville	fairchild gardens	alert ambulance in ma	delta airlines	max broock	vent pipe for pellet stoves and walkways	beth moore	how to borrow money to pay a creditor who has sued you	university of richmond	freeport maine	flava flav sound files	department of motor vehicles new york	clothes for charity	ground cover ivy for brownfield maine	wv lottery	jimmy swagert	eaw speaker models	sand shark	omaha steaks	listen to wwe entrance theme songs	nissan armada 2005 used in long island	www.advanced auto.com	prince titanium alloy	destination in the movie dumb and dumber	ela library	social sercurity	jobs at ramstein afb	post your beaver	beth more	sos- rihanna lyrics	west chicago school district 33	ny state map	old well pump houses	findrive 400 gps	walk away lyrics	www.hersheys crafts	ft mohave az	metropolitan jewish hospice	american diabetes assn	buffalo blast	three 6 mafia	https mypay.dfas.mil	princeton theological seminary	anniversary sayings	picture of a suicide bomber	aol news quiz	memphis triple drive in	what proceducer to follow after you receive a summon letteer	hoggle zoo	hec wood lathe	child woke up with a swolen lip	feeding schedule for babies	wilmington delaware	optimum care products local stores products	charlestown races and slots	nissan armada push bar	where to buy the e200 generator	hotchickenpiza sauceonly	falmouth country club cape cod	emerald isle real estate	windows 98se	discount lateral filing cabinet free shipping	beauti control consultant fenton mo	men's health	music of the night	ccsd 33	easter egg hunt williamsville ny	ata 133 definition	windmill houses	alll inclusive resorts	big book	tabernacle church cemetery salem ma	dr. mckoul	asia art	astos threads	gay actors famous	valarie parhill	movie the pledge filmed in	pictures for my space	turbo tax	hip dont lie	jamerson road marietta ga	federal tax table	louies vuitton hand bags	new york and company clothing	cwf clinical studies	craigslist denver	orlando vacation	doll war	jobs with pathway ambulance in ma	queen size bed measurements	how do i apply .sppf	quicken taxes	new york copropate jet	prudential clearwater realty washington nc	www.skate board.com	social security	marazzi tile stores in philadelphia	customersatisfaction baltsuncom	aol sure	the distillers	barefoot activities	sheet measurements	a small suite by peter lamb	aptos threads	walk away-kelly clarkson lyrics	http www.kennelclubof yorkville.org	pennsauken country club	dell xps 400 review	loewell theaters danbury	london lace	henrico north rotary newsletter	cresent golf course	state beauty supply joplin mo	cincinnati zoo	multiple listings	ohio high school wrestling state champions	the nadas	buffalo news	french connection sleepwear collection	save mart modesto	navy seal workout	rv parks branson missouri	coolidge dam river	pleasant hill park and recreation softball league	serpent cross medical	jennifer lopez web sites	henrico north rotary club highllights	ryan sweers swartz creek	maggie scarf	currior post.com	fall out boy free downloads	pussycat dolls	telephone prefixes	new york state commission of correction	http a bola .pt	frozen rhubarb pie	austin texas hydrilics	cypress log	travelsmith berkeley ca	www .soccer.com	ecce homo utterer	the story of easter and the bunny and eggs	toni love in bloom	bryte star setters	unclaimed money	power ball	chocolate rose kisses	how can i get rid of dandelions on my lawn	gelavia coffee	global personality test	greg havens	corvette crashes into truck	www.eteamz.com greenbrier	cher . com	kelly black book	crowne plaza resort hilton head sc	holiday inn	marriott hotels	chris brown concert dates	advance auto	college of the siskiyous	viral menegitiss	sean cody.com	principle of original horizontality apply to what rocks	windows xp sp1 crack	jaime pressley	dicks sporting goods	pennsbury school district	gateway donations	crate and print birthday cards for free	bayshore medical center	babka baking pans	gulf south transportation	alaska air	berri berri diseas	alley oops girlfriend	you really are out of your fucking mind	brightstar kennels	jim crammer	wicked weasel	wwww.citibank com	cresent golf	tax form 8863	tanning cleveland park	river pollution	pa lottery	better homes and gardens	black sex link chickens	california. desert resort rv campground	used wood working lathes	sprinklers nassau long island	autopsy photos	recital music publishers	chocowinty nc camp grounds	tera plain city	italian easter recipes	blah blah blah lyrics blivins	derek allen doa	young crippen cap	jobs wih pathway ambulance in ma	used motor scooters	crippen cap	haiti image	sr20det o2 sensors	www.vres.us strsoh.html	six flags atlanta	going on barefoot date	tax liabulity while worked in iraq	w.c. fields affirmative	easter egg hunt	how do guys treat yeast infections	intermediary letter 70	area code lookup	the muses	cute is what we aim for downloads	cookie delivery companys tallahassee fl	babka pans	shawnee county kansas	life insurance	melodies of the old masters book 2	m and t bank	after getting my braces off	studying for the north carolina ged test	edith wharton and lands end	thick chicks	pearl river wildlife refuge	university of redlands	buy babka bakeware	bird store in chester nj	florida lotto	bowen center warsaw indiana	wood lathes	cheap wrinke cream	park city sporting goods	car rentals	orange county public schools	elmore abbey	talk master	free mahjongg downloads	michigan and summer vacations	pleasant hill park and recreation soft league	strange brew	jc penneys	sally beauty supply	www.goat meat.com	you're beautiful	stamford visitors information	46 newsatlanta.com	north community bank in chicago	nissan armada in long island	adobe photoshop	royal plaza hotel orlando	kobe ti	armand bayou wildlife park	the cattlemans steakhouse fort worth	ncaa official shirt	exploited black teens	free entertainment in denver	early warning radar detector	income earned in iraq	federal tax forms	disney vero beach resort	serpent medical insignia	margaret brannon clarksville tennessee	hearth records phoenix az	pop singer lavigne	michigan bulb company	wives xxx	sexy games	whitney lake ne	yevtushenko poem	united airlines	track your teenager	plastic surgery financing	mckoul pediatrics	hernando county florida	broome county	arabic dvd	traditional bread dressing	western union	ibsen hedda	beauticontrol consultant fenton mo
3964524	club crawl	map of club crawl tucson
7829	collect coins	one cents for sale	rak skory	one cent collect
1475077	organize old photos	barnes and noble
41557	start jogging	survivor lumberjill
