1355608	buy whole sale	we do drop shipments
1147817	sell an idea	sell an food idea
714436	become a cell phone dealer	open a cell phone store
2398715	live for jesus	community living	community living jesus love
1254530	get married in hawaii	hawaii visitors and conventions bureau	top rated wedding planner in kauai hawaii	kauai hawaii	hawaii vistors and conventions bureau
1020624	make-your-own game	pretty princess
215182	acid stain concrete	acid stain	concrete acid stain	tangerine acid stain	tangerine concrete acid stain
550068	create a code	create a code for a song
5590453	build your own wine rack	wine rack out of cabinet	pot rack
